"","X","LIST.ID","EDCS.ID","EDH.ID","not_before","not_after","transcription","clean_text_interpretive_word","type_of_inscription_clean","type_of_inscription_auto","type_of_monument_clean","province","province_label_clean","place","findspot_ancient_clean","findspot_modern_clean","status_notation","Latitude","Longitude","count"
"1",6735,475194,"EDCS-28400166","HD060146",-31,9,"L(ucius) Fadienus L(uci) f(ilius) Pomp(tina) / Fuscus dom(o) Dert(ona) / vet(eranus) speculator v(ivus) f(ecit) sibi / et Camuriae Pollae uxori / L(ucio) Fadieno patri Vibiae Primae matri / Fadienae Pollae sorori Fadieno / Tertio fratri signifero leg(ionis) X&lt;I=V&gt;III g(eminae) / suisque omnibus ossibus infer(re) / in fr(onte) p(edes) XV in agr(o) p(edes) XXXI ","Lucius Fadienus Luci filius Pomptina Fuscus domo Dertona veteranus speculator vivus fecit sibi et Camuriae Pollae uxori Lucio Fadieno patri Vibiae Primae matri Fadienae Pollae sorori Fadieno Tertio fratri signifero legionis X lt I gt III geminae suis que omnibus ossibus inferre in fronte pedes XV in agro pedes XXXI","epitaph","epitaph","NULL","Dalmatia","Dalmatia","Zadar / Iader","Iader","Zadar","milites, mulieres, tria nomina, viri",44.115501,15.223778,1
"2",1178,469141,"EDCS-28300165","HD061408",-20,9,"Sal(vius) Frebranus T(iti) f(ilius) / Quir(ina) Baculus has(tatus) / pri(or) leg(ionis) XX","Salvius Frebranus Titi filius Quirina Baculus hastatus prior legionis XX","epitaph","epitaph","NULL","Dalmatia","Dalmatia","Ivosevci / Burnum","Burnum","Kistanje","milites, tria nomina, viri",44.0317,15.9936,1
"3",1860,469846,"EDCS-08900515","HD005973",-30,14,"Marc(us) Octa[v]/ius [Mar]c(i) f(ilius) V/[---]nus","Marcus Octavius Marci filius V nus","epitaph","epitaph","stele","Dalmatia","Dalmatia","Nadin / Nedinum","Nedinum","Benkovac","viri",44.0721,15.5095,1
"4",7104,108927,"EDCS-78400014",NA,-27,14,NA,"Aninia Marci filia Saturnina",NA,"epitaph",NA,"Dalmatia",NA,"Vid / Narona",NA,NA,"mulieres, tria nomina",43.0804139,17.6258524,1
"5",873,468825,"EDCS-67300052","HD056132",-30,30,"[---] C(ai) f(ilius) / [---] Arne(nsis) / [--- a]n(norum) L et [------ // Satu[rnin-? ---] / Sen[eca? --- A?]/rne(nsis?) [---] / S[---] / [------","Cai filius Arnensis annorum L et Saturnin Seneca Arnensis S","epitaph","epitaph","NULL","Dalmatia","Dalmatia","Glamoc / Municipium Salvium","Municipium Salvium","Glamoč","viri",44.1301,16.8281,1
"6",1105,469063,"EDCS-30101161","HD045055",21,30,"Q(uintus) Valerius / Q(uinti) f(ilius) Qui(rina) dom(o) / Icon(io) vet(eranus) leg(ionis) / VII an(norum) LV stip(endiorum) / XXVIII h(ic) s(itus) e(st) / Q(uintus) Portorius et Q(uintus) Va/lerius Anteros posuer(unt)","Quintus Valerius Quinti filius Quirina domo Iconio veteranus legionis VII annorum LV stipendiorum XXVIII hic situs est Quintus Portorius et Quintus Valerius Anteros posuerunt","epitaph","epitaph","stele","Dalmatia","Dalmatia","Hardomilje / Bigeste","Bigeste","Ljubuški","milites, praenomen et nomen, tria nomina, viri",43.1818,17.5271,1
"7",78,468002,"EDCS-20601175","HD004491",14,37,"------](?) / L(ucius) Luc[---](?) / C(ai) f(ilius) Prim[us] / vete(ranus) leg(ionis) / XV Apolli/naris / h(ic) s(itus) e(st) // t(estamento) f(ieri) i(ussit)","Lucius Luc Cai filius Primus veteranus legionis XV Apollinaris hic situs est testamento fieri iussit","epitaph","epitaph","stele","Dalmatia","Dalmatia","Bigeste","Bigeste","Ljubuški","milites, tria nomina, viri",43.1818,17.5271,1
"8",807,468759,"EDCS-28300043","HD058891",14,37,"M(arcus) Vireius T(iti) [f(ilius)] Celer Leo domo / Augusta Ba[g]ie[n(norum)] donatus a / Tib(erio) C(a)esare tor(quibus) armillis fale[ris](!)","Marcus Vireius Titi filius Celer Leo domo Augusta Bagiennorum donatus a Tiberio Caesare torquibus armillis faleris","epitaph","epitaph","NULL","Dalmatia","Dalmatia","Gardun / Tilurium","Tilurium","Trilj","Augusti/Augustae, tria nomina, viri",43.6139,16.689,1
"9",1750,469728,"EDCS-08901077","HD004479",14,37,"L(ucius) Gavius L(uci) f(ilius) Pub(lilia) Ve/rona vet(eranus) leg(ionis) XV se / vivo fecit / et M(arco) Gavio fratri / et liberto Hilaro","Lucius Gavius Luci filius Publilia Verona veteranus legionis XV se vivo fecit et Marco Gavio fratri et liberto Hilaro","epitaph","epitaph","tabula","Dalmatia","Dalmatia","Ljubuski / Mlade / Bigeste","Bigeste","Ljubuški","liberti/libertae, milites, nomen singulare, praenomen et nomen, viri",43.1818,17.5271,1
"10",799,468751,"EDCS-28300036","HD058819",1,41,"Cn(aeus) Domiti/us Cn(aei) f(ilius) Vel(ina) / Pessinunte / an(norum) XLIV stip(endiorum) / XXV veteran(us) / [ex leg(ione) VII h(ic) s(itus) e(st)] / [testam]en[to] / [fieri] iussit","Cnaeus Domitius Cnaei filius Velina Pessinunte annorum XLIV stipendiorum XXV veteranus ex legione VII hic situs est testamento fieri iussit","epitaph","epitaph","stele","Dalmatia","Dalmatia","Gardun / Tilurium","Tilurium","Trilj","milites, tria nomina, viri",43.6139,16.689,1
"11",1734,469712,"EDCS-30600566","HD058381",1,41,"L(ucius) Herenni/us L(uci) f(ilius) Pap(iria) / Muliade(!) / vet(eranus) leg(ionis) VII / an(norum) LX sti(pendiorum) / XXX h(ic) s(itus) e(st)","Lucius Herennius Luci filius Papiria Muliade veteranus legionis VII annorum LX stipendiorum XXX hic situs est","epitaph","epitaph","cliff","Dalmatia","Dalmatia","Ljubuski / Mlade / Bigeste","Bigeste","Ljubuški, bei","milites, praenomen et nomen, viri",43.1818,17.5271,1
"12",1741,469719,"EDCS-31900305","HD058380",1,41,"L(ucius) Domitius L(uci) f(ilius) Ann(iensi) / Aquila vet(eranus) leg(ionis) VII / domo Myliada(!) / stip(endiorum) XXXIII vi(vus) fe[cit] sib(i) / et C(aio) Domitio [---] An(iensi) / [A]qui[l]ino(?) mil(iti) [l]eg(ionis) V[II] / [s]tip(endiorum) XX h(onesta) m(issione) [---] / [------] / [------] / [---]A[---] / [---]V[---]","Lucius Domitius Luci filius Anniensi Aquila veteranus legionis VII domo Myliada stipendiorum XXXIII vivus fecit sibi et Caio Domitio Aniensi Aquilino militi legionis VII stipendiorum XX honesta missione A V","epitaph","epitaph","cliff","Dalmatia","Dalmatia","Ljubuski / Mlade / Bigeste","Bigeste","Ljubuški","milites, tria nomina, viri",43.1818,17.5271,1
"13",6224,474671,"EDCS-10100892","HD034294",1,41,"C(aius) Iulius C(ai) f(ilius) / Fab(ia) Ninica / mil(es) leg(ionis) VII / an(norum) XXXIX stip(endiorum) / XVII h(ic) s(itus) e(st) / hospes resis[te et] tumulum / contempla meum lege et / moraris iam scies quae / debeas vixi qua potui ca/rus sum Opiorum hic su/m sepultus hic ossua(!) re/quiescum(!) mea vale et / bene facito vitae dum fa/tum venit / Faustus l(ibertus) patrono","Caius Iulius Cai filius Fabia Ninica miles legionis VII annorum XXXIX stipendiorum XVII hic situs est hospes resiste et tumulum contempla meum lege et moraris iam scies quae debeas vixi qua potui carus sum Opiorum hic sum sepultus hic ossua requiescum mea vale et bene facito vitae dum fatum venit Faustus libertus patrono","epitaph","epitaph","stele","Dalmatia","Dalmatia","Trilj / Tilurium","Tilurium","Trilj","liberti/libertae, milites, nomen singulare, tria nomina, viri",43.6139,16.689,1
"14",6230,474677,"EDCS-03300743","HD040156",1,41,"L(ucius) Attius L(uci) f(ilius) Sergi(a) / Augusta / an(norum) XXX st(ipendiorum) VIII / mil(es) leg(ionis) VII / h(ic) s(itus) es(t)","Lucius Attius Luci filius Sergia Augusta annorum XXX stipendiorum VIII miles legionis VII hic situs est","epitaph","epitaph","stele","Dalmatia","Dalmatia","Trilj / Tilurium","Tilurium","Trilj","milites, praenomen et nomen, viri",43.6139,16.689,1
"15",6391,474843,"EDCS-26600673","HD051071",1,41,"M(arcus) Heredius M(arci) f(ilius) Pal(atina) / veteranus leg(ionis) VII / h(ic) s(itus) est fecit / Faustus l(ibertus)","Marcus Heredius Marci filius Palatina veteranus legionis VII hic situs est fecit Faustus libertus","epitaph","epitaph","stele","Dalmatia","Dalmatia","Vid / Narona","Narona","Metković","liberti/libertae, milites, nomen singulare, praenomen et nomen, viri",43.0801,17.625,1
"16",6621,475080,"EDCS-14800171","HD039866",1,41,"L(ucius) Ancharenus Q(uinti) f(ilius) / Ser(gia) Laranda mil(es) / leg(ionis) VII ann(orum) XL stip(endiorum) XXI / h(ic) s(itus) e(st) / Q(uintus) Ancharenus haec tan[---?] / posuit tibi dona frater quia / longe a patria te cecidisse dolet / optaram vivo potius dare vi[na] / [---] non obito care ferenda / tuo si quicquam sentire potes / [---]mpore nostro damus haec / o[---] sit tibi terra levis frater / fratri posuit","Lucius Ancharenus Quinti filius Sergia Laranda miles legionis VII annorum XL stipendiorum XXI hic situs est Quintus Ancharenus haec tan posuit tibi dona frater quia longe a patria te cecidisse dolet optaram vivo potius dare vina non obito care ferenda tuo si quicquam sentire potes mpore nostro damus haec o sit tibi terra levis frater fratri posuit","epitaph","epitaph","stele","Dalmatia","Dalmatia","Vojnic Sinjski / Tilurium","Tilurium","Trilj","milites, praenomen et nomen, tria nomina, viri",43.6139,16.689,1
"17",6734,475193,"EDCS-28400165","HD060145",1,41,"T(ito) (H)elvio Sca(ptia) Marino / IIIIvir(o) Altini / T(itus) (H)elvius T(iti) f(ilius) Salinator / |(centurio) leg(ionis) VII patri / in fronte p(edes) XXX in agro p(edes) XXX / h(oc) m(onumentum) h(eredem) n(on) s(equetur)","Tito Helvio Scaptia Marino IIII viro Altini Titus Helvius Titi filius Salinator centurio legionis VII patri in fronte pedes XXX in agro pedes XXX hoc monumentum heredem non sequetur","epitaph","epitaph","NULL","Dalmatia","Dalmatia","Zadar / Iader","Iader","Zadar","milites, ordo decurionum, tria nomina, viri",44.115501,15.223778,1
"18",7018,107221,"EDCS-69000085",NA,6,41,NA,"us uri filius eques alae Hispanorum Batavus",NA,"epitaph",NA,"Dalmatia",NA,"Ivosevci / Burnum",NA,NA,"milites, viri",44.0160408,16.0072244,1
"19",288,468218,"EDCS-30200434","HD031512",1,42,"M(arcus) Domitius / M(arci) f(ilius) Fabia Sev/erus Brixsia(!) / miles leg(ionis) XI / ann(orum) XXX / stip(endiorum) VIII h(ic) s(itus) e(st) / heres posuit","Marcus Domitius Marci filius Fabia Severus Brixsia miles legionis XI annorum XXX stipendiorum VIII hic situs est heres posuit","epitaph","epitaph","stele","Dalmatia","Dalmatia","Burnum","Burnum","Kistanje","milites, tria nomina, viri",44.0317,15.9936,1
"20",822,468774,"EDCS-30100406","HD054439",1,42,"C(aius) Longin(i)us C(ai) f(ilius) / Cor(nelia) Amblada / mil(es) leg(ionis) VII an(norum) XL / stip(endiorum) XXI h(ic) s(itus) e(st) / frater fratri","Caius Longinius Cai filius Cornelia Amblada miles legionis VII annorum XL stipendiorum XXI hic situs est frater fratri","epitaph","epitaph","stele","Dalmatia","Dalmatia","Gardun / Tilurium","Tilurium","Trilj","milites, praenomen et nomen, viri",43.6139,16.689,1
"21",1089,469047,"EDCS-10100864","HD034239",1,42,"M(arcus) Livius M(arci) f(ilius) Pal(atina) dom(o) Aloro veteranus leg(ionis) VII an(norum) L stip(endiorum) XXVI h(ic) s(itus) e(st) t(estamento) f(ieri) i(ussit)","Marcus Livius Marci filius Palatina domo Aloro veteranus legionis VII annorum L stipendiorum XXVI hic situs est testamento fieri iussit","epitaph","epitaph","stele","Dalmatia","Dalmatia","Hardomilje / Bigeste","Bigeste","Ljubuški","milites, tria nomina, viri",43.1818,17.5271,1
"22",1090,469048,"EDCS-10100865","HD034241",1,42,"T(itus) Varius T(iti) f(ilius) / Vel(ina) domo / Pessinunte / vet(eranus) leg(ionis) VII / an(norum) L sti(pendiorum) XXIX / h(ic) s(itus) e(st) her(es) pos(uit)","Titus Varius Titi filius Velina domo Pessinunte veteranus legionis VII annorum L stipendiorum XXIX hic situs est heres posuit","epitaph","epitaph","stele","Dalmatia","Dalmatia","Hardomilje / Bigeste","Bigeste","Ljubuški","praenomen et nomen, viri",43.1818,17.5271,1
"23",6231,474678,"EDCS-03300744","HD040157",1,42,"L(ucius) Mummius L(uci) / f(ilius) Fab(ia) Ancyra / miles leg(ionis) VII / ann(orum) XXXVI / stipend(iorum) XVI / h(ic) s(itus) e(st) // Arma bis octonis felicia qui tulit annis / hic situs est fato Mummius ipse suo / si sapiunt obiti data munera percipis am(pla) / et recipis nostrae pignus amicitiae / hoc tibi cum titulo posuit Cornelius Chrestus / et dixit lachrymans(!) sit tibi ter(r)a levis // M(arcus) Cornelius M(arci) l(ibertus) / Chrestus pos(u)it","Lucius Mummius Luci filius Fabia Ancyra miles legionis VII annorum XXXVI stipendiorum XVI hic situs est Arma bis octonis felicia qui tulit annis hic situs est fato Mummius ipse suo si sapiunt obiti data munera percipis ampla et recipis nostrae pignus amicitiae hoc tibi cum titulo posuit Cornelius Chrestus et dixit lachrymans sit tibi terra levis Marcus Cornelius Marci libertus Chrestus posuit","epitaph","epitaph","stele","Dalmatia","Dalmatia","Trilj / Tilurium","Tilurium","Trilj","liberti/libertae, milites, nomen singulare, praenomen et nomen, tria nomina, viri",43.6139,16.689,1
"24",845,468797,"EDCS-16900021","HD028177",9,42,"Q(uintus) Marcius / Q(uinti) f(ilius) Cor(nelia) Bassus / dom(o) Benevento / mil(es) leg(ionis) VII an(norum) / [---] stip(endiorum) XVII / [h(ic) s(itus)] e(st) t(estamento) f(ieri) i(ussit) / [ex arb]itratu / [M]aximi","Quintus Marcius Quinti filius Cornelia Bassus domo Benevento miles legionis VII annorum stipendiorum XVII hic situs est testamento fieri iussit ex arbitratu Maximi","epitaph","epitaph","stele","Dalmatia","Dalmatia","Gardun / Tilurium","Tilurium","Trilj","milites, nomen singulare, tria nomina, viri",43.6139,16.689,1
"25",1177,469140,"EDCS-28300164","HD058166",9,42,"T(itus) Cominius / C(ai) f(ilius) R[o]milia / Ateste miles / leg(ionis) XI anno/rum XL stip(endiorum) XVI / h(ic) s(itus) e(st) frat[e]r / fratri posuit / vixsi(!) quoad potui sem/per bene pauper honeste / [fr]audavi nullum nunc iuvat / [os]sa mea","Titus Cominius Cai filius Romilia Ateste miles legionis XI annorum XL stipendiorum XVI hic situs est frater fratri posuit vixsi quoad potui semper bene pauper honeste fraudavi nullum nunc iuvat ossa mea","epitaph","epitaph","tabula","Dalmatia","Dalmatia","Ivosevci / Burnum","Burnum","Kistanje","milites, tria nomina, viri",44.0317,15.9936,1
"26",1439,469412,"EDCS-30301406","HD058275",9,42,"------]IL(?) / [--- mil(---)] leg(ionis) XI / [tess]erar(i--) [---] / [---] corni/[culari-- ---?] / leg(ati) Aug(usti) / [---]I(?)PIO[------","IL mil legionis XI tesserari corniculari legati Augusti IPIO","epitaph","epitaph","tabula","Dalmatia","Dalmatia","Knin / Burnum","Ninia","Knin, bei","milites, viri",44.0408,16.1994,1
"27",2505,470507,"EDCS-30301392","HD061586",9,42,"M(arcus) Fraxsanius(!) Sex(ti) f(ilius) / Pol(lia) domo Regio Lepido / veteranus leg(ionis) XI eques / annorum XLIIII stipendiorum XXV donatus / phaleris torquibus / armillis h(ic) s(itus) e(st) / Primu(s) l(ibertus) pro meritis","Marcus Fraxsanius Sexti filius Pollia domo Regio Lepido veteranus legionis XI eques annorum XLIIII stipendiorum XXV donatus phaleris torquibus armillis hic situs est Primus libertus pro meritis","epitaph","epitaph","cliff","Dalmatia","Dalmatia","Roski slap","NULL","Skradin - Kistanje, zwischen","liberti/libertae, milites, nomen singulare, viri",43.8227,15.9208,1
"28",2698,470701,"EDCS-28300147","HD061590",9,42,"T(itus) Cillius / T(iti) f(ilius) Fab(ia) / domo Lara/nda vet(eranus) / leg(ionis) XI ann(orum) LXX / stipendioru(m) / [X?]XXIIX / [--]E[--]","Titus Cillius Titi filius Fabia domo Laranda veteranus legionis XI annorum LXX stipendiorum XXXIIX E","epitaph","epitaph","cliff","Dalmatia","Dalmatia","Skradin / Scardona","NULL","Skradin - Kistanje, zwischen","milites, praenomen et nomen, viri",43.8227,15.9208,1
"29",6846,475307,"EDCS-10000895","HD034498",-30,50,"------ ann(os)] / XIIII h(ic) s(itus) [e(st)] / L(ucius) Cominius [L(uci)? f(ilius)] / M(arcus) Magius M(arci) [f(ilius)] soceio(!) suo / fece[r]unt","annos XIIII hic situs est Lucius Cominius Luci filius Marcus Magius Marci filius soceio suo fecerunt","epitaph","epitaph","NULL","Dalmatia","Dalmatia","Zadar / Iader","Iader","Zadar","praenomen et nomen, viri",44.115501,15.223778,1
"30",56,467979,"EDCS-57200180","HD057596",1,50,"(H)elviae L(uci) f(iliae) / Maximillae / L(ucius) Cassius / p(osuit)","Helviae Luci filiae Maximillae Lucius Cassius posuit","epitaph","epitaph","NULL","Dalmatia","Dalmatia","Benkovac / Asseria","Asseria","Benkovac","mulieres, praenomen et nomen, tria nomina, viri",44.0103,15.6844,1
"31",290,468220,"EDCS-30200435","HD035403",1,50,"Remmo / Saeconis / f(ilius) mil(es) coh(ortis) I(?) / Mo[nt(anorum)] ann(orum) / [------","Remmo Saeconis filius miles cohortis I Montanorum annorum","epitaph","epitaph","stele","Dalmatia","Dalmatia","Burnum","Burnum","Kistanje","milites, nomen singulare, viri",44.0317,15.9936,1
"32",988,468941,"EDCS-30200139","HD021258",1,50,"------ mil(es) leg(ionis) eiusd]em / [--- fr]ater f(aciendum) c(uravit)","miles legionis eiusdem frater faciendum curavit","epitaph","epitaph","NULL","Dalmatia","Dalmatia","Gornji Muc / Andetrium","Andetrium","Muć","viri",43.6922,16.5206,1
"33",1091,469049,"EDCS-10100866","HD034242",1,50,"[Q(uinto)?] Caenio / Q(uinti) f(ilio) [e]q(uiti) coh(ortis) / [II]I Alpinoru[m] / [d]omo [V]e[l]au/[no] ann(orum) [---] / st[ip(endiorum)] XX[---] / [------","Quinto Caenio Quinti filio equiti cohortis III Alpinorum domo Velauno annorum stipendiorum XX","epitaph","epitaph","NULL","Dalmatia","Dalmatia","Hardomilje / Bigeste","Bigeste","Ljubuški","milites, viri",43.1818,17.5271,1
"34",1112,469070,"EDCS-51400004","HD065033",1,50,"L(ucius) Vettius M(arci) [f(ilius)] / Maec(ia) Secun[dus] / Libarn[a] vet(eranus) le[g(ionis)] / VII vivus [f]ecit s[ibi] / et Vettiae L(uci) f(iliae) Ver[ae] / et Vettiae L(uci) l(ibertae) S[---]","Lucius Vettius Marci filius Maecia Secundus Libarna veteranus legionis VII vivus fecit sibi et Vettiae Luci filiae Verae et Vettiae Luci libertae S","epitaph","epitaph","stele","Dalmatia","Dalmatia","Hrvace","Aequum","Hrvace","liberti/libertae, milites, mulieres, tria nomina, viri",43.7423,16.6547,1
"35",1231,469195,"EDCS-10000854","HD034391",1,50,"Heras Ennom/ai f(ilius) mil(es) c(oh)or(tis) II / Cyrr(hestarum) do(mo) Cyr(rh)o / ann(orum) L sti(pendiorum) XXII h(ic) s(itus) e(st) / [---]raeus Ab/emmi f(ilius) (h)er(es) pos(uit)","Heras Ennomai filius miles cohortis II Cyrrhestarum domo Cyrrho annorum L stipendiorum XXII hic situs est raeus Abemmi filius heres posuit","epitaph","epitaph","stele","Dalmatia","Dalmatia","Ivosevci / Burnum","Burnum","Kistanje","milites, nomen singulare, viri",44.0317,15.9936,1
"36",1236,469200,"EDCS-10000859","HD034394",1,50,"C(aius) Virius C(ai) l(ibertus) / Vitalis annor(um) / VI h(ic) s(itus) e(st) / C(aius) Virius et Neuma / mater posuere","Caius Virius Cai libertus Vitalis annorum VI hic situs est Caius Virius et Neuma mater posuere","epitaph","epitaph","stele","Dalmatia","Dalmatia","Ivosevci / Burnum","Burnum","Kistanje","liberti/libertae, mulieres, nomen singulare, praenomen et nomen, tria nomina, viri",44.0317,15.9936,1
"37",1251,469215,"EDCS-10101845","HD025912",1,50,"Dacnas / Apsaei f(ilius) / mil(es) coh(ortis) II / Cyrrhestaru(m) / dom(o) Berea / ann(orum) L stip(endiorum) XXIV / h(ic) s(itus) e(st)","Dacnas Apsaei filius miles cohortis II Cyrrhestarum domo Berea annorum L stipendiorum XXIV hic situs est","epitaph","epitaph","stele","Dalmatia","Dalmatia","Ivosevci / Burnum","Burnum","Kistanje","milites, nomen singulare, viri",44.0317,15.9936,1
"38",1942,469928,"EDCS-31200686","HD059929",1,50,"T(itus) Ap(p)ul(eius)","Titus Appuleius","epitaph","epitaph","urn","Dalmatia","Dalmatia","Nin / Aenona","Aenona","Nin","praenomen et nomen, viri",44.2435,15.1842,1
"39",2312,470310,"EDCS-10101861","HD035427",1,50,"L(ucio) Clodio / Q(uinti) f(ilio) / IIII","Lucio Clodio Quinti filio IIII","epitaph","epitaph","NULL","Dalmatia","Dalmatia","Podgrade / Asseria","Asseria","Benkovac","praenomen et nomen, viri",44.0103,15.6844,1
"40",2434,470435,"EDCS-30900101","HD057992",1,50,"P(ublio)(?) Octavio / [-] f(ilio) Serg(ia) / Certo dec(urioni) / P(ublius) Octaviu[s] / Placidus L(uci) f(ilius) / [fra]ter v(ivus) [f(ecit)]","Publio Octavio filio Sergia Certo decurioni Publius Octavius Placidus Luci filius frater vivus fecit","epitaph","epitaph","altar","Dalmatia","Dalmatia","Rab, Otok / Arba","Arba","Rab","ordo decurionum, tria nomina, viri",44.7565,14.7596,1
"41",2509,470511,"EDCS-57100061","HD034023",1,50,"Verzo / BB[--]A(?)I / nepos(?)","Verzo BB AI nepos","epitaph","epitaph","stele","Dalmatia","Dalmatia","Ruduse / Rudusa","Aequum","Sinj","viri",43.7423,16.6547,1
"42",2574,470577,"EDCS-09001558","HD003409",1,50,"Quarta / Livia / se viva / sibi fecit","Quarta Livia se viva sibi fecit","epitaph","epitaph","NULL","Dalmatia","Dalmatia","Senj / Segna / Zengg / Senia","Senia","Senj","mulieres, tria nomina",44.9931,14.902,1
"43",2603,470606,"EDCS-07400600","HD004506",1,50,"Paio Totius / Implant(i?) / filia Cuio","Paio Totius Implanti filia Cuio","epitaph","epitaph","stele","Dalmatia","Dalmatia","Sinj / Osinium","Aequum","Sinj","mulieres, nomen singulare, tria nomina, viri",43.7423,16.6547,1
"44",2604,470607,"EDCS-07400601","HD004089",1,50,"Daico Samuio Versoni(s) / filia an(n)orum III","Daico Samuio Versonis filia annorum III","epitaph","epitaph","stele","Dalmatia","Dalmatia","Sinj / Osinium","Aequum","Sinj","mulieres, nomen singulare, tria nomina, viri",43.7423,16.6547,1
"45",6223,474670,"EDCS-10100891","HD034293",1,50,"L(ucius) Fabius C(ai) f(ilius) / Serg(ia) Conana / ann(orum) XX[---] / h(ic) s(itus) [e(st)] / C(aius) Fabius pa[ter] / filio posuit","Lucius Fabius Cai filius Sergia Conana annorum XX hic situs est Caius Fabius pater filio posuit","epitaph","epitaph","stele","Dalmatia","Dalmatia","Trilj / Tilurium","Tilurium","Trilj","praenomen et nomen, tria nomina, viri",43.6139,16.689,1
"46",6340,474792,"EDCS-08900511","HD004165",1,50,"Pusil(l)a A/l(l)ia S(puri) f(ilia) / s(ita)","Pusilla Allia Spuri filia sita","epitaph","epitaph","stele","Dalmatia","Dalmatia","Vid / Narona","Narona","Metković","mulieres, tria nomina",43.0801,17.625,1
"47",6393,474845,"EDCS-26600674","HD051073",1,50,"Cn(aeus) Magius Cn(aei) f(ilius) / Palat(ina) veteranus / s(itus)","Cnaeus Magius Cnaei filius Palatina veteranus situs","epitaph","epitaph","NULL","Dalmatia","Dalmatia","Vid / Narona","Narona","Metković","milites, praenomen et nomen, viri",43.0801,17.625,1
"48",6396,474848,"EDCS-27500162","HD053445",1,50,"L(ucius) Riccius L(uci) f(ilius) Vel(ina) / Pessinunte ann(orum) LX vet(eranus) / Marcia Maxima uxor / L(ucius) Riccius L(uci) f(ilius) Valens / L(ucius) Riccius L(uci) f(ilius) Gallus / Riccia L(uci) [f(ilia)] Bulla / h(ic) s(iti) s(unt) / L(ucius) Atilius L(uci) f(ilius) Vel(ina) veter(anus) leg(ionis) VII / avunculo suo posuit et sibi","Lucius Riccius Luci filius Velina Pessinunte annorum LX veteranus Marcia Maxima uxor Lucius Riccius Luci filius Valens Lucius Riccius Luci filius Gallus Riccia Luci filia Bulla hic siti sunt Lucius Atilius Luci filius Velina veteranus legionis VII avunculo suo posuit et sibi","epitaph","epitaph","NULL","Dalmatia","Dalmatia","Vid / Narona","Narona","Čapljina","milites, mulieres, praenomen et nomen, viri",43.0645,17.6884,1
"49",6408,474860,"EDCS-26600678","HD051068",1,50,"C(aius) Catellius / C(ai) l(ibertus) Stab(i)l(i)[s] / C(aius) Catellius / C(ai) l(ibertus) Licinus / IIIIIIvir(i?) / t(estamento) f(ieri) i(usserunt)","Caius Catellius Cai libertus Stabilis Caius Catellius Cai libertus Licinus IIIIII viri testamento fieri iusserunt","epitaph","epitaph","stele","Dalmatia","Dalmatia","Vid / Narona","Narona","Metković","liberti/libertae, seviri Augustales, tria nomina, viri",43.0801,17.625,1
"50",6432,474884,"EDCS-26600640","HD050364",1,50,"[[------]] / C(ai) l(iberta) Fortu[nata] / an(norum) h(ic) s(ita) e(st) XIIX / si pietas prodest / &lt;c=Q&gt;uiquam vixisse / modeste vos precor / o Mane[s sit] mihi / terra lev[i]s / libertas [cui] olim fuerat / promissa e[s]t ante ditis sub / fatum venit [i]n arbitrium / vivite felices quibu[s] // est Fortuna superste[s] / spenque(!) meam oppress[i]t / fatus in Hiluricum(!) ","Cai liberta Fortunata annorum hic sita est XIIX si pietas prodest lt c gt uiquam vixisse modeste vos precor o Manes sit mihi terra levis libertas cui olim fuerat promissa est ante ditis sub fatum venit in arbitrium vivite felices quibus est Fortuna superstes spen que meam oppressit fatus in Hiluricum","epitaph","epitaph","stele","Dalmatia","Dalmatia","Vid / Narona","Narona","Metković","liberti/libertae, mulieres, tria nomina",43.0801,17.625,1
"51",6448,474900,"EDCS-26600646","HD050263",1,50,"L(ucius) Pomponiu[s] / Sp(uri) f(ilius) Longinu[s] / ex testamen(to) / s(itus)","Lucius Pomponius Spuri filius Longinus ex testamento situs","epitaph","epitaph","tabula","Dalmatia","Dalmatia","Vid / Narona","Narona","Metković","tria nomina, viri",43.0801,17.625,1
"52",6731,475190,"EDCS-28400162","HD060142",1,50,"C(aio) Allio T(iti) f(ilio) Fab(ia) Luc(o) / veter(ano) leg(ionis) XX / C(aio) Allio Prisco f(ilio) / ann(orum) X Allia C(ai) l(iberta) Mete / patrono et filio / viva b(e)ne merenti / in fronte p(edes) [X in agr(o)] p(edes) XVI / et C(aio) Allio Vi[tal]i fil[i]o","Caio Allio Titi filio Fabia Luco veterano legionis XX Caio Allio Prisco filio annorum X Allia Cai liberta Mete patrono et filio viva bene merenti in fronte pedes X in agro pedes XVI et Caio Allio Vitali filio","epitaph","epitaph","NULL","Dalmatia","Dalmatia","Zadar / Iader","Iader","Zadar","liberti/libertae, milites, mulieres, praenomen et nomen, tria nomina, viri",44.115501,15.223778,1
"53",6785,475244,"EDCS-28400218","HD060290",1,50,"------](?) / Aulo C(a)ecinae / Aulo / Caecin&lt;ae=O&gt; A(uli) &lt;f=P&gt;(ilio) / parenti / [------? ","Aulo Caecinae Aulo Caecin lt ae gt Auli lt f gt ilio parenti","epitaph","epitaph","NULL","Dalmatia","Dalmatia","Zadar / Iader","Iader","Zadar","praenomen et nomen, viri",44.115501,15.223778,1
