"","X","LIST.ID","EDCS.ID","EDH.ID","not_before","not_after","transcription","clean_text_interpretive_word","type_of_inscription_clean","type_of_inscription_auto","type_of_monument_clean","province","province_label_clean","place","findspot_ancient_clean","findspot_modern_clean","status_notation","Latitude","Longitude","count"
"227",2417,470418,"EDCS-30600026","HD061469",31,100,"Ti(berius) Claudius / Ti(beri) &lt;f=I&gt;(ilius) Quadrat[us] / Clau(dio) Aequo [--](?) / ann(orum) XXXV s[ibi et] / Pelsoniae [Ter]/tullae uxo[ri] / t(estamento) f(ieri) i(ussit) ","Tiberius Claudius Tiberi lt f gt ilius Quadratus Claudio Aequo annorum XXXV sibi et Pelsoniae Tertullae uxori testamento fieri iussit","epitaph","epitaph","NULL","Dalmatia","Dalmatia","Puljane / Pugliane / Burnum","NULL","Promina","mulieres, tria nomina, viri",43.9743322,16.032173,1
"228",6738,475197,"EDCS-28400169","HD060191",31,100,"C(aius) Trebius C(ai) [f(ilius)] Firmus / veteranus leg(ionis) XI / stipendiorum XXV annor(um) LXXX / A(---) O(---) V(---) F(---) F(---) D(---) S(---) E(---) M(---) Q(---) M(---) C(---) S(---)","Caius Trebius Cai filius Firmus veteranus legionis XI stipendiorum XXV annorum LXXX A O V F F D S E M Q M C S","epitaph","epitaph","NULL","Dalmatia","Dalmatia","Zadar / Iader","Iader","Zadar","milites, tria nomina, viri",44.115501,15.223778,1
"229",447,468389,"EDCS-30200126","HD061948",41,100,"[- Corn]elio Cl(audia) [---]/no Cornelia [---] / [--- p]atrono t(estamento) f(ieri) i(ussit) Corneli(i) [---] / [---] Verecundus Pudens [---] / [lib(erti)] et hered(es) P(ubli) Quinti Liciniani [---] / [ho?]c testamento reliquit col(oniae) C(laudiae) [Aeq(uensium)] / [H]S n(ummum) LX(milia) e[x c]uius reditu [---] / [------","Cornelio Claudia no Cornelia patrono testamento fieri iussit Cornelii Verecundus Pudens liberti et heredes Publi Quinti Liciniani hoc testamento reliquit coloniae Claudiae Aequensium HS nummum LXmilia ex cuius reditu","epitaph","epitaph","NULL","Dalmatia","Dalmatia","Citluk / Aequum","Aequum","Sinj","liberti/libertae, mulieres, tria nomina, viri",43.7423,16.6547,1
"230",84,468008,"EDCS-30000207","HD058592",42,100,"T(itus) Octavius T(iti) f(ilius) / Vel(ina) Hister vet(eranus) / leg(ionis) XI C(laudiae) p(iae) f(idelis) t(estamento) f(ieri) i(ussit) et / Acrini contuber/nali / in f(ronte) ped(es) X / in agr(o) ped(es) XI","Titus Octavius Titi filius Velina Hister veteranus legionis XI Claudiae piae fidelis testamento fieri iussit et Acrini contubernali in fronte pedes X in agro pedes XI","epitaph","epitaph","NULL","Dalmatia","Dalmatia","Bihac / Raetinium","Siculi","Kaštela","milites, nomen singulare, tria nomina, viri",43.5306,16.3004,1
"231",415,468356,"EDCS-28300058","HD005641",42,100,"Sex(tus) Iu[lius Sex(ti) f(ilius)] / Ani(ensis) Silva[nus Foro Iuli(i)] / summus c[urat(or) c(ivium) R(omanorum) prov(inciae) Dalm(atiae)] / suffragio [eorum factus ex cent(urione)] / leg(ionis) VII C(laudiae) p(iae) f(idelis) aed[ilis col(oniae) Claudiae Aequi ab] / ordine primus [post col(oniam) deduct(am) creatus] / IIIIvir i(ure) d(icundo) pont(ifex) [in col(onia) Salonitan(orum)] / in ag&lt;ro=CE&gt; p(edes) [--- in fronte p(edes) ---] / h(oc) s(epulcrum) h(eredem) [n(on) s(equetur)] ","Sextus Iulius Sexti filius Aniensis Silvanus Foro Iulii summus curator civium Romanorum provinciae Dalmatiae suffragio eorum factus ex centurione legionis VII Claudiae piae fidelis aedilis coloniae Claudiae Aequi ab ordine primus post coloniam deductam creatus IIII vir iure dicundo pontifex in colonia Salonitanorum in ag lt roE gt pedes in fronte pedes hoc sepulcrum heredem non sequetur","epitaph","epitaph","NULL","Dalmatia","Dalmatia","Citluk / Aequum","Aequum","Sinj","milites, ordo decurionum, tria nomina, viri",43.7423,16.6547,1
"232",464,468407,"EDCS-32700500","HD028366",42,100,"C(aius) Octavius / C(ai) f(ilius) Fabia Vital[i]s / domo Brixiae(!) / vet(eranus) leg(ionis) VII C(laudiae) p(iae) f(idelis) / h(ic) s(itus) e(st) / testamento f(ieri) i(ussit) / arbitratu Octavi/ae Secundaes(!) lib(ertae) / suae","Caius Octavius Cai filius Fabia Vitalis domo Brixiae veteranus legionis VII Claudiae piae fidelis hic situs est testamento fieri iussit arbitratu Octaviae Secundaes libertae suae","epitaph","epitaph","NULL","Dalmatia","Dalmatia","Citluk / Aequum","Aequum","Sinj","liberti/libertae, milites, mulieres, tria nomina, viri",43.7423,16.6547,1
"233",481,468424,"EDCS-10000760","HD034195",42,100,"M(arco) Caecilio / Saturni/no vet(erano) leg(ionis) XI / C(laudiae) p(iae) f(idelis) et / Viriae P(ubli) l(ibertae) / uxori [--] / [------","Marco Caecilio Saturnino veterano legionis XI Claudiae piae fidelis et Viriae Publi libertae uxori","epitaph","epitaph","tabula","Dalmatia","Dalmatia","Citluk / Aequum","NULL","Otok","liberti/libertae, milites, mulieres, praenomen et nomen, tria nomina, viri",43.7425382,16.6534966,1
"234",804,468756,"EDCS-28300041","HD062415",42,100,"M(arcus) Iulius M(arci) f(ilius) / Trernahensis / miles leg(ionis) VII C(laudiae) p(iae) f(idelis) / an(norum) XXXXV stip(endiorum) XX / M(arcus) Arruntius frater et / heres posuit / h(ic) s(itus) e(st)","Marcus Iulius Marci filius Trernahensis miles legionis VII Claudiae piae fidelis annorum XXXXV stipendiorum XX Marcus Arruntius frater et heres posuit hic situs est","epitaph","epitaph","NULL","Dalmatia","Dalmatia","Gardun / Tilurium","Tilurium","Trilj","milites, praenomen et nomen, viri",43.6139,16.689,1
"235",838,468790,"EDCS-31900029","HD058783",42,100,"Sex(tus) Clodius / C(?)(ai) f(ilius) Pub(lilia) Verona / mil(es) l[eg(ionis) VII C(laudia) p(ia)] f(idelis) / [------","Sextus Clodius Cai filius Publilia Verona miles legionis VII Claudia pia fidelis","epitaph","epitaph","stele","Dalmatia","Dalmatia","Gardun / Tilurium","Tilurium","Trilj","milites, praenomen et nomen, viri",43.6139,16.689,1
"236",1175,469138,"EDCS-28300162","HD058165",42,100,"L(ucius) Cassius L(uci) f(ilius) / Trom(entina) Marti/alis Aq(uae) Sta(tiellae) / mil(es) leg(ionis) XI / C(laudiae) p(iae) f(idelis) / |(centuria) Pulpidi Sil/vestris / stip(endiorum) XII an(norum) XXXV / t(itulum) f(ieri) i(ussit) h(eres) f(aciendum) c(uravit)","Lucius Cassius Luci filius Tromentina Martialis Aquae Statiellae miles legionis XI Claudiae piae fidelis centuria Pulpidi Silvestris stipendiorum XII annorum XXXV titulum fieri iussit heres faciendum curavit","epitaph","epitaph","tabula","Dalmatia","Dalmatia","Ivosevci / Burnum","Burnum","Kistanje","milites, tria nomina, viri",44.0317,15.9936,1
"237",1176,469139,"EDCS-28300163","HD058137",42,100,"[D(is) M(anibus)](?) / [A(ulus)? ---]ubiu[s] A(uli) [f(ilius)?] / [Cel]er |(centurio) leg(ionis) XI C(laudiae) / p(iae) f(idelis) domo Vero/na ann(orum) LXIII stip(endiorum) / XXXXIII t(itulum) f(ieri) iussit / Panthagathus / lib(ertus) f(aciendum) c(uravit)","Dis Manibus Aulus ubius Auli filius Celer centurio legionis XI Claudiae piae fidelis domo Verona annorum LXIII stipendiorum XXXXIII titulum fieri iussit Panthagathus libertus faciendum curavit","epitaph","epitaph","altar","Dalmatia","Dalmatia","Ivosevci / Burnum","Burnum","Kistanje","liberti/libertae, milites, nomen singulare, tria nomina, viri",44.0317,15.9936,1
"238",1193,469157,"EDCS-29900060","HD058168",42,100,"Sub hac in/scriptione / M(arcus) Cupitius / M(arci) f(ilius) Pol(lia) / Paulus / Amasia / miles leg(ionis) / XI C(laudiae) p(iae) f(idelis) stip/endiorum / XVII Cupitius / Pol(l)io frater / faciundum / curavit","Sub hac inscriptione Marcus Cupitius Marci filius Pollia Paulus Amasia miles legionis XI Claudiae piae fidelis stipendiorum XVII Cupitius Pollio frater faciundum curavit","epitaph","epitaph","stele","Dalmatia","Dalmatia","Ivosevci / Burnum","Burnum","Kistanje","milites, tria nomina, viri",44.0317,15.9936,1
"239",1325,469291,"EDCS-28400137","HD060048",42,100,"C(aio) Iulio C(ai) f(ilio) / [Se]r(gia) [Agr]ippae / [m(iliti)] leg(ionis) VII p(iae) f(idelis) / |(centuria) Agrip[p]ae p(---) / Avita mari/to Agrippi[na] / patri","Caio Iulio Cai filio Sergia Agrippae militi legionis VII piae fidelis centuria Agrippae p Avita marito Agrippina patri","epitaph","epitaph","NULL","Dalmatia","Dalmatia","Karin Gornji / Corinium","Corinium","Benkovac","milites, mulieres, nomen singulare, tria nomina, viri",44.1075,15.6256,1
"240",1345,469312,"EDCS-30301480","HD060039",42,100,"P(ubli-) Val[eri--- vet(eran-)?] / leg(ionis) X[I C(laudiae) p(iae) f(idelis) ---] / C(ai) f(ili-) Pa[---] / Valer[i---] / et Val[eri---] / fr[atri? ---?] / fieri [iuss---]","Publi Valeri veteran legionis XI Claudiae piae fidelis Cai fili Pa Valeri et Valeri fratri fieri iuss","epitaph","epitaph","NULL","Dalmatia","Dalmatia","Karin Gornji / Corinium","Corinium","Benkovac","milites, viri",44.1075,15.6256,1
"241",1436,469409,"EDCS-30301403","HD058257",42,100,"------] / T(itus) Lolliu[s] / T(iti) f(ilius) Clau(dia) / Tarviso / mil(es) leg(ionis) / XI C(laudiae) p(iae) f(idelis) / h(ic) s(itus) e(st)","Titus Lollius Titi filius Claudia Tarviso miles legionis XI Claudiae piae fidelis hic situs est","epitaph","epitaph","stele","Dalmatia","Dalmatia","Knin / Burnum","Ninia","Knin, bei","milites, tria nomina, viri",44.0408,16.1994,1
"242",1437,469410,"EDCS-30301404","HD058264",42,100,"------] C(aius) Sem[--]ius / [---] C(ai) f(ilius) Trom(entina) Se/[---]us Aq(uis) Sta(tiellis) / [--- l]eg(ionis) XI C(laudiae) p(iae) f(idelis) / [--- sign]ifer(?) [------?","Caius Sem ius Cai filius Tromentina Se us Aquis Statiellis legionis XI Claudiae piae fidelis signifer","epitaph","epitaph","NULL","Dalmatia","Dalmatia","Knin / Burnum","Ninia","Knin, bei","milites, tria nomina, viri",44.0408,16.1994,1
"243",1438,469411,"EDCS-30301405","HD058258",42,100,"------ T?]ert/ul(l)i[u]s Novar(ia) / m(iles) leg(ionis) XI C(laudiae) p(iae) f(idelis) / |(centuria) Cai Verecun(di) / an(norum) XXIIX stip(endiorum) / XXII t(estamento)(?) p(oni)(?) [i(usst)?]","Tertullius Novaria miles legionis XI Claudiae piae fidelis centuria Cai Verecundi annorum XXIIX stipendiorum XXII testamento poni iusst","epitaph","epitaph","tabula","Dalmatia","Dalmatia","Knin / Burnum","Ninia","Knin, bei","milites, praenomen et nomen, viri",44.0408,16.1994,1
"244",2226,470224,"EDCS-03700660","HD040083",42,100,"Iuliae Turi / f(iliae) Tertul[lae] / sacerd[oti] / divae A[ugustae] / Arrunti[a - f(ilia)] / Severa m[ater]","Iuliae Turi filiae Tertullae sacerdoti divae Augustae Arruntia filia Severa mater","epitaph","epitaph","NULL","Dalmatia","Dalmatia","Podgrade / Asseria","Asseria","Benkovac","Augusti/Augustae, mulieres, sacerdotes pagani, tria nomina",44.0103,15.6844,1
"245",7082,108891,"EDCS-55300298",NA,42,100,NA,"Lucius Marcilius Cai filius domo Pessinunte legionis VII Claudiae Piae Fidelis Caius Marcilius",NA,"epitaph",NA,"Dalmatia",NA,"Veljaci / Bigeste",NA,NA,"tria nomina, viri",43.2362774,17.4433546,1
"246",2611,470614,"EDCS-10100903","HD034303",45,100,"Ti(berius) Claudius / Priscus / vet(eranus) alae Claud(iae) nov(ae) / t(estamento) f(ieri) i(ussit) / arbitratu Sexti Viniusi","Tiberius Claudius Priscus veteranus alae Claudiae novae testamento fieri iussit arbitratu Sexti Viniusi","epitaph","epitaph","stele","Dalmatia","Dalmatia","Sinj / Osinium","Aequum","Sinj, bei","milites, tria nomina, viri",43.7423,16.6547,1
"247",474,468417,"EDCS-10000753","HD010876",51,100,"Caecilia / Procula / t(estamento) f(ieri) i(ussit) sibi et / Ti(berio) Cl(audio) Syrioni / coniugi b(ene) m(erenti) / L(ucius) Caecilius / Onesimus h(eres) / ponendum / curavit","Caecilia Procula testamento fieri iussit sibi et Tiberio Claudio Syrioni coniugi bene merenti Lucius Caecilius Onesimus heres ponendum curavit","epitaph","epitaph","cippus","Dalmatia","Dalmatia","Citluk / Aequum","Aequum","Sinj","mulieres, tria nomina, viri",43.7423,16.6547,1
"248",522,468466,"EDCS-28300105","HD062402",51,100,"------] / principi / Delmatarum / ann(orum) XXII / Claudia Tib(eri) fil(ia) / [------","principi Delmatarum annorum XXII Claudia Tiberi filia","epitaph","epitaph","NULL","Dalmatia","Dalmatia","Danilo Gornje / Rider","Rider","Šibenik","mulieres, ordo decurionum, viri",43.7034,16.0486,1
"249",812,468764,"EDCS-28300048","HD054613",51,100,"Honesimus(!) / T(iti) Septumi(!) / ser(vus) ann(orum) XV / h(ic) s(itus) e(st) dominus / bene merito / p(osuit)","Honesimus Titi Septumi servus annorum XV hic situs est dominus bene merito posuit","epitaph","epitaph","stele","Dalmatia","Dalmatia","Gardun / Tilurium","Tilurium","Trilj","nomen singulare, praenomen et nomen, servi/servae, viri",43.6139,16.689,1
"250",837,468789,"EDCS-29900112","HD012375",51,100,"P(ublius) Attecius P(ubli) f(ilius) / Venimarus mi/l(es) coh(ortis) VIII |(centuria) At(t)i/li domo Clau(dia) / Viruno an(n)o(rum) / XXI stip(endiorum) II / M(arcus) Ressius / Bricomar/us h(eres) ex t(estamento) / p(onendum) c(uravit)","Publius Attecius Publi filius Venimarus miles cohortis VIII centuria Attili domo Claudia Viruno annorum XXI stipendiorum II Marcus Ressius Bricomarus heres ex testamento ponendum curavit","epitaph","epitaph","stele","Dalmatia","Dalmatia","Gardun / Tilurium","Tilurium","Trilj","milites, nomen singulare, tria nomina, viri",43.6139,16.689,1
"251",847,468799,"EDCS-30200432","HD028183",51,100,"M(arcus) Pytha Segni f(ilius) / mil(es) c(o)hor(tis) II C{h}yrr&lt;h&gt;es(ticorum) / dom(o) Berea an(norum) LX stip(endiorum) / XXXV t(estamento) f(ieri) i(ussit) sibi Felici l(iberto) / [------?","Marcus Pytha Segni filius miles cohortis II Chyrr lt h gt esticorum domo Berea annorum LX stipendiorum XXXV testamento fieri iussit sibi Felici liberto","epitaph","epitaph","stele","Dalmatia","Dalmatia","Gardun / Tilurium","Tilurium","Trilj","milites, nomen singulare, praenomen et nomen, viri",43.6139,16.689,1
"252",1102,469060,"EDCS-10100877","HD034250",51,100,"------] f(ilio) / [---]R / [---]one / [---]XXXIIX / [---] h(ic) s(itus) [e(st)] / [---]us","filio R one XXXIIX hic situs est us","epitaph","epitaph","NULL","Dalmatia","Dalmatia","Hardomilje / Bigeste","Bigeste","Ljubuški",NA,43.1818,17.5271,1
"253",1324,469290,"EDCS-28400136","HD035467",51,100,"T(itus) Caninius / T(iti) f(ilius) Ser(gia) Maxim(us) / vet(eranus) coh(ortis) VI pr(aetoriae) / sibi t(estamento) p(oni) i(ussit) / M(arcus) Maesius Pau/lus h(eres) p(onendum) c(uravit)","Titus Caninius Titi filius Sergia Maximus veteranus cohortis VI praetoriae sibi testamento poni iussit Marcus Maesius Paulus heres ponendum curavit","epitaph","epitaph","altar","Dalmatia","Dalmatia","Karin Gornji / Corinium","Ansium","Obrovac","milites, tria nomina, viri",44.179,15.666,1
"254",1599,469576,"EDCS-10100643","HD033969",51,100,"D(is) M(anibus) / Maximu/s Diti an(n)o/rum LXX p(---) v(---) f(ecit) / h(ic) s(itus) e(st)","Dis Manibus Maximus Diti annorum LXX p v fecit hic situs est","epitaph","epitaph","stele","Dalmatia","Dalmatia","Krnjeusa","NULL","Bosanski Petrovac","nomen singulare, viri",44.6876805,16.2255311,1
"255",2240,470238,"EDCS-30101168","HD045063",51,100,"Q(uinto) Trosio","Quinto Trosio","epitaph","epitaph","NULL","Dalmatia","Dalmatia","Podgrade / Asseria","Asseria","Benkovac","praenomen et nomen, viri",44.0103,15.6844,1
"256",1087,469045,"EDCS-31300303","HD056522",71,100,"Ti(berius) Claudius Ligomarus / Carstimari f(ilius) / Claudia Salinis / eq(ues) coh(ortis) III Alpinae / ann(orum) LVII stipend(iorum) XXX / h(ic) [s(itus)] e(st) t(estamento) f(ieri) i(ussit) her(edes) p(osuerunt) / Ti(berius) Claudius Silenu[s] / et Ti(berius) Claudius Abascian(us) / libertus","Tiberius Claudius Ligomarus Carstimari filius Claudia Salinis eques cohortis III Alpinae annorum LVII stipendiorum XXX hic situs est testamento fieri iussit heredes posuerunt Tiberius Claudius Silenus et Tiberius Claudius Abascianus libertus","epitaph","epitaph","stele","Dalmatia","Dalmatia","Hardomilje / Bigeste","Bigeste","Ljubuški","milites, nomen singulare, tria nomina, viri",43.1818,17.5271,1
"257",6413,474865,"EDCS-27500169","HD053456",98,117,"C(aio) Vibio Severo / IIIIIIvir(o) annor(um) XXV / C(aius) Vibius Ingenu(u)s pater / IIIIII(vir) Augustalis / Flavialis Titialis / Nervialis vivos(!) fecit / et sibi et Vibiae Rhodope / uxori libertae vivae et / C(aio) Vibio Primigenio / IIIIIIvir(o) liberto optimo","Caio Vibio Severo IIIIII viro annorum XXV Caius Vibius Ingenuus pater IIIIII vir Augustalis Flavialis Titialis Nervialis vivos fecit et sibi et Vibiae Rhodope uxori libertae vivae et Caio Vibio Primigenio IIIIII viro liberto optimo","epitaph","epitaph","altar","Dalmatia","Dalmatia","Vid / Narona","Narona","Čapljina; Metković","liberti/libertae, mulieres, sacerdotes pagani, seviri Augustales, tria nomina, viri",43.0645,17.6884,1
"258",2227,470225,"EDCS-03700661","HD040090",1,130,"Vesiae T(iti) f(iliae) / Paullinae","Vesiae Titi filiae Paullinae","epitaph","epitaph","NULL","Dalmatia","Dalmatia","Podgrade / Asseria","Asseria","Benkovac","mulieres, tria nomina",44.0103,15.6844,1
"259",2231,470229,"EDCS-03700666","HD040114",1,130,"Rubriae / T(iti) f(iliae) Maximilla[e] / Valeria M(arci) f(ilia) / Marcella / f(iliae) p(osuit?)","Rubriae Titi filiae Maximillae Valeria Marci filia Marcella filiae posuit","epitaph","epitaph","NULL","Dalmatia","Dalmatia","Podgrade / Asseria","Asseria","Benkovac","mulieres, tria nomina",44.0103,15.6844,1
"260",2480,470482,"EDCS-64100451","HD072521",1,130,"Octaviae / Q(uinti) f(iliae) / Quintinae","Octaviae Quinti filiae Quintinae","epitaph","epitaph","NULL","Dalmatia","Dalmatia","Risan / Risano / Risinium","Risinium","Kotor","mulieres, tria nomina",42.5098,18.6969,1
"261",6779,475238,"EDCS-28400212","HD060120",1,130,"Valeria T(iti) f(ilia) Secunda viva f(ecit) / sibi et M(arco) Iulio T(iti) f(ilio) Ser(gia) Asprenati / viro et L(ucio) Iulio T(iti) f(ilio) Ser(gia) Macro et / Iuliae M(arci) f(iliae) Maximillae f(iliae) et L(ucio) Iulio / [------","Valeria Titi filia Secunda viva fecit sibi et Marco Iulio Titi filio Sergia Asprenati viro et Lucio Iulio Titi filio Sergia Macro et Iuliae Marci filiae Maximillae filiae et Lucio Iulio","epitaph","epitaph","tabula","Dalmatia","Dalmatia","Zadar / Iader","Iader","Zadar","mulieres, praenomen et nomen, tria nomina, viri",44.115501,15.223778,1
"262",6784,475243,"EDCS-28400217","HD060122",1,130,"H(oc) m(onumentum) h(eredem) n(on) s(equetur)","Hoc monumentum heredem non sequetur","epitaph","epitaph","block","Dalmatia","Dalmatia","Zadar / Iader","Iader","Zadar",NA,44.115501,15.223778,1
"263",6879,475341,"EDCS-10101903","HD035670",1,130,"Q(uinto) Tullio / Primigenio / Q(uintus) Tullius / Ausimus / libertus et / heres","Quinto Tullio Primigenio Quintus Tullius Ausimus libertus et heres","epitaph","epitaph","NULL","Dalmatia","Dalmatia","Zadar / Iader","Iader","Zadar","liberti/libertae, tria nomina, viri",44.115501,15.223778,1
"264",1206,469170,"EDCS-32700566","HD058295",30,130,"Sex(tus) Antern(ius) / Q(uinti) f(ilius) Sca(ptia) / Severus domo / Flor[entia ---] / [------","Sextus Anternius Quinti filius Scaptia Severus domo Florentia","epitaph","epitaph","stele","Dalmatia","Dalmatia","Ivosevci / Burnum","Burnum","Kistanje","tria nomina, viri",44.0317,15.9936,1
"265",1120,469078,"EDCS-10000684","HD034084",31,130,"Pr[---]A / AT[---] fa/to rapta h(ic) s(ita) e(st) / C(aius) Valerius C(ai) f(ilius) Den/to veter(anus) leg(ionis) VII lib(ertae) / suae posuit","Pr A AT fato rapta hic sita est Caius Valerius Cai filius Dento veteranus legionis VII libertae suae posuit","epitaph","epitaph","stele","Dalmatia","Dalmatia","Humac / Bigeste","Bigeste","Ljubuški","liberti/libertae, milites, mulieres, tria nomina, viri",43.1818,17.5271,1
"266",2229,470227,"EDCS-03700663","HD040109",31,130,"[Arrun]tiae / [--- Sec]undillae / [---] f(ilia) Quinta / mater","Arruntiae Secundillae filia Quinta mater","epitaph","epitaph","NULL","Dalmatia","Dalmatia","Podgrade / Asseria","Asseria","Benkovac","mulieres, tria nomina",44.0103,15.6844,1
"267",6742,475201,"EDCS-28400173","HD060203",31,130,"Q(uintus) Dellius Q(uinti) l(ibertus) / Fuscus / VIvir August(alis) v(ivus) f(ecit) / sibi et suis / in f(ronte) p(edes) XX in ag(ro) p(edes) XX","Quintus Dellius Quinti libertus Fuscus VI vir Augustalis vivus fecit sibi et suis in fronte pedes XX in agro pedes XX","epitaph","epitaph","NULL","Dalmatia","Dalmatia","Zadar / Iader","Iader","Zadar","liberti/libertae, seviri Augustales, tria nomina, viri",44.115501,15.223778,1
"268",1870,469856,"EDCS-28400117","HD051048",51,130,"------] / [--- vet?]er/[anus?] le[g(ionis)] VIII / L(ucio) Octavio [-] f(ilio) / Cla(udia) Frontin(o) / fratri","veteranus legionis VIII Lucio Octavio filio Claudia Frontino fratri","epitaph","epitaph","honorific/grave/votive column","Dalmatia","Dalmatia","Nadin / Nedinum","Nedinum","Benkovac","milites, tria nomina, viri",44.0721,15.5095,1
"269",7096,108917,"EDCS-78400005",NA,51,130,NA,"Caius Feresius Cai libertus Urbanus IIIIII vir Augustalis",NA,"epitaph",NA,"Dalmatia",NA,"Vid / Narona",NA,NA,"seviri Augustales, tria nomina, viri",43.0804139,17.6258524,1
"270",265,468195,"EDCS-64100437","HD072506",71,130,"Porciliae / Tertul(l)ae / aviae et / Aeliae M(arci) f(iliae) / Marcellae / matri / Iulia Q(uinti) f(ilia) / Tertul(l)ina / fecit","Porciliae Tertullae aviae et Aeliae Marci filiae Marcellae matri Iulia Quinti filia Tertullina fecit","epitaph","epitaph","altar","Dalmatia","Dalmatia","Budva / Buthoe","Buthoe","Budva","mulieres, tria nomina",42.2789,18.8351,1
"271",334,468264,"EDCS-31200538","HD052482",71,130,"C(aio) Oppio / C(ai) f(ilio) Cla(udia) / Clementi / Rusticel[lo?] / an(norum) XVI Baebi[a] / T(iti) f(ilia) Oppia mat[er] / f(ilio) p(osuit)","Caio Oppio Cai filio Claudia Clementi Rusticello annorum XVI Baebia Titi filia Oppia mater filio posuit","epitaph","epitaph","altar","Dalmatia","Dalmatia","Burnum","Asseria","Benkovac","mulieres, tria nomina, viri",44.0103,15.6844,1
"272",821,468773,"EDCS-30100405","HD046617",71,130,"[-]agenio(?) Eucisi f(ilio) / eq(uiti) ala(e) Frontoni(anae) / an(norum) XL stip(endiorum) XX / Nemis Sige h(ic) s(itus) e(st) / frateres(!) frater(!) / fecerunt","agenio Eucisi filio equiti alae Frontonianae annorum XL stipendiorum XX Nemis Sige hic situs est frateres frater fecerunt","epitaph","epitaph","stele","Dalmatia","Dalmatia","Gardun / Tilurium","Tilurium","Trilj","milites, nomen singulare, viri",43.6139,16.689,1
"273",984,468937,"EDCS-30200136","HD054442",71,130,"Ser(vius) Ennius Ser(vi) f(ilius) / Claudia Fuscus / domo Cemeneli / miles coh(ortis) VIII vol(untariorum) / stip(endiorum) XVIIII ann(orum) XXXIIX / Fulvia Vitalis v(iva) f(ecit) sibi / et coniugi b(ene) m(erenti) {f(ecit)} / h(oc) m(onumentum) h(eredem) n(on) s(equetur)","Servius Ennius Servi filius Claudia Fuscus domo Cemeneli miles cohortis VIII voluntariorum stipendiorum XVIIII annorum XXXIIX Fulvia Vitalis viva fecit sibi et coniugi bene merenti fecit hoc monumentum heredem non sequetur","epitaph","epitaph","stele","Dalmatia","Dalmatia","Gornji Muc / Andetrium","Andetrium","Muć","milites, mulieres, tria nomina, viri",43.6922,16.5206,1
"274",1068,469023,"EDCS-09300467","HD012300",71,130,"Raecio / Eumolpo","Raecio Eumolpo","epitaph","epitaph","stele","Dalmatia","Dalmatia","Grusine, Sibenik","Rider","Šibenik","tria nomina, viri",43.7034,16.0486,1
"275",1928,469914,"EDCS-28400236","HD060368",71,130,"Dis Manib(us) / Caeciani","Dis Manibus Caeciani","epitaph","epitaph","NULL","Dalmatia","Dalmatia","Nin / Aenona","Aenona","Nin","nomen singulare, viri",44.2435,15.1842,1
"276",2305,470303,"EDCS-10000880","HD012025",71,130,"C(aius) Veronius Aet/or v(ivus) f(ecit) sibi et Veturi/ae Ae&lt;t=I&gt;ae uxori e&lt;t=I&gt; Ce&lt;u&gt;n/o &lt;f=E&gt;(ilio) e&lt;t=I&gt; C(aio) Iulio nepoti ","Caius Veronius Aetor vivus fecit sibi et Veturiae Ae lt t gt ae uxori e lt t gt Ce lt u gt no lt f gt ilio e lt t gt Caio Iulio nepoti","epitaph","epitaph","stele","Dalmatia","Dalmatia","Podgrade / Asseria","Alveria","Lišane Ostrovičke","mulieres, nomen singulare, praenomen et nomen, tria nomina, viri",43.9937,15.8139,1
"277",2507,470509,"EDCS-10100548","HD033818",71,130,"D(is) M(anibus) / T(itus) F(lavius) Silva/nus dec(urio) M(?)(---?) / muni(cipii?) Fl(avi?) / [------","Dis Manibus Titus Flavius Silvanus decurio M municipii Flavi","epitaph","epitaph","NULL","Dalmatia","Dalmatia","Rudo / Municipium Malvesatium","Municipium Malvesiatium","Rudo","ordo decurionum, tria nomina, viri",43.9667,19.5333,1
"278",6160,474607,"EDCS-10101830","HD025915",71,130,"Manibus / C(ai) Valeri C(ai) f(ili) / Sca(ptia) Secundi / Altino praef(ecti) kas(trorum) leg(ionis) XI Cl(audiae) p(iae) f(idelis)","Manibus Cai Valeri Cai fili Scaptia Secundi Altino praefecti kastrorum legionis XI Claudiae piae fidelis","epitaph","epitaph","tabula","Dalmatia","Dalmatia","Tepljuh / Promona","Ninia","Knin","milites, ordo equester, tria nomina, viri",44.0408,16.1994,1
"279",6443,474895,"EDCS-26600644","HD050363",71,130,"[------?] / Marciae / Maritimae / Nicephor(us) / Aprilis Aug(usti) l(iberti) / ser(vus) coniugi / b(ene) m(erenti)","Marciae Maritimae Nicephorus Aprilis Augusti liberti servus coniugi bene merenti","epitaph","epitaph","tabula","Dalmatia","Dalmatia","Vid / Narona","Narona","Metković","liberti/libertae, mulieres, nomen singulare, servi/servae, tria nomina, viri",43.0801,17.625,1
"280",6476,474933,"EDCS-31900273","HD054443",71,130,"C(aio) Publicio / Romano / decur(ioni) ann(orum) XXX / C(aio) Licinio Expectato / Publiciae Iluricae / ann(orum) V infelicissima / mater fili(i)s et nepotiae / v(iva) f(ecit) et pater infelix senex","Caio Publicio Romano decurioni annorum XXX Caio Licinio Expectato Publiciae Iluricae annorum V infelicissima mater filiis et nepotiae viva fecit et pater infelix senex","epitaph","epitaph","stele","Dalmatia","Dalmatia","Vid / Narona","Narona","Metković","mulieres, ordo decurionum, tria nomina, viri",43.0801,17.625,1
