"","X","LIST.ID","EDCS.ID","EDH.ID","not_before","not_after","transcription","clean_text_interpretive_word","type_of_inscription_clean","type_of_inscription_auto","type_of_monument_clean","province","province_label_clean","place","findspot_ancient_clean","findspot_modern_clean","status_notation","Latitude","Longitude","count"
"1",6348,474800,"EDCS-26600652","HD050268",1,14,"Aug(usto) sacr(um) / C(aius) Iulius Macrini lib(ertus) / Martialis IIIIIIvir m(agister) M(ercurialis) ob / honor(em) idem ludos scaenic(os) / per trid(uum) d(edit) et canthar(um) arg(enteum) p(ondo) |S(unciarum septem)","Augusto sacrum Caius Iulius Macrini libertus Martialis IIIIII vir magister Mercurialis ob honorem idem ludos scaenicos per triduum dedit et cantharum argenteum pondo Sunciarum septem","votive inscription","votive inscription","tabula","Dalmatia","Dalmatia","Vid / Narona","Narona","Metković","liberti/libertae, nomen singulare, sacerdotes pagani, seviri Augustales, tria nomina, viri",43.0801,17.625,1
"2",2382,470383,"EDCS-10100662","HD033986",9,19,"I(ovi) O(ptimo) M(aximo) / s(acrum)","Iovi Optimo Maximo sacrum","votive inscription","votive inscription","altar","Dalmatia","Dalmatia","Prijepolje / Municipium Splonistarum","NULL","Prijepolje",NA,43.3891969,19.6496772,1
"3",6351,474803,"EDCS-24900088","HD056758",-30,30,"Q(uintus) Vibius L(uci) f(ilius) / Dianae v(otum) s(olvit) / eisdem aram / d(e) s(uo) f(aciendum) c(uravit)","Quintus Vibius Luci filius Dianae votum solvit eisdem aram de suo faciendum curavit","votive inscription","votive inscription","altar","Dalmatia","Dalmatia","Vid / Narona","Narona","Metković","praenomen et nomen, viri",43.0801,17.625,1
"4",6557,475014,"EDCS-12000832","HD042300",1,30,"Annaea D(ecimi) f(ilia) Maxima / L(uci) Saeni Luculli / Iunon(i) ob honore(m)","Annaea Decimi filia Maxima Luci Saeni Luculli Iunoni ob honorem","votive inscription","votive inscription","statue base","Dalmatia","Dalmatia","Vid / Narona","Narona","Metković","mulieres, tria nomina, viri",43.0801,17.625,1
"5",6556,475013,"EDCS-14800165","HD039847",14,30,"Divo Augusto / sacrum / P(ublius) Dolabella co(n)s(ul) / Caesaris August(i) / leg(atus) pro pr(aetore)","Divo Augusto sacrum Publius Dolabella consul Caesaris Augusti legatus pro praetore","votive inscription","votive inscription","statue base","Dalmatia","Dalmatia","Vid / Narona","Narona","Metković","Augusti/Augustae, ordo senatorius, tria nomina, viri",43.0801,17.625,1
"6",6,467866,"EDCS-28600118","HD062306",14,37,"Iano Patri / Aug(usto) sacrum / C(aius) Iulius C(ai) f(ilius) Ser(gia) / Aetor aed(ilis) / donatus ab Ti(berio) Caes(are) / Aug(usti) f(ilio) Augusto torq(ue) / maiore bello Delma/tico ob honorem / IIviratus cum liberis / suis posuit","Iano Patri Augusto sacrum Caius Iulius Cai filius Sergia Aetor aedilis donatus ab Tiberio Caesare Augusti filio Augusto tor que maiore bello Delmatico ob honorem II viratus cum liberis suis posuit","votive inscription","votive inscription","NULL","Dalmatia","Dalmatia","?","Aenona","Nin","Augusti/Augustae, ordo decurionum, tria nomina, viri",44.2435,15.1842,1
"7",1747,469725,"EDCS-10000216","HD021619",14,37,"[Divo] Augusto et / [T]i(berio) Caes[a]ri Aug(usti) f(ilio) Aug(usto) / sa[cr]um / veterani pagi Scunastic(i) / quibus colonia Naronit(ana) / agros dedit // Divo Augusto et / Ti(berio) Caesari Aug(usti) f(ilio) Aug(usto) / sacrum / veterani pagi Scunast(ici) / quibus colon(ia) Naroni(tana) / agros dedit","Divo Augusto et Tiberio Caesari Augusti filio Augusto sacrum veterani pagi Scunastici quibus colonia Naronitana agros dedit Divo Augusto et Tiberio Caesari Augusti filio Augusto sacrum veterani pagi Scunastici quibus colonia Naronitana agros dedit","votive inscription","votive inscription","tabula","Dalmatia","Dalmatia","Ljubuski / Mlade / Bigeste","Bigeste","Ljubuški","Augusti/Augustae, milites, viri",43.1818,17.5271,1
"8",2073,470067,"EDCS-28400367","HD062325",14,37,"Divo Aug(usto) / sacr(um) / L(ucius) Quinc[t]ius C(ai) f(ilius) / Ga[l]lus testamento / poni iussit","Divo Augusto sacrum Lucius Quinctius Cai filius Gallus testamento poni iussit","votive inscription","votive inscription","NULL","Dalmatia","Dalmatia","Pag","Cissa, insula","Pag","Augusti/Augustae, tria nomina, viri",44.3262,15.207,1
"9",359,468300,"EDCS-15100101","HD052803",1,50,"[------] / [------] / [---] conservatrici(?) / [---] potenti / [------] / Calpurnia L(uci) Pisonis auguris / filia Cn(aei) Pisonis neptis do(num) d(edit)","conservatrici potenti Calpurnia Luci Pisonis auguris filia Cnaei Pisonis neptis donum dedit","votive inscription","votive inscription","altar","Dalmatia","Dalmatia","Caska / Cissa","Cissa","Novalja","mulieres, nomen singulare, ordo senatorius, sacerdotes pagani, viri",44.546,14.914,1
"10",360,468301,"EDCS-67500106","HD029124",1,50,"[------] / [------] / [---] conservatrici(?) / [---] potenti / [------] / Calpurnia L(uci) Pisonis auguris / filia Cn(aei) Pisonis neptis do(num) d(edit)","conservatrici potenti Calpurnia Luci Pisonis auguris filia Cnaei Pisonis neptis donum dedit","votive inscription","votive inscription","altar","Dalmatia","Dalmatia","Caska / Cissa","Cissa","Novalja","mulieres, praenomen et nomen, sacerdotes pagani, viri",44.546,14.914,1
"11",1185,469149,"EDCS-30301398","HD004225",1,50,"Coran/us Iovi/le v(otum) s(olvit)","Coranus Iovile votum solvit","votive inscription","votive inscription","altar","Dalmatia","Dalmatia","Ivosevci / Burnum","Burnum","Kistanje","nomen singulare, viri",44.0317,15.9936,1
"12",1356,469323,"EDCS-10101883","HD035649",1,50,"Iovi / Kalpurn/ia Peculi/aris / v(otum) s(olvit) l(ibens) m(erito)","Iovi Kalpurnia Peculiaris votum solvit libens merito","votive inscription","votive inscription","altar","Dalmatia","Dalmatia","Karin Gornji / Corinium","Corinium","Benkovac","mulieres, tria nomina",44.1075,15.6256,1
"13",1907,469893,"EDCS-10000881","HD034505",1,50,"L(ucius) Sen(tius) / P(atri) Iano / [v(otum) s(olvit)](?) l(ibens) m(erito)","Lucius Sentius Patri Iano votum solvit libens merito","votive inscription","votive inscription","altar","Dalmatia","Dalmatia","Nadin / Nedinum","Nedinum","Benkovac","praenomen et nomen, viri",44.0721,15.5095,1
"14",1982,469969,"EDCS-10000337","HD016279",1,50,"B(onae) D(eae) dom(inae) Heiae A[ug(ustae)] / triumphali terrae / marisq(ue) dominatric[i] / conservatrici / mentiumque bo[n]arum / ac remediorum potenti / deae bene iudicanti / [C]alpurnia L(uci) Pisonis aug(uris) f(ilia) / Cn(aei) Pisonis neptis / d(onum) d(edit)","Bonae Deae dominae Heiae Augustae triumphali terrae maris que dominatrici conservatrici mentium que bonarum ac remediorum potenti deae bene iudicanti Calpurnia Luci Pisonis auguris filia Cnaei Pisonis neptis donum dedit","votive inscription","votive inscription","altar","Dalmatia","Dalmatia","Novalja","Cissa","Novalja","mulieres, nomen singulare, praenomen et nomen, viri",44.546,14.914,1
"15",6558,475015,"EDCS-12000833","HD042301",1,50,"Catena Ter/tulla / Veneri / munus","Catena Tertulla Veneri munus","votive inscription","votive inscription","altar","Dalmatia","Dalmatia","Vid / Narona","Narona","Metković","mulieres, tria nomina",43.0801,17.625,1
"16",6941,509768,"EDCS-10100575","HD033868",1,50,"[Silv]ano Aug(usto) sa(crum) // Aur(e)l(ius) Marci fil(ius) v(otum) s(olvit)","Silvano Augusto sacrum Aurelius Marci filius votum solvit","votive inscription","votive inscription","altar","Pannonia superior","Dalmatia","Gradac","NULL","Kiseljak","nomen singulare, viri",45.6142808,15.2452183,1
"17",6948,523120,NA,"HD051036",1,50,"C(aius) Ar/runt/i(us) v(otum) s(olvit)","Caius Arruntius votum solvit","votive inscription","votive inscription","tabula",NA,"Dalmatia",NA,"Asseria","Benkovac",NA,44.0103,15.6844,1
"18",2003,469992,"EDCS-03000738","HD039963",14,50,"[Div]o Aug(usto) et [Romae] / sacru[m] // [Ara]m Geni[o -]/[--- A]ugustam / [coh(ors)? Ga?]llica vol(untariorum?) / [------](?)","Divo Augusto et Romae sacrum Aram Genio Augustam cohors Gallica voluntariorum","votive inscription","votive inscription","altar","Dalmatia","Dalmatia","Omis / Almissa / Oneum / Onaeum","Oneum","Omiš",NA,43.4422,16.7019,1
"19",6352,474804,"EDCS-26600656","HD039236",14,54,"Dianae Nemore(n)s(i) / sacrum / Ti(berius) Claudius Claud[i]/anus praef(ectus) coh(ortis) I / Bracaraugust(anorum) / ex voto su(s)cep(to) de suo","Dianae Nemorensi sacrum Tiberius Claudius Claudianus praefectus cohortis I Bracaraugustanorum ex voto suscepto de suo","votive inscription","votive inscription","statue base","Dalmatia","Dalmatia","Vid / Narona","Narona","Metković","milites, ordo equester, tria nomina, viri",43.0801,17.625,1
"20",3610,471654,"EDCS-28701352","HD057704",9,56,"------] / [--- m]iles leg(ionis) VI[I ---] / Veneri don[um ob] / [magisteriu?]m cognation[is ---] / [--- Cl]odior(um) CVI(?)[---] / [------","miles legionis VII Veneri donum ob magisterium cognationis Clodiorum CVI","votive inscription","votive inscription","NULL","Dalmatia","Dalmatia","Solin / Salona","Salonae","Solin","milites, viri",43.5384,16.4743,1
"21",2571,470574,"EDCS-08300491","HD003120",42,57,"Herculi / sacrum / P(ublius) Plotius |(centurio) leg(ionis) / VII C(laudiae) p(iae) f(idelis) / v(otum) s(olvit) l(ibens) m(erito)","Herculi sacrum Publius Plotius centurio legionis VII Claudiae piae fidelis votum solvit libens merito","votive inscription","votive inscription","altar","Dalmatia","Dalmatia","Seget Donji / Tragurium","Tragurium","Seget","milites, praenomen et nomen, viri",43.5594,16.524,1
"22",5192,473437,"EDCS-10101029","HD034543",54,63,"------] / [C(aius) Cal]petanus / [Rant]ius Sedatus / [leg(atus) C]aesaris","Caius Calpetanus Rantius Sedatus legatus Caesaris","votive inscription","votive inscription","altar","Dalmatia","Dalmatia","Solin / Salona","Salonae","Solin","ordo senatorius, tria nomina, viri",43.5384,16.4743,1
"23",7084,108903,"EDCS-78300737",NA,1,70,NA,"uttius ntinus A Fortunae pecunia sua restituit",NA,"votive inscription",NA,"Dalmatia",NA,"Vid / Narona",NA,NA,"tria nomina, viri",43.0804139,17.6258524,1
"24",352,468293,"EDCS-03000732","HD039932",9,70,"------] / [--]VL[---] / [b(ene)]f(iciarius) co[(n)s(ularis) ex] / [l]eg(ione) XI [Cl(audiae)] / [v(otum)] s(olvit) [l(ibens) m(erito)]","VL beneficiarius consularis ex legione XI Claudiae votum solvit libens merito","votive inscription","votive inscription","altar","Dalmatia","Dalmatia","Cacak / Malvesiatium","Municipium Malvesiatium","Lučani","milites, viri",43.9667,19.5333,1
"25",6233,474681,"EDCS-46600038","HD056480",31,70,"[H]ercul[i] / Aug(usto) sac(rum) / Donatus / Cn(aei) Corneli / Certi v(otum) s(olvit) l(ibens)","Herculi Augusto sacrum Donatus Cnaei Corneli Certi votum solvit libens","votive inscription","votive inscription","altar","Dalmatia","Dalmatia","Trogir / Tragurium","Tragurium","Trogir","nomen singulare, tria nomina, viri",43.5594,16.524,1
"26",92,468016,"EDCS-32300071","HD052240",69,79,"[T(itus) F]lavius / [---]ditanus / [civ(itate?) d]on(atus) ab / [Imp(eratore)] Vespasiano / Ca[e]sare Aug(usto) / pra[e]positu[s] / et p[rin]cep[s] / Iapo[d]um / [v(otum) s(olvit) l(ibens) m(erito)]","Titus Flavius ditanus civitate donatus ab Imperatore Vespasiano Caesare Augusto praepositus et princeps Iapodum votum solvit libens merito","votive inscription","votive inscription","altar","Dalmatia","Dalmatia","Bihac / Raetinium","Raetinium","Bihać","Augusti/Augustae, milites, ordo decurionum, tria nomina, viri",44.7885,15.9292,1
"27",2725,470728,"EDCS-65000045","HD072483",79,81,"Divo Aug(usto) e[t] / divo Vespasian[o] / ex auctoritat[e] / [Imp(eratoris)] T(iti) Caesaris divi Ve[sp(asiani) f(ili) Vesp(asiani)] / [Augu]sti conventus L[iburnor(um)] / Scardonis c[onsecravit?]","Divo Augusto et divo Vespasiano ex auctoritate Imperatoris Titi Caesaris divi Vespasiani fili Vespasiani Augusti conventus Liburnorum Scardonis consecravit","votive inscription","votive inscription","tabula","Dalmatia","Dalmatia","Skradin / Scardona","Scardona; Tragurium","Skradin; Trogir","Augusti/Augustae, viri",43.8227,15.9208,1
"28",7078,108850,"EDCS-73900199",NA,79,81,NA,"Divo Augusto et divo Vespasiano ex auctoritate Imperatoris Titi Caesaris divi Vespasiani filii Vespasiani Augusti conventus Liburnorum Scardonis consecravit",NA,"votive inscription",NA,"Dalmatia",NA,"Trogir / Tragurium",NA,NA,"Augusti/Augustae, viri",43.516687,16.2499724,1
"29",2203,470201,"EDCS-10101916","HD035263",-30,100,"Senton(a)e / Sex(tus) Aem(ilius) / v(otum) s(olvit) l(ibens) m(erito)","Sentonae Sextus Aemilius votum solvit libens merito","votive inscription","votive inscription","altar","Dalmatia","Dalmatia","Plomin / Flanona","Flanona","Kršan","praenomen et nomen, viri",45.1382,14.1801,1
"30",6724,475183,"EDCS-24400841","HD053497",-30,100,"Isidi Serapi Liber(o) / Liberae voto / suscepto pro salute / Scapulae filii sui / P(ublius) Quinctius Paris / s(olvit) l(ibens) m(erito)","Isidi Serapi Libero Liberae voto suscepto pro salute Scapulae filii sui Publius Quinctius Paris solvit libens merito","votive inscription","votive inscription","altar","Dalmatia","Dalmatia","Zadar / Iader","Iader","Zadar","mulieres, nomen singulare, tria nomina, viri",44.115501,15.223778,1
"31",147,468073,"EDCS-08500497","HD000683",1,100,"I(ovi) O(ptimo) M(aximo) / sacr(um) / P(ublius) Vo/lusi/us Se/[---](?) / [------?","Iovi Optimo Maximo sacrum Publius Volusius Se","votive inscription","votive inscription","altar","Dalmatia","Dalmatia","Blagaj","NULL","Novi Grad","tria nomina, viri",43.2575855,17.8904391,1
"32",163,468089,"EDCS-10100765","HD022752",1,100,"S(ilvano) S(ilvestri) Primus / Vepi l(ibens) p(osuit)","Silvano Silvestri Primus Vepi libens posuit","votive inscription","votive inscription","altar","Dalmatia","Dalmatia","Bosansko Grahovo / Municipium Salvium","NULL","Bosansko Grahovo","nomen singulare, viri",44.1808174,16.36568,1
"33",231,468160,"EDCS-30301389","HD061582",1,100,"L(ucius) Aeroni/us Silvano / v(otum) s(olvit) l(ibens) m(erito)","Lucius Aeronius Silvano votum solvit libens merito","votive inscription","votive inscription","altar","Dalmatia","Dalmatia","Bribir / Bribirska Glavica / Varvaria","Varvaria","Skradin","praenomen et nomen, viri",43.8892,15.9051,1
"34",488,468431,"EDCS-10000767","HD034201",1,100,"[------](?) // [---] vilicus / [--- ex] voto","vilicus ex voto","votive inscription","votive inscription","relief","Dalmatia","Dalmatia","Citluk / Aequum","Aequum","Sinj, bei","officium/professio, viri",43.7423,16.6547,1
"35",791,468743,"EDCS-57200004","HD053934",1,100,"I Mac(edonica) le[g(io)] / [I]ovi o(ptimo) m(aximo) / v(otum) [s(olvit)] l(ibens) m(erito)","I Macedonica legio Iovi optimo maximo votum solvit libens merito","votive inscription","votive inscription","altar","Dalmatia","Dalmatia","Galovac / Iader","Iader","Galovac","milites",43.9393,15.4483,1
"36",792,468744,"EDCS-30101159","HD045053",1,100,"Gen[io] / [------","Genio","votive inscription","votive inscription","tabula","Dalmatia","Dalmatia","Gardun / Tilurium","Tilurium","Trilj",NA,43.6139,16.689,1
"37",1186,469150,"EDCS-30301399","HD061475",1,100,"Iovi Op(timo) M(aximo) / T(itus) Fufisius sig(nifer) / v(otum) s(olvit) l(ibens) m(erito)","Iovi Optimo Maximo Titus Fufisius signifer votum solvit libens merito","votive inscription","votive inscription","altar","Dalmatia","Dalmatia","Ivosevci / Burnum","Burnum","Kistanje","milites, praenomen et nomen, viri",44.0317,15.9936,1
"38",1187,469151,"EDCS-30301400","HD061477",1,100,"------](?) / C(aius?) Voc[onius](?) / M(arci) f(ilius) Iovi","Caius Voconius Marci filius Iovi","votive inscription","votive inscription","altar","Dalmatia","Dalmatia","Ivosevci / Burnum","Burnum","Kistanje","praenomen et nomen, viri",44.0317,15.9936,1
"39",1322,469288,"EDCS-28400133","HD060047",1,100,"Iano Pat[ri] / Q(uintus) Ennius [-] / f(ilius) Agrippa / v(otum) s(olvit) l(ibens) m(erito)","Iano Patri Quintus Ennius filius Agrippa votum solvit libens merito","votive inscription","votive inscription","altar","Dalmatia","Dalmatia","Karin Gornji / Corinium","Corinium","Benkovac","tria nomina, viri",44.1075,15.6256,1
"40",1481,469454,"EDCS-08900525","HD005985",1,100,"L(ibero) P(atri) A(ugusto) / Cordi/us Ur/sinus","Libero Patri Augusto Cordius Ursinus","votive inscription","votive inscription","altar","Dalmatia","Dalmatia","Kolovrat / Municipium Splonistarum","NULL","Prijepolje","tria nomina, viri",43.3691604,19.626587,1
"41",1640,469617,"EDCS-30400622","HD061801",1,100,"Sex(tus) C[eion(ius)?] / Vol(timesis?) f(ilius?) [---] / v(otum) s(olvit) l(ibens) m(erito)","Sextus Ceionius Voltimesis filius votum solvit libens merito","votive inscription","votive inscription","altar","Dalmatia","Dalmatia","Labin / Alvona","Albona","Labin","viri",45.0949,14.1232,1
"42",1720,469698,"EDCS-10100751","HD034061",1,100,"------] / [---]sus[---] / [---]aeq(---) p(osuit) l(ibens) m(erito) [---](?)","sus aeq posuit libens merito","votive inscription","votive inscription","tabula","Dalmatia","Dalmatia","Livno / Bariduum / Delminium","NULL","Livno","ordo decurionum, viri",43.8259136,17.0042416,1
"43",1906,469892,"EDCS-10000299","HD021805",1,100,"T(itus)(?) Octavius / C(ai) f(ilius) Macer |(centurio) / cohor(tis) I / Liburnorum / Iano Patri / v(otum) s(olvit) l(ibens) m(erito)","Titus Octavius Cai filius Macer centurio cohortis I Liburnorum Iano Patri votum solvit libens merito","votive inscription","votive inscription","altar","Dalmatia","Dalmatia","Nadin / Nedinum","Nedinum","Benkovac","milites, tria nomina, viri",44.0721,15.5095,1
"44",1908,469894,"EDCS-10000882","HD034506",1,100,"Trivi(i)s / sacr(um) / C(aius) Iulius / Celer / v(otum) s(olvit) l(ibens) m(erito)","Triviis sacrum Caius Iulius Celer votum solvit libens merito","votive inscription","votive inscription","altar","Dalmatia","Dalmatia","Nadin / Nedinum","Nedinum","Benkovac","tria nomina, viri",44.0721,15.5095,1
"45",2281,470279,"EDCS-31900020","HD058062",1,100,"T(itus) Iulius / Dianae / v(otum) s(olvit) l(ibens) m(erito)","Titus Iulius Dianae votum solvit libens merito","votive inscription","votive inscription","altar","Dalmatia","Dalmatia","Podgrade / Asseria","Alveria","Lišane Ostrovičke","praenomen et nomen, viri",43.9937,15.8139,1
"46",2393,470394,"EDCS-16000504","HD027049",1,100,"Liberai(!) / Iulia M(a)ximina / v(otum) s(olvit) l(ibens) m(erito)","Liberai Iulia Maximina votum solvit libens merito","votive inscription","votive inscription","altar","Dalmatia","Dalmatia","Pritoka / Raetinium","Raetinium","Bihać","mulieres, tria nomina",44.7885,15.9292,1
"47",2610,470613,"EDCS-10100902","HD021249",1,100,"[G]enio / Osiniatiu[m] / P(ublius) Rapidiu[s] / signifer / c(o)h[ortis] / [------","Genio Osiniatium Publius Rapidius signifer cohortis","votive inscription","votive inscription","altar","Dalmatia","Dalmatia","Sinj / Osinium","Senia","Senj","milites, praenomen et nomen, viri",44.9931,14.902,1
"48",2726,470729,"EDCS-57200037","HD054127",1,100,"M(agnae) M(atri) / Mescenia P(ubli) f(ilia) port(i)c(um) / f(ecit) d(e) s(ua) p(ecunia)","Magnae Matri Mescenia Publi filia porticum fecit de sua pecunia","votive inscription","votive inscription","NULL","Dalmatia","Dalmatia","Skrip / Brattia","NULL","Supetar","mulieres, praenomen et nomen",43.3546077,16.603408,1
"49",2862,470873,"EDCS-27500033","HD053745",1,100,"I(ovi) O(ptimo) M(aximo) / sacrum / L(ucius) Egnatius L(uci) f(ilius) / Cn(aei) nep(os) Cn(aei) pronep(os) / Tro(mentina) Clemens / decurio augur","Iovi Optimo Maximo sacrum Lucius Egnatius Luci filius Cnaei nepos Cnaei pronepos Tromentina Clemens decurio augur","votive inscription","votive inscription","cliff","Dalmatia","Dalmatia","Solin / Salona","Salonae","Klis","ordo decurionum, sacerdotes pagani, tria nomina, viri",43.5384,16.4743,1
"50",3615,471660,"EDCS-28701358","HD034680",1,100,"P(ublius) Cloelius miles c(o)ho(rtis) Campanae custos Traguri / v(otum) s(olvit) l(ibens) m(erito)","Publius Cloelius miles cohortis Campanae custos Traguri votum solvit libens merito","votive inscription","votive inscription","tabula","Dalmatia","Dalmatia","Solin / Salona","Salonae","Solin","milites, praenomen et nomen, viri",43.5384,16.4743,1
"51",3715,471761,"EDCS-28900133","HD060148",1,100,"------](?) / Min[ervae? ---] / aede I(?)[---] / M(arcus) Trosiu[s ---] / Magnus [---]","Minervae aede I Marcus Trosius Magnus","votive inscription","votive inscription","tabula","Dalmatia","Dalmatia","Solin / Salona","Salonae","Solin","tria nomina, viri",43.5384,16.4743,1
"52",6509,474966,"EDCS-66100167","HD060609",1,100,"C(aius) Iulius C(ai) [f(ilius) ---] / Cerialis [--- coh(ortis)] / Campan[ae] / Castori et [Polluci] / v(otum) s(olvit) [l(ibens) m(erito)]","Caius Iulius Cai filius Cerialis cohortis Campanae Castori et Polluci votum solvit libens merito","votive inscription","votive inscription","altar","Dalmatia","Dalmatia","Vid / Narona","Narona","Metković","milites, tria nomina, viri",43.0801,17.625,1
"53",6523,474980,"EDCS-10000214","HD032926",1,100,"[------] / [s]ac(rum) / ob honore(m) / IIvir(atus) C(ai) Vibi Res/tituti C(aius) Iulius / Maximus pos(uit)","sacrum ob honorem II viratus Cai Vibi Restituti Caius Iulius Maximus posuit","votive inscription","votive inscription","altar","Dalmatia","Dalmatia","Vid / Narona","Narona","Metković","ordo decurionum, tria nomina, viri",43.0801,17.625,1
"54",6875,475337,"EDCS-10101898","HD035665",1,100,"Dis / Salutari/bus / Cn(aeus) Corne/lius Severus / ob periculum / quod evase/rat","Dis Salutaribus Cnaeus Cornelius Severus ob periculum quod evaserat","votive inscription","votive inscription","altar","Dalmatia","Dalmatia","Zadar / Iader","Iader","Zadar","tria nomina, viri",44.115501,15.223778,1
"55",1617,469594,"EDCS-28400303","HD061824",14,100,"Nymphis / Aug(ustis) sacr(um) / ex voto sus/cepto pro sa/lute municipi(i) / balineo effect(o) / Ti(berius) Gavillius C(ai) f(ilius) / Claud(ia) Lambicus / aed(ilis) IIvir posuit","Nymphis Augustis sacrum ex voto suscepto pro salute municipii balineo effecto Tiberius Gavillius Cai filius Claudia Lambicus aedilis II vir posuit","votive inscription","votive inscription","NULL","Dalmatia","Dalmatia","Labin / Alvona","Albona","Labin","ordo decurionum, tria nomina, viri",45.0949,14.1232,1
"56",993,468946,"EDCS-32700505","HD060571",42,100,"------] / Nymp[his] / sacr[um] / [-?] Iulius [---]/us |(centurio) l[eg(ionis)] / [VII] C(laudiae) p(iae) [f(idelis)] / [cu?]m Pri[------","Nymphis sacrum Iulius us centurio legionis VII Claudiae piae fidelis cum Pri","votive inscription","votive inscription","altar","Dalmatia","Dalmatia","Gornji Muc / Andetrium","Andetrium","Muć","milites, tria nomina, viri",43.6922,16.5206,1
"57",6375,474827,"EDCS-27500105","HD053391",51,100,"Saturno / Aug(usto) sac(rum) / Claudia / Aesernina / sacerdos / divae Augustae / t(estamento) p(oni) i(ussit)","Saturno Augusto sacrum Claudia Aesernina sacerdos divae Augustae testamento poni iussit","votive inscription","votive inscription","NULL","Dalmatia","Dalmatia","Vid / Narona","Narona","Metković","Augusti/Augustae, mulieres, sacerdotes pagani, tria nomina",43.0801,17.625,1
"58",6215,474662,"EDCS-10100883","HD034286",71,100,"Silvano Aug(usto) / sac(rum) Iul(ius) Cass/ianus mil(es) coh(ortis) / [------","Silvano Augusto sacrum Iulius Cassianus miles cohortis","votive inscription","votive inscription","altar","Dalmatia","Dalmatia","Trilj / Tilurium","Tilurium","Trilj","milites, tria nomina, viri",43.6139,16.689,1
"59",7013,107029,"EDCS-71300207",NA,71,100,NA,"Iovi Optimo Maximo Varius R TI cohortis I miliariae ex iussu libens",NA,"votive inscription",NA,"Dalmatia",NA,"Doboj",NA,NA,"milites, tria nomina, viri",44.7313612,18.0847183,1
"60",6511,474968,"EDCS-32500118","HD060606",96,117,"Iovi Au[gusto] / sacr[um] / colle[g(ium) Aug(ustalium)? s(ub)? c(ura)?] / L(ucio) Pub[licio?] / Diadu[meno] / Aug(ustale) / F(laviale) T(itiale) [N(erviale)? ---]","Iovi Augusto sacrum collegium Augustalium sub cura Lucio Publicio Diadumeno Augustale Flaviale Titiale Nerviale","votive inscription","votive inscription","altar","Dalmatia","Dalmatia","Vid / Narona","Narona","Metković","sacerdotes pagani, seviri Augustales, tria nomina, viri",43.0801,17.625,1
"61",6347,474799,"EDCS-27500091","HD053374",98,117,"Aesculapio / Aug(usto) sacr(um) / P(ublius) Servilius [---] / IIIIIIvir [August(alis) Flav]/ialis [Titialis] / Nervialis testam[ento] / pon(endum) iussit ex [HS ---] / et ob dedicationem / [------]","Aesculapio Augusto sacrum Publius Servilius IIIIII vir Augustalis Flavialis Titialis Nervialis testamento ponendum iussit ex HS et ob dedicationem","votive inscription","votive inscription","NULL","Dalmatia","Dalmatia","Vid / Narona","Narona","Metković","sacerdotes pagani, seviri Augustales, viri",43.0801,17.625,1
"62",5541,473872,"EDCS-57200030","HD053954",1,130,"P(ublius) [---] / Pa[---] / Ma[tri Magnae? ---] / [-] vo[tum? ---]","Publius Pa Matri Magnae votum","votive inscription","votive inscription","stele","Dalmatia","Dalmatia","Solin / Salona","Salonae","Solin","viri",43.5384,16.4743,1
"63",6725,475184,"EDCS-30800341","HD060135",1,130,"Iunoni Augustae / Appuleia M(arci) fil(ia) Quinta / suo et L(uci) Turpilii Brocchi / Liciniani filii nomine / test(amento) poni iuss(it)","Iunoni Augustae Appuleia Marci filia Quinta suo et Luci Turpilii Brocchi Liciniani filii nomine testamento poni iussit","votive inscription","votive inscription","statue base","Dalmatia","Dalmatia","Zadar / Iader","Iader","Zadar","mulieres, tria nomina, viri",44.115501,15.223778,1
"64",6962,523197,NA,"HD060136",1,130,"Iovi Augusto / Appuleia M(arci) f(ilia) Quinta / suo et L(uci) Turpilii Brocch[i] / Liciniani filii nomine t(estamento) [p(oni) i(ussit)]","Iovi Augusto Appuleia Marci filia Quinta suo et Luci Turpilii Brocchi Liciniani filii nomine testamento poni iussit","votive inscription","votive inscription","statue base",NA,"Dalmatia",NA,"Iader","Zadar",NA,44.115501,15.223778,1
