"","X","LIST.ID","EDCS.ID","EDH.ID","not_before","not_after","transcription","clean_text_interpretive_word","type_of_inscription_clean","type_of_inscription_auto","type_of_monument_clean","province","province_label_clean","place","findspot_ancient_clean","findspot_modern_clean","status_notation","Latitude","Longitude","count"
"337",1831,469816,"EDCS-56900115","HD056711",1,100,"------] / leg(io-) XX [---] / [------","legio XX","NULL",NA,"NULL","Dalmatia","Dalmatia","Metkovic / Narona","Narona","Metković","milites",43.0801,17.625,1
"338",1875,469861,"EDCS-28400122","HD058240",1,100,"Octavia Q(uinti) f(ilia) / Secunda v(iva) f(ecit) sibi et / Octaviae T(iti) f(iliae) Gracil/lae f(iliae) Octaviae Sex(ti) / f(iliae) Celsinae nepti Q(uinto) Octa/vio patri aed(ili) IIviro III / Quintiae Voltisae matri / T(ito) Octavio Sex(ti) f(ilio) Gracili / viro aed(ili) IIviro pont(ifici) C(aio) Oc/tavio Rufo fratri aed(ili) / IIviro pont(ifici) Sex(to) Octavio / Sex(ti) f(ilio) Celso genero","Octavia Quinti filia Secunda viva fecit sibi et Octaviae Titi filiae Gracillae filiae Octaviae Sexti filiae Celsinae nepti Quinto Octavio patri aedili II viro III Quintiae Voltisae matri Tito Octavio Sexti filio Gracili viro aedili II viro pontifici Caio Octavio Rufo fratri aedili II viro pontifici Sexto Octavio Sexti filio Celso genero","epitaph","epitaph","tabula","Dalmatia","Dalmatia","Nadin / Nedinum","Nedinum","Benkovac","mulieres, ordo decurionum, praenomen et nomen, tria nomina, viri",44.0721,15.5095,1
"339",1883,469869,"EDCS-28400130","HD058247",1,100,"M(arcus) Tar[i]us C(ai) f(ilius) Triera Tariae / Sex(to) Tario C(ai) f(ilio) fratri / Tariae C(ai) f(iliae) Tertiae soror(i) / Q(uinto) Tario C(ai) f(ilio) fratri / vivos(!) fecit et suis filiis","Marcus Tarius Cai filius Triera Tariae Sexto Tario Cai filio fratri Tariae Cai filiae Tertiae sorori Quinto Tario Cai filio fratri vivos fecit et suis filiis","epitaph","epitaph","NULL","Dalmatia","Dalmatia","Nadin / Nedinum","Nedinum","Benkovac","mulieres, tria nomina, viri",44.0721,15.5095,1
"340",1906,469892,"EDCS-10000299","HD021805",1,100,"T(itus)(?) Octavius / C(ai) f(ilius) Macer |(centurio) / cohor(tis) I / Liburnorum / Iano Patri / v(otum) s(olvit) l(ibens) m(erito)","Titus Octavius Cai filius Macer centurio cohortis I Liburnorum Iano Patri votum solvit libens merito","votive inscription","votive inscription","altar","Dalmatia","Dalmatia","Nadin / Nedinum","Nedinum","Benkovac","milites, tria nomina, viri",44.0721,15.5095,1
"341",1908,469894,"EDCS-10000882","HD034506",1,100,"Trivi(i)s / sacr(um) / C(aius) Iulius / Celer / v(otum) s(olvit) l(ibens) m(erito)","Triviis sacrum Caius Iulius Celer votum solvit libens merito","votive inscription","votive inscription","altar","Dalmatia","Dalmatia","Nadin / Nedinum","Nedinum","Benkovac","tria nomina, viri",44.0721,15.5095,1
"342",1969,469955,"EDCS-10000306","HD033253",1,100,"C(aius) Iulius Ceuni f(ilius) / Ser(gia) Curticus Aetor / pontem de sua pecun(ia) / fecit / lon(gum) p(e)d(es) CXXCVII / lat(um) p(edes) X","Caius Iulius Ceuni filius Sergia Curticus Aetor pontem de sua pecunia fecit longum pedes CXXCVII latum pedes X","building/dedicatory inscription","building/dedicatory inscription","tabula","Dalmatia","Dalmatia","Nin / Aenona","Aenona","Vrsi","nomen singulare, tria nomina, viri",44.2435,15.1842,1
"343",2038,470031,"EDCS-28400396","HD057944",1,100,"C(aio) Lucretio / Sex(ti) f(ilio) a(nnorum) IX h(ic) s(itus) / Catellia T(iti) f(ilia) Secunda f(ecit)","Caio Lucretio Sexti filio annorum IX hic situs Catellia Titi filia Secunda fecit","epitaph","epitaph","NULL","Dalmatia","Dalmatia","Osor / Opsorus","Apsorus","Mali Lošinj","mulieres, praenomen et nomen, tria nomina, viri",44.693,14.3919,1
"344",2045,470038,"EDCS-28600107","HD057946",1,100,"Q(uintus) Fonteius Raeci / f(ilius) v(ivus) f(ecit) sibi et / Volsounae Oplicae / Pl[a]etoris f(iliae) / coniugi suae","Quintus Fonteius Raeci filius vivus fecit sibi et Volsounae Oplicae Plaetoris filiae coniugi suae","epitaph","epitaph","NULL","Dalmatia","Dalmatia","Osor / Opsorus","Crexa","Cres","mulieres, nomen singulare, tria nomina, viri",45.112,14.3542,1
"345",2047,470040,"EDCS-28600109","HD057942",1,100,"Q(uintus) Nigidius Turi f(ilius) / v(ivus) fec(it) sib(i) et Avitae / Nigidia[e] Volsouni f(iliae) / uxori","Quintus Nigidius Turi filius vivus fecit sibi et Avitae Nigidiae Volsouni filiae uxori","epitaph","epitaph","NULL","Dalmatia","Dalmatia","Osor / Opsorus","Crexa","Cres","mulieres, praenomen et nomen, tria nomina, viri",45.112,14.3542,1
"346",2192,470190,"EDCS-28400292","HD014821",1,100,"[A]cilia L(uci) f(ilia) Quincta v(iva) f(ecit) s(ibi) et Se[x(to)] / [A]quillio viro suo h(eredi) [et] / [L(ucio)] Aquillio Sex(ti) f(ilio) [C]la(udia) Longo f(ilio) de[c(urioni) ---]","Acilia Luci filia Quincta viva fecit sibi et Sexto Aquillio viro suo heredi et Lucio Aquillio Sexti filio Claudia Longo filio decurioni","epitaph","epitaph","tabula","Dalmatia","Dalmatia","Plomin / Flanona","Flanona","Kršan","milites, mulieres, ordo decurionum, praenomen et nomen, tria nomina",45.1382,14.1801,1
"347",2193,470191,"EDCS-28400293","HD061847",1,100,"[Se]x(to) Aquillio Sex(ti) f(ilio) L(ucio) A/quillio Sex(ti) f(ilio) Ruf[o] / [------?","Sexto Aquillio Sexti filio Lucio Aquillio Sexti filio Rufo","epitaph","epitaph","NULL","Dalmatia","Dalmatia","Plomin / Flanona","Flanona","Kršan","praenomen et nomen, viri",45.1382,14.1801,1
"348",2194,470192,"EDCS-28400294","HD015547",1,100,"Avita Su/ioca Ves/clevesis / f(ilia) v(iva) f(ecit) sibi et / [---]V / [------? // Volsou/nae Suio/cae Ves/clevesis / f(iliae) / [------? // Avita / Aquil/lia L(uci) f(ilia) / v(iva) f(ecit) si[bi et] / Vol[---] / [------?","Avita Suioca Vesclevesis filia viva fecit sibi et V Volsounae Suiocae Vesclevesis filiae Avita Aquillia Luci filia viva fecit sibi et Vol","epitaph","epitaph","stele","Dalmatia","Dalmatia","Plomin / Flanona","Flanona","Kršan","mulieres, nomen singulare, tria nomina, viri",45.1382,14.1801,1
"349",2251,470249,"EDCS-64100474","HD072539",1,100,"Sex(t--) Ati[li--] / Sex(ti) f(ili--) Ru[f--] / [------","Sext Atili Sexti fili Ruf","epitaph","epitaph","tabula","Dalmatia","Dalmatia","Podgrade / Asseria","Asseria","Benkovac","tria nomina, viri",44.0103,15.6844,1
"350",2281,470279,"EDCS-31900020","HD058062",1,100,"T(itus) Iulius / Dianae / v(otum) s(olvit) l(ibens) m(erito)","Titus Iulius Dianae votum solvit libens merito","votive inscription","votive inscription","altar","Dalmatia","Dalmatia","Podgrade / Asseria","Alveria","Lišane Ostrovičke","praenomen et nomen, viri",43.9937,15.8139,1
"351",2314,470312,"EDCS-10101863","HD035455",1,100,"[--- Pa]piri[us] C(ai) f(ilius) Secund[us? ---] / [------?","Papirius Cai filius Secundus","building/dedicatory inscription","building/dedicatory inscription","architectural member","Dalmatia","Dalmatia","Podgrade / Asseria","Asseria","Benkovac","tria nomina, viri",44.0103,15.6844,1
"352",2393,470394,"EDCS-16000504","HD027049",1,100,"Liberai(!) / Iulia M(a)ximina / v(otum) s(olvit) l(ibens) m(erito)","Liberai Iulia Maximina votum solvit libens merito","votive inscription","votive inscription","altar","Dalmatia","Dalmatia","Pritoka / Raetinium","Raetinium","Bihać","mulieres, tria nomina",44.7885,15.9292,1
"353",2418,470419,"EDCS-10101964","HD004919",1,100,"Liccaeus Vei f(ilius) / |(centurio) de liburna / Lucusta / testamento / fieri iussit arbit(ratu) / Dabali Triti / heredis / a(mico) mer(enti) an(norum) XXX / loc(o) publ(ice) dat(o)","Liccaeus Vei filius centurio de liburna Lucusta testamento fieri iussit arbitratu Dabali Triti heredis amico merenti annorum XXX loco publice dato","epitaph","epitaph","stele","Dalmatia","Dalmatia","Punta Kriza","Apsorus","Mali Lošinj","milites, nomen singulare, viri",44.693,14.3919,1
"354",2439,470440,"EDCS-10101960","HD035314",1,100,"------]o hic situs est [---] / PETOV[---]FLAVI[---] / vixit [---] SXVXII[---] / E[---]EB Claudius [------","o hic situs est PETOV FLAVI vixit SXVXII E EB Claudius","epitaph","epitaph","tabula","Dalmatia","Dalmatia","Rab, Otok / Arba","Arba","Rab","viri",44.7565,14.7596,1
"355",2489,470491,"EDCS-64100459","HD072528",1,100,"Sex(to) Man(lio) / d(omo) Sirmi(o)","Sexto Manlio domo Sirmio","epitaph","epitaph","urn","Dalmatia","Dalmatia","Risan / Risano / Risinium","Risinium","Kotor","praenomen et nomen, viri",42.5098,18.6969,1
"356",2610,470613,"EDCS-10100902","HD021249",1,100,"[G]enio / Osiniatiu[m] / P(ublius) Rapidiu[s] / signifer / c(o)h[ortis] / [------","Genio Osiniatium Publius Rapidius signifer cohortis","votive inscription","votive inscription","altar","Dalmatia","Dalmatia","Sinj / Osinium","Senia","Senj","milites, praenomen et nomen, viri",44.9931,14.902,1
"357",2631,470634,"EDCS-57200161","HD014585",1,100,"Voltisa Tresina [---] / Camuniae f(iliae) sua[e et sibi fecit] / Titamoc[a ---] / Volt[isa et] / C(aius) Titius C(ai) [f(ilius)] / Volses [sibi et] / suis fe[cerunt]","Voltisa Tresina Camuniae filiae suae et sibi fecit Titamoca Voltisa et Caius Titius Cai filius Volses sibi et suis fecerunt","epitaph","epitaph","stele","Dalmatia","Dalmatia","Skabrnja / Nedinum","Nedinum","Škabrnja","mulieres, tria nomina, viri",44.0721,15.5095,1
"358",2700,470703,"EDCS-30600024","HD061593",1,100,"P(ublius) Cornelius P(ubli) f(ilius) Eporediensis / mil(es) leg(ionis) XI ann(orum) XXX stip(endiorum) VIII","Publius Cornelius Publi filius Eporediensis miles legionis XI annorum XXX stipendiorum VIII","epitaph","epitaph","NULL","Dalmatia","Dalmatia","Skradin / Scardona","Scardona","Skradin","milites, tria nomina, viri",43.8227,15.9208,1
"359",2726,470729,"EDCS-57200037","HD054127",1,100,"M(agnae) M(atri) / Mescenia P(ubli) f(ilia) port(i)c(um) / f(ecit) d(e) s(ua) p(ecunia)","Magnae Matri Mescenia Publi filia porticum fecit de sua pecunia","votive inscription","votive inscription","NULL","Dalmatia","Dalmatia","Skrip / Brattia","NULL","Supetar","mulieres, praenomen et nomen",43.3546077,16.603408,1
"360",6002,474447,"EDCS-10101950","HD035300",1,100,"[---]us Plator / [---]gato / [hic sit]us est t(estamento) [f(ieri) i(ussit)]","us Plator gato hic situs est testamento fieri iussit","epitaph","epitaph","tabula","Dalmatia","Dalmatia","Solta, Otok / Solentia","Solentia, insula","Šolta","tria nomina, viri",43.3972,16.2752,1
"361",6067,474513,"EDCS-27500027","HD053723",1,100,"------] / in agr(o) p(edes) XX / [------","in agro pedes XX","epitaph","epitaph","NULL","Dalmatia","Dalmatia","Stobrec / Epetino / Epetium","Epetium","Split",NA,43.4987,16.5235,1
"362",6142,474589,"EDCS-30301342","HD061686",1,100,"Flavos(!) Bo/uti f(ilius) mil(es) / coh(ortis) I Luce(nsium) / ann(orum) XXXI / stip(endiorum) X dom(o) / Luco Aug(usti) h(eres) f(aciendum) c(uravit) / h(ic) s(itus) e(st)","Flavos Bouti filius miles cohortis I Lucensium annorum XXXI stipendiorum X domo Luco Augusti heres faciendum curavit hic situs est","epitaph","epitaph","stele","Dalmatia","Dalmatia","Tepljuh / Promona","Promona","Drniš","milites, nomen singulare, viri",43.8955,16.2114,1
"363",6210,474657,"EDCS-10000746","HD034182",1,100,"------ c]enturio le[g(ionis) VII ---]","centurio legionis VII","epitaph","epitaph","stele","Dalmatia","Dalmatia","Trilj / Tilurium","Tilurium","Trilj","milites, viri",43.6139,16.689,1
"364",6280,474728,"EDCS-31900096","HD058762",1,100,"Sex(to) Fundanio Q(uinti) [f(ilio) ---?] / Ponponiae(!) Sex(ti) f(iliae) Terti[ae] / C(aius) Fundanius Clemens [p]ar[entibus] / f[ec]it","Sexto Fundanio Quinti filio Ponponiae Sexti filiae Tertiae Caius Fundanius Clemens parentibus fecit","epitaph","epitaph","NULL","Dalmatia","Dalmatia","Trogir / Tragurium","Tragurium","Trogir","mulieres, praenomen et nomen, tria nomina, viri",43.5594,16.524,1
"365",6380,474832,"EDCS-26600666","HD050228",1,100,"[A(ulus) Obultronius Grat(us)?] P(ublius) Annae(us) Stam[it(us) L(ucius) Bat(tius) ---] / [L(ucius) Safinius Qua]r(tus)(?) C(aius) Licinius T[elamo] / [sev(iri) m(agistri) M(ercuriales) a(ere) a(ccepto) l(ibentes)] a(---) i(n) [s(olo) p(rivato) a(edem)] ai(dificaverunt) [d(e) s(ua) p(ecunia) f(aciendum) c(uraverunt)]","Aulus Obultronius Gratus Publius Annaeus Stamitus Lucius Battius Lucius Safinius Quartus Caius Licinius Telamo seviri magistri Mercuriales aere accepto libentes a in solo privato aedem aidificaverunt de sua pecunia faciendum curaverunt","building/dedicatory inscription","building/dedicatory inscription","tabula","Dalmatia","Dalmatia","Vid / Narona","Narona","Metković","sacerdotes pagani, seviri Augustales, tria nomina, viri",43.0801,17.625,1
"366",6400,474852,"EDCS-27500118","HD053448",1,100,"A(ulo) Annaeo A(uli) f(ilio) An(iensi) / Flacco flamini / Augustali IIIIvir(o) II / quin[q(uennali)] IIIIvir(o) i(ure) dic(undo) / praef(ecto) i(ure) d(icundo) ex dec(reto) dec(urionum) / pontif(ici) Aninia D(ecimi) f(ilia) uxor","Aulo Annaeo Auli filio Aniensi Flacco flamini Augustali IIII viro II quinquennali IIII viro iure dicundo praefecto iure dicundo ex decreto decurionum pontifici Aninia Decimi filia uxor","honorific inscription","honorific inscription","NULL","Dalmatia","Dalmatia","Vid / Narona","Narona","Metković","mulieres, ordo decurionum, praenomen et nomen, sacerdotes pagani, tria nomina, viri",43.0801,17.625,1
"367",6410,474862,"EDCS-26600679","HD050260",1,100,"[---]o L(uci) l(iberto) Hyllo / [---? IIIII]I August(ali) / [--- Ma]ximae con(iugi) / [e]ius / [--- T]urbo aed(ilis) IIIIvir / [t(estamento)] f(ieri) i(ussit)","o Luci liberto Hyllo IIIIII Augustali Maximae coniugi eius Turbo aedilis IIII vir testamento fieri iussit","epitaph","epitaph","altar","Dalmatia","Dalmatia","Vid / Narona","Narona","Metković","liberti/libertae, mulieres, ordo decurionum, seviri Augustales, tria nomina, viri",43.0801,17.625,1
"368",6471,474928,"EDCS-31900271","HD060631",1,100,"------](?) / Q(uintus) MaR(?)[cius? ---] / Serg(ia) Itali[cus ---?] / signifer l[eg(ionis) ---] / annor(um) nat(us) XX[---] / stipendiorum X[---] / [------","Quintus MaRcius Sergia Italicus signifer legionis annorum natus XX stipendiorum X","epitaph","epitaph","NULL","Dalmatia","Dalmatia","Vid / Narona","Narona","Metković","milites, viri",43.0801,17.625,1
"369",6473,474930,"EDCS-31500392","HD060635",1,100,"------](?) / [--- dom]o Arimin(o) / mil(es) leg(ionis) XIII donat(us) torq(uibus) / armil(lis) phal(eris) et |(centurio) coh(ortis) I / Camp(estris) an(norum) LX t(estamento) f(ieri) i(ussit) Posidonius / et Prunicus lib(erti) posuer(unt) / et ali ne(mini) h(ic) s(itus) e(st)","domo Arimino miles legionis XIII donatus torquibus armillis phaleris et centurio cohortis I Campestris annorum LX testamento fieri iussit Posidonius et Prunicus liberti posuerunt et ali nemini hic situs est","epitaph","epitaph","NULL","Dalmatia","Dalmatia","Vid / Narona","Narona","Metković","liberti/libertae, milites, nomen singulare, viri",43.0801,17.625,1
"370",6474,474931,"EDCS-30800078","HD060638",1,100,"------] / M(?)[--]VL[---]D[--] / c(o)ho(rtis) XI Gall(orum) / domo Patavi / ann(orum) XLVI stip(endiorum) / XV","M VL D cohortis XI Gallorum domo Patavi annorum XLVI stipendiorum XV","epitaph","epitaph","NULL","Dalmatia","Dalmatia","Vid / Narona","Narona","Metković","milites, viri",43.0801,17.625,1
"371",6495,474952,"EDCS-31900290","HD060870",1,100,"T(itus) Pullicus / Rufi f(ilius) Rom(ilia) / C(aius) Pullicus / T(iti) f(ilius) Rom(ilia) a(nnorum) XXIIII / Q(uintus) Pullicus T(iti) f(ilius) / Salvius","Titus Pullicus Rufi filius Romilia Caius Pullicus Titi filius Romilia annorum XXIIII Quintus Pullicus Titi filius Salvius","epitaph","epitaph","altar","Dalmatia","Dalmatia","Vid / Narona","Narona","Metković","nomen singulare, praenomen et nomen, tria nomina, viri",43.0801,17.625,1
"372",6509,474966,"EDCS-66100167","HD060609",1,100,"C(aius) Iulius C(ai) [f(ilius) ---] / Cerialis [--- coh(ortis)] / Campan[ae] / Castori et [Polluci] / v(otum) s(olvit) [l(ibens) m(erito)]","Caius Iulius Cai filius Cerialis cohortis Campanae Castori et Polluci votum solvit libens merito","votive inscription","votive inscription","altar","Dalmatia","Dalmatia","Vid / Narona","Narona","Metković","milites, tria nomina, viri",43.0801,17.625,1
"373",6523,474980,"EDCS-10000214","HD032926",1,100,"[------] / [s]ac(rum) / ob honore(m) / IIvir(atus) C(ai) Vibi Res/tituti C(aius) Iulius / Maximus pos(uit)","sacrum ob honorem II viratus Cai Vibi Restituti Caius Iulius Maximus posuit","votive inscription","votive inscription","altar","Dalmatia","Dalmatia","Vid / Narona","Narona","Metković","ordo decurionum, tria nomina, viri",43.0801,17.625,1
"374",6531,474988,"EDCS-10000674","HD033965",1,100,"------] / ann(orum) X[---] / h(ic) s(it-) e(st) / L(ucius) Ae[lius?] / Firmu[s ---] / [------","annorum X hic sit est Lucius Aelius Firmus","epitaph","epitaph","NULL","Dalmatia","Dalmatia","Vid / Narona","Narona","Metković","tria nomina, viri",43.0801,17.625,1
"375",6544,475001,"EDCS-10100832","HD034176",1,100,"Sex(tus) Herennius / Sex(ti) l(ibertus) Eros IIIIIIvir / Licinia Q(uinti) f(ilia) Iucunda / Herennia Sex(ti) fil(ia) Tyc(h)e / Herennia Sex(ti) lib(erta) [---] / [---]","Sextus Herennius Sexti libertus Eros IIIIII vir Licinia Quinti filia Iucunda Herennia Sexti filia Tyche Herennia Sexti liberta","epitaph","epitaph","cliff","Dalmatia","Dalmatia","Vid / Narona","Narona","Metković","liberti/libertae, mulieres, seviri Augustales, tria nomina, viri",43.0801,17.625,1
"376",6577,475035,"EDCS-28400338","HD061165",1,100,"G(aius) Octav[ius ---] / M(arcus) Octavi[us ---] / M(arcus) Octavius [---] / G(aius) Octavius N[---] / et fr(atribus?) f(aciendum) c(uravit?)","Gaius Octavius Marcus Octavius Marcus Octavius Gaius Octavius N et fratribus faciendum curavit","epitaph","epitaph","NULL","Dalmatia","Dalmatia","Vis / Issa","Issa, insula","Vis","viri",43.0655,16.1865,1
"377",6620,475079,"EDCS-14800172","HD039867",1,100,"L(ucius) Cusius / L(uci) l(ibertus) Ascani/us an(norum) XX h(ic) s(itus) e(st) / patronus posu/it bene merito","Lucius Cusius Luci libertus Ascanius annorum XX hic situs est patronus posuit bene merito","epitaph","epitaph","stele","Dalmatia","Dalmatia","Vojnic Sinjski / Tilurium","Tilurium","Trilj","liberti/libertae, tria nomina, viri",43.6139,16.689,1
"378",6733,475192,"EDCS-28400164","HD060144",1,100,"Sex(tus) Atilius / Sex(ti) f(ilius) Pap(iria) / veter(anus) leg(ionis) VII / domo Ticino / hic situs est / testamento / fieri iussit / in f(ronte) p(edes) XV in a(gro) p(edes) XX","Sextus Atilius Sexti filius Papiria veteranus legionis VII domo Ticino hic situs est testamento fieri iussit in fronte pedes XV in agro pedes XX","epitaph","epitaph","stele","Dalmatia","Dalmatia","Zadar / Iader","Iader","Zadar","milites, praenomen et nomen, viri",44.115501,15.223778,1
"379",6748,475207,"EDCS-28400179","HD060214",1,100,"C(aio) Octa[vio M]ontan[o] / pont[ific]i IIvir(o) / [--- i]ter(um) / [------","Caio Octavio Montano pontifici II viro iterum","honorific inscription","honorific inscription","NULL","Dalmatia","Dalmatia","Zadar / Iader","Iader","Zadar","ordo decurionum, sacerdotes pagani, tria nomina, viri",44.115501,15.223778,1
"380",6790,475249,"EDCS-28400223","HD060294",1,100,"------](?) / [---]VNESIC[---] / |(centuria) Octavi F[---] / Volso [e](?)t F(?) Octa(vio) [-](?) f(ilio?) Balbo / [------?","VNESIC centuria Octavi F Volso et F Octavio filio Balbo","NULL",NA,"NULL","Dalmatia","Dalmatia","Zadar / Iader","Nedinum","Benkovac","milites, tria nomina, viri",44.0721,15.5095,1
"381",6791,475250,"EDCS-28400224","HD060295",1,100,"------](?) / Paula Lucii filia / annorum septem / Iulia Caii filia vivens / [------?","Paula Lucii filia annorum septem Iulia Caii filia vivens","epitaph","epitaph","NULL","Dalmatia","Dalmatia","Zadar / Iader","Nedinum","Benkovac","mulieres, praenomen et nomen, viri",44.0721,15.5095,1
"382",6831,475291,"EDCS-31200674","HD060065",1,100,"------] in fr(onte) [p(edes) ------","in fronte pedes","boundary inscription","boundary inscription","NULL","Dalmatia","Dalmatia","Zadar / Iader","Iader","Zadar",NA,44.115501,15.223778,1
"383",6832,475292,"EDCS-31200675","HD060066",1,100,"------] in fron[te p(edes) ------","in fronte pedes","boundary inscription","boundary inscription","NULL","Dalmatia","Dalmatia","Zadar / Iader","Iader","Zadar",NA,44.115501,15.223778,1
"384",6847,475308,"EDCS-10000896","HD034499",1,100,"Sex(to) Cornelio / Sex(ti) l(iberto) Acasto / ex testamento / in fronte ped(es) XII / [e]t in agro ped(es) XI","Sexto Cornelio Sexti liberto Acasto ex testamento in fronte pedes XII et in agro pedes XI","epitaph","epitaph","NULL","Dalmatia","Dalmatia","Zadar / Iader","Iader","Zadar","liberti/libertae, tria nomina, viri",44.115501,15.223778,1
"385",6849,475310,"EDCS-10000898","HD034561",1,100,"[--- dol]oroso / iussu pravi labori[s] / qui semp(e)r fui cu/pidus meorum / dis(p)arsa nomin/a res(ti)tuere in u/num Sex(tus) Fuficius / Cleme(n)s / in agro p(edes) XX / in f(r)ont(e) p(edes) XV","doloroso iussu pravi laboris qui semper fui cupidus meorum disparsa nomina restituere in unum Sextus Fuficius Clemens in agro pedes XX in fronte pedes XV","epitaph","epitaph","stele","Dalmatia","Dalmatia","Zadar / Iader","Iader","Zadar","tria nomina, viri",44.115501,15.223778,1
"386",6850,475311,"EDCS-10000899","HD019557",1,100,"C(aius) Vettidi[us] / Hilarus / C(aius) Plotius / Blandus / pro indivi[so] / in f(ronte) p(edes) XV / in a(gro) p(edes) XX","Caius Vettidius Hilarus Caius Plotius Blandus pro indiviso in fronte pedes XV in agro pedes XX","epitaph","epitaph","tabula","Dalmatia","Dalmatia","Zadar / Iader","Iader","Zadar","tria nomina, viri",44.115501,15.223778,1
"387",6857,475318,"EDCS-10000906","HD034567",1,100,"------ i]n ag(ro) [p(edes) --] / in [f(ronte) p(edes) --]","in agro pedes in fronte pedes","epitaph","epitaph","NULL","Dalmatia","Dalmatia","Zadar / Iader","Iader","Zadar",NA,44.115501,15.223778,1
"388",6875,475337,"EDCS-10101898","HD035665",1,100,"Dis / Salutari/bus / Cn(aeus) Corne/lius Severus / ob periculum / quod evase/rat","Dis Salutaribus Cnaeus Cornelius Severus ob periculum quod evaserat","votive inscription","votive inscription","altar","Dalmatia","Dalmatia","Zadar / Iader","Iader","Zadar","tria nomina, viri",44.115501,15.223778,1
"389",6943,521651,"EDCS-01601304","HD057307",1,100,"T(itus) Vettidius |(mulieris) l(ibertus) / Phindarus(!) / sibi et Vettid&lt;i&gt;ae / Phiale coni(ugi) / in fr(onte) p(edes) XX / in ag(ro) p(edes) LXX","Titus Vettidius mulieris libertus Phindarus sibi et Vettid lt i gt ae Phiale coniugi in fronte pedes XX in agro pedes LXX","epitaph","epitaph","stele","Venetia et Histria / Regio X","Dalmatia","Aquileia","Tarsatica","Rijeka","liberti/libertae, mulieres, tria nomina, viri",45.3278,14.4444,1
"390",6982,106845,"EDCS-04201550",NA,1,100,NA,"Appuleia Aretusa Caio Trosio Liberali mater ponit militi praetoriae cohortis VI annorum XVIIII",NA,"epitaph",NA,"Dalmatia",NA,"Asseria",NA,NA,"milites, mulieres, tria nomina, viri",44.0099747,15.6690296,1
"391",6983,106846,"EDCS-04202098",NA,1,100,NA,"Lucio Trosio Crescenti Trosia Tertia filia posuit",NA,"epitaph",NA,"Dalmatia",NA,"Asseria",NA,NA,"mulieres, tria nomina, viri",44.0099747,15.6690296,1
"392",7016,107162,"EDCS-71400196",NA,1,100,NA,"menses II",NA,"epitaph",NA,"Dalmatia",NA,"Grab",NA,NA,NA,43.2148243,17.4579442,1
"393",7066,108731,"EDCS-78300176",NA,1,100,NA,"anius",NA,NA,NA,"Dalmatia",NA,"Split / Spalatum",NA,NA,"viri",43.5116383,16.4399659,1
"394",7067,108732,"EDCS-78300177",NA,1,100,NA,"titulum filiae et",NA,"epitaph",NA,"Dalmatia",NA,"Split / Spalatum",NA,NA,"mulieres",43.5116383,16.4399659,1
"395",7088,108907,"EDCS-78300751",NA,1,100,NA,"FA us domo Ger I aquilifer legionis centuria Aemili Pi",NA,"epitaph",NA,"Dalmatia",NA,"Vid / Narona",NA,NA,"milites, viri",43.0804139,17.6258524,1
"396",7089,108908,"EDCS-78300752",NA,1,100,NA,"decurio Alpinorum annorum XL stipendiorum",NA,"epitaph",NA,"Dalmatia",NA,"Vid / Narona",NA,NA,"milites, viri",43.0804139,17.6258524,1
"397",7093,108912,"EDCS-78400001",NA,1,100,NA,"IA oco sacerdos testamento poni iussit",NA,NA,NA,"Dalmatia",NA,"Vid / Narona",NA,NA,"sacerdotes pagani, viri",43.0804139,17.6258524,1
"398",7094,108914,"EDCS-78400003",NA,1,100,NA,"viri ti Iul O O",NA,NA,NA,"Dalmatia",NA,"Vid / Narona",NA,NA,"viri",43.0804139,17.6258524,1
"399",7095,108916,"EDCS-78400004",NA,1,100,NA,"Caio Ca Rest colleg fabr",NA,"epitaph",NA,"Dalmatia",NA,"Vid / Narona",NA,NA,"officium/professio, viri",43.0804139,17.6258524,1
"400",7098,108919,"EDCS-78400007",NA,1,100,NA,"irales Ma faciundum curaverunt",NA,NA,NA,"Dalmatia",NA,"Vid / Narona",NA,NA,NA,43.0804139,17.6258524,1
"401",7099,108921,"EDCS-78400008",NA,1,100,NA,"nes us Marcus Lucius Pomponius",NA,NA,NA,"Dalmatia",NA,"Vid / Narona",NA,NA,"viri",43.0804139,17.6258524,1
"402",7103,108926,"EDCS-78400013",NA,1,100,NA,"verus phra ENVVs",NA,NA,NA,"Dalmatia",NA,"Vid / Narona",NA,NA,"viri",43.0804139,17.6258524,1
"403",7111,108934,"EDCS-78400021",NA,1,100,NA,"Auge uxori ariae Lup",NA,"epitaph",NA,"Dalmatia",NA,"Vid / Narona",NA,NA,"mulieres, viri",43.0804139,17.6258524,1
"404",7113,108936,"EDCS-78400023",NA,1,100,NA,"Bassus",NA,NA,NA,"Dalmatia",NA,"Vid / Narona",NA,NA,"viri",43.0804139,17.6258524,1
"405",7114,108937,"EDCS-78400024",NA,1,100,NA,"Caio Curtio Supero collegium",NA,NA,NA,"Dalmatia",NA,"Vid / Narona",NA,NA,"officium/professio, tria nomina, viri",43.0804139,17.6258524,1
"406",7122,108945,"EDCS-78400032",NA,1,100,NA,"aeus bius m sibi et suis vivus fecit",NA,"epitaph",NA,"Dalmatia",NA,"Vid / Narona",NA,NA,"tria nomina, viri",43.0804139,17.6258524,1
"407",7125,108949,"EDCS-78400036",NA,1,100,NA,"TIS AVG",NA,"identification inscription",NA,"Dalmatia",NA,"Vid / Narona",NA,NA,NA,43.0804139,17.6258524,1
"408",7126,108950,"EDCS-78400037",NA,1,100,NA,"Celsus",NA,NA,NA,"Dalmatia",NA,"Vid / Narona",NA,NA,"viri",43.0804139,17.6258524,1
