"","X","LIST.ID","EDCS.ID","EDH.ID","not_before","not_after","transcription","clean_text_interpretive_word","type_of_inscription_clean","type_of_inscription_auto","type_of_monument_clean","province","province_label_clean","place","findspot_ancient_clean","findspot_modern_clean","status_notation","Latitude","Longitude","count"
"1053",867,468819,"EDCS-67300045","HD056036",71,150,"------] / [---]AV[-] / [---] et(?) Cato/ni con(iugi) et / nepoti an(norum) / XXX et Das/[si]o(?) an(norum) XXV / [---] et / [------","AV et Catoni coniugi et nepoti annorum XXX et Dassio annorum XXV et","epitaph","epitaph","stele","Dalmatia","Dalmatia","Glamoc / Municipium Salvium","Municipium Salvium","Glamoč","mulieres, nomen singulare, viri",44.1301,16.8281,1
"1054",886,468838,"EDCS-67300063","HD056012",71,150,"[---] s(acrum) / [---]V C / [---]I(?)[-] / [------","sacrum V C I","epitaph","epitaph","altar","Dalmatia","Dalmatia","Glamoc / Municipium Salvium","Municipium Salvium","Glamoč",NA,44.1301,16.8281,1
"1055",887,468839,"EDCS-67300064","HD056013",71,150,"I(ovi?) [O(ptimo)? M(aximo)?]","Iovi Optimo Maximo","votive inscription","votive inscription","altar","Dalmatia","Dalmatia","Glamoc / Municipium Salvium","Municipium Salvium","Glamoč",NA,44.1301,16.8281,1
"1056",889,468841,"EDCS-67300066","HD056020",71,150,"I(ovi) O(ptimo) M(aximo) / [------","Iovi Optimo Maximo","votive inscription","votive inscription","altar","Dalmatia","Dalmatia","Glamoc / Municipium Salvium","Salviae","Glamoč",NA,44.0726,16.7894,1
"1057",909,468861,"EDCS-07400599","HD012602",71,150,"I(ovi) O(ptimo) M(aximo) / [------","Iovi Optimo Maximo","votive inscription","votive inscription","altar","Dalmatia","Dalmatia","Glavica / Municipium Salvium","Municipium Salvium","Glamoč",NA,44.1301,16.8281,1
"1058",992,468945,"EDCS-32700504","HD008787",71,150,"I(ovi) O(ptimo) M(aximo) / Cassius / Dasantis / c(o)h(ortis) III Alpin(orum) / tessera(rius) ce(nturia) Nun(nii) / Isiani / v(otum) s(olvit) l(ibens) m(erito)","Iovi Optimo Maximo Cassius Dasantis cohortis III Alpinorum tesserarius centuria Nunnii Isiani votum solvit libens merito","votive inscription","votive inscription","altar","Dalmatia","Dalmatia","Gornji Muc / Andetrium","Andetrium","Muć","milites, nomen singulare, tria nomina, viri",43.6922,16.5206,1
"1059",1327,469293,"EDCS-28400139","HD059982",71,150,"A(ulus) Saufeius P(ubli) f(ilius) Ca[m(ilia)] / Max(imus?) Ansio miles c[oh(ortis)] / VIIII pr(aetoriae) |(centuria) Firmi Ter[tulli] / militavit annis [--- bene]/ficiarius t[rib(uni) tes]/serarius co[rnicular(ius)] / donis do[natus ab] / Imperat[ore ---]/no Cae[sare Aug(usto) tor]/quib[us ---] / [------","Aulus Saufeius Publi filius Camilia Maximus Ansio miles cohortis VIIII praetoriae centuria Firmi Tertulli militavit annis beneficiarius tribuni tesserarius cornicularius donis donatus ab Imperatore no Caesare Augusto torquibus","epitaph","epitaph","NULL","Dalmatia","Dalmatia","Karin Gornji / Corinium","Ansium","Obrovac","Augusti/Augustae, milites, tria nomina, viri",44.179,15.666,1
"1060",1745,469723,"EDCS-29900118","HD028888",71,150,"Leg(io) IIII F(lavia) [f(elix)]","Legio IIII Flavia felix","owner/artist inscription","owner/artist inscription","tile","Dalmatia","Dalmatia","Ljubuski / Mlade / Bigeste","NULL","Ljubuški","milites",43.1904758,17.540558,1
"1061",1999,469988,"EDCS-72900246","HD072453",71,150,"------] / [---]ae / [---]illae / [---]XX / [---]VS / [------","ae illae XX VS","epitaph","epitaph","NULL","Dalmatia","Dalmatia","Obrovac / Clambetae","Ansium","Obrovac","mulieres",44.179,15.666,1
"1062",2244,470242,"EDCS-30101172","HD045068",71,150,"[---]fuius T(iti) f(ilius) Cla(udia) / [---]uter t(estamento) f(ieri) i(ussit) / [---]io [---] / [--- sibi?] et su[is]","fuius Titi filius Claudia uter testamento fieri iussit io sibi et suis","epitaph","epitaph","stele","Dalmatia","Dalmatia","Podgrade / Asseria","Asseria","Benkovac","tria nomina, viri",44.0103,15.6844,1
"1063",2246,470244,"EDCS-34100071","HD029376",71,150,"Rubria Q(uinti) f(ilia) / Rufina / infelicis(s)i/ma sibi p(osuit)","Rubria Quinti filia Rufina infelicissima sibi posuit","epitaph","epitaph","NULL","Dalmatia","Dalmatia","Podgrade / Asseria","Asseria","Benkovac","mulieres, tria nomina",44.0103,15.6844,1
"1064",2576,470579,"EDCS-12000841","HD042310",71,150,"D(is) M(anibus) s(acrum) M(arcus) Gn[orius] / Satyr(us) Gnor[iae] / Secundin(ae) fil(iae) / a(nnorum) XIIX v(ivus) f(ecit) sibi et [suis]","Dis Manibus sacrum Marcus Gnorius Satyrus Gnoriae Secundinae filiae annorum XIIX vivus fecit sibi et suis","epitaph","epitaph","tabula","Dalmatia","Dalmatia","Senj / Segna / Zengg / Senia","Senia","Senj","mulieres, tria nomina, viri",44.9931,14.902,1
"1065",2682,470685,"EDCS-28300131","HD058466",71,150,"Genio / municipii / Fl(avi) Scard(onae) / C(aius) Petronius / Firmus ob / honorem aug(uratus) / l(ocus) d(atus) d(ecreto) d(ecurionum)","Genio municipii Flavi Scardonae Caius Petronius Firmus ob honorem auguratus locus datus decreto decurionum","votive inscription","votive inscription","altar","Dalmatia","Dalmatia","Skradin / Scardona","Scardona","Skradin","sacerdotes pagani, tria nomina, viri",43.8227,15.9208,1
"1066",6109,474555,"EDCS-10000220","HD032932",71,150,"T(ito) Flavio Blodi f(ilio) / Plasso patri / pientissimo an(norum) L / et Flaviae Tattae matri / an(norum) XXXX bene meritae / et T(ito) Flavio Epicado fratri / an(norum) XII et T(ito) Flavio Laedioni / [---] aed(ili) IIIIvir(o) i(ure) d(icundo) Naronae / [---] Laedio f(ilius) vivos(!) sibi et s(uis) f(ecit)","Tito Flavio Blodi filio Plasso patri pientissimo annorum L et Flaviae Tattae matri annorum XXXX bene meritae et Tito Flavio Epicado fratri annorum XII et Tito Flavio Laedioni aedili IIII viro iure dicundo Naronae Laedio filius vivos sibi et suis fecit","epitaph","epitaph","altar","Dalmatia","Dalmatia","Stolac / Rotimlja / Megjina / Diluntum","Diluntum","Stolac, bei","mulieres, nomen singulare, ordo decurionum, tria nomina, viri",43.1138,17.8414,1
"1067",6379,474831,"EDCS-27500107","HD053394",71,150,"P(ublius) Mescenius / Trophimus / T(itus) Flavius Asiaticus / T(itus) Flavius Surus / L(ucius) Bovianius Pareus / IIIIIIviri / ob h(onorem) m(agistri) M(ercuriales)","Publius Mescenius Trophimus Titus Flavius Asiaticus Titus Flavius Surus Lucius Bovianius Pareus IIIIII viri ob honorem magistri Mercuriales","votive inscription","votive inscription","NULL","Dalmatia","Dalmatia","Vid / Narona","Narona","Metković","sacerdotes pagani, seviri Augustales, tria nomina, viri",43.0801,17.625,1
"1068",6434,474886,"EDCS-26600642","HD051076",71,150,"[---] Haline [---] / [---] ann(orum) XV[---] / [--- S]ex(tus) Lusius [---] / [---] Leonas [---] / [---] coniug[i ------","Haline annorum XV Sextus Lusius Leonas coniugi","epitaph","epitaph","NULL","Dalmatia","Dalmatia","Vid / Narona","Narona","Metković","mulieres, tria nomina, viri",43.0801,17.625,1
"1069",6921,475384,"EDCS-10100768","HD034076",71,150,"I(ovi) O(ptimo) M(aximo) / Fulgerali / Vesii / Ravonius / et Hermes / v(otum) s(olverunt) l(ibentes) m(erito)","Iovi Optimo Maximo Fulgerali Vesii Ravonius et Hermes votum solverunt libentes merito","votive inscription","votive inscription","altar","Dalmatia","Dalmatia","Zupa","NULL","Drvar","tria nomina, viri",43.3369154,17.1125675,1
"1070",1865,469851,"EDCS-28300189","HD058231",98,150,"Divo Nervae / d(ecreto) d(ecurionum)","Divo Nervae decreto decurionum","honorific inscription","honorific inscription","NULL","Dalmatia","Dalmatia","Nadin / Nedinum","Nedinum","Benkovac","Augusti/Augustae, viri",44.0721,15.5095,1
"1071",221,468148,"EDCS-10100565","HD033834",101,150,"Ulpiae T(iti) f(iliae) / Proculae an(norum) XX / T(itus) F(lavius) Valens Varron(is) / f(ilius) princeps Desitiati(um) / et Aelia Iusta / Scenobar[bi f(ilia)] / [------","Ulpiae Titi filiae Proculae annorum XX Titus Flavius Valens Varronis filius princeps Desitiatium et Aelia Iusta Scenobarbi filia","epitaph","epitaph","NULL","Dalmatia","Dalmatia","Breza","Hedum Castellum Daesitiatium","Breza","mulieres, nomen singulare, ordo decurionum, tria nomina, viri",44.0184,18.2634,1
"1072",222,468149,"EDCS-10100566","HD033859",101,150,"Ael[ia] Mar/cel[la] an(norum) XX / P(ublius) Ae[lius ---]mael/[------","Aelia Marcella annorum XX Publius Aelius mael","epitaph","epitaph","tabula","Dalmatia","Dalmatia","Breza","Hedum Castellum Daesitiatium","Breza","mulieres, tria nomina, viri",44.0184,18.2634,1
"1073",227,468154,"EDCS-10100571","HD033866",101,150,"Dis / [Manibus] / [------] / Clario an(norum) [---] / posuerunt Ur[sus] / et Dassius pat[ri] / h(ic) s(itus) es[t]","Dis Manibus Clario annorum posuerunt Ursus et Dassius patri hic situs est","epitaph","epitaph","tabula","Dalmatia","Dalmatia","Breza","Hedum Castellum Daesitiatium","Breza","nomen singulare, viri",44.0184,18.2634,1
"1074",261,468190,"EDCS-10100680","HD033998",101,150,"D(is) M(anibus) / [------","Dis Manibus","epitaph","epitaph","stele","Dalmatia","Dalmatia","Brodarevo","NULL","Prijepolje",NA,43.2309869,19.7176308,1
"1075",262,468191,"EDCS-10100681","HD033999",101,150,"[D(is)] M(anibus) / [------","Dis Manibus","epitaph","epitaph","stele","Dalmatia","Dalmatia","Brodarevo","NULL","Prijepolje",NA,43.2309869,19.7176308,1
"1076",268,468198,"EDCS-64100440","HD072510",101,150,"C(aio) Octavi(o) / Silvestro","Caio Octavio Silvestro","epitaph","epitaph","NULL","Dalmatia","Dalmatia","Budva / Buthoe","Buthoe","Budva","tria nomina, viri",42.2789,18.8351,1
"1077",286,468216,"EDCS-10100489","HD033742",101,150,"D(is) M(anibus) / C(aio) T[essio] Mar/cell[i]no p[---] / [q(ui) vixit?] an(nos) XXII[---] / C(aio) Tes(sio) Paterno / [---]co[---]iov / [vix(it)] ann(os) VIII / Ulp(ia) Ma[rci f(ilia)?] Bi/dna(?) filio [---]t / marito / pientissimis","Dis Manibus Caio Tessio Marcellino p qui vixit annos XXII Caio Tessio Paterno co iov vixit annos VIII Ulpia Marci filia Bidna filio t marito pientissimis","epitaph","epitaph","stele","Dalmatia","Dalmatia","Bukovica / Domavium","NULL","Ljubovija","mulieres, tria nomina, viri",43.2286111,18.1138889,1
"1078",328,468258,"EDCS-31200529","HD051034",101,150,"L(ucio) Arrun/tio / Maroni / [------","Lucio Arruntio Maroni","epitaph","epitaph","stele","Dalmatia","Dalmatia","Burnum","Asseria","Benkovac","tria nomina, viri",44.0103,15.6844,1
"1079",378,468319,"EDCS-27400597","HD053359",101,150,"P(ublio) Marcio / P(ubli) f(ilio) Trom(entina) / Messiano / Varius Fes/tus heres / ex testam(ento) / posuit / l(ocus) d(atus) d(ecreto) d(ecurionum)","Publio Marcio Publi filio Tromentina Messiano Varius Festus heres ex testamento posuit locus datus decreto decurionum","honorific inscription","honorific inscription","NULL","Dalmatia","Dalmatia","Cavtat / Epidaurum","Epidaurum","Konavle","tria nomina, viri",42.5848,18.2137,1
"1080",475,468418,"EDCS-10000754","HD034189",101,150,"Diis / Manibus / sac(rum) / L(uci) Tetti Luculli","Diis Manibus sacrum Luci Tetti Luculli","epitaph","epitaph","altar","Dalmatia","Dalmatia","Citluk / Aequum","Aequum","Sinj","tria nomina, viri",43.7423,16.6547,1
"1081",823,468775,"EDCS-30100407","HD056324",101,150,"------]EMANS / [---] Platoris / [Da?]esitias vexill(arius) / [e]quit(um) coh(ortis) I Belgar(um) / turma Valeri / Proculi ann(orum) XLV / stipendior(um) XXIV h(ic) s(itus) e(st) / fieri curavit Iulia Ves(---) / coniunx","EMANS Platoris Daesitias vexillarius equitum cohortis I Belgarum turma Valeri Proculi annorum XLV stipendiorum XXIV hic situs est fieri curavit Iulia Ves coniunx","epitaph","epitaph","stele","Dalmatia","Dalmatia","Gardun / Tilurium","Tilurium","Trilj","mulieres, nomen singulare, tria nomina, viri",43.6139,16.689,1
"1082",1096,469054,"EDCS-10100871","HD027216",101,150,"[Das]sius Bastarni / [f(ilius) do]mo Maezaeus / [mile]s coh(ortis) I Belgarum |(centuria) / [Rest]ituti sig(nifer) annor(um) / [---] stip(endiorum) XV t(estamento) f(ieri) i(ussit) cura/[vit] Valerius Maxi/[min]us heres","Dassius Bastarni filius domo Maezaeus miles cohortis I Belgarum centuria Restituti signifer annorum stipendiorum XV testamento fieri iussit curavit Valerius Maximinus heres","epitaph","epitaph","stele","Dalmatia","Dalmatia","Hardomilje / Bigeste","Bigeste","Ljubuški","milites, nomen singulare, tria nomina, viri",43.1818,17.5271,1
"1083",1284,469250,"EDCS-66200106","HD057925",101,150,"Dis Manibus / [---]is H(?)A(?)ER / [---]Q V&lt;e=I&gt;rin(a)e / [---]C con/[iugi ---] / [------? ","Dis Manibus is HAER Q V lt e gt rinae C coniugi","epitaph","epitaph","stele","Dalmatia","Dalmatia","Jurandvor","Curicum","Baška","mulieres, viri",44.9742,14.7407,1
"1084",1473,469446,"EDCS-32300048","HD058155",101,150,"------]us bene [---] / [---]us f(aciendum) c(uravit) arbi[tratu?] / [---] Papiri Maxi[mini?] / [---]ia ex d(ecreto) [d(ecurionum)]","us bene us faciendum curavit arbitratu Papiri Maximini ia ex decreto decurionum","building/dedicatory inscription","building/dedicatory inscription","NULL","Dalmatia","Dalmatia","Knin / Burnum","Burnum","Kistanje","tria nomina, viri",44.0317,15.9936,1
"1085",1557,469532,"EDCS-27400553","HD053188",101,150,"D(is) M(anibus) s(acrum) / Clodiae / Euphrosynae / ann(orum) XXIIII / Clodius / Euphrosynus / et Clodia / Frequentilla / parentes / v(ivi) f(ecerunt) / et Clodio Eu/carpo magistro","Dis Manibus sacrum Clodiae Euphrosynae annorum XXIIII Clodius Euphrosynus et Clodia Frequentilla parentes vivi fecerunt et Clodio Eucarpo magistro","epitaph","epitaph","altar","Dalmatia","Dalmatia","Kotor / Acruvium","Acruvium","Kotor","mulieres, officium/professio, tria nomina, viri",42.4438,18.689,1
"1086",1566,469541,"EDCS-64100446","HD072516",101,150,"D(is) M(anibus) s(acrum) / T(itus) Statius / Lupus / h(ic) s(itus) e(st) / T(itus) Statius / Threptus","Dis Manibus sacrum Titus Statius Lupus hic situs est Titus Statius Threptus","epitaph","epitaph","altar","Dalmatia","Dalmatia","Kotor / Acruvium","Acruvium","Kotor","tria nomina, viri",42.4438,18.689,1
"1087",1570,469545,"EDCS-65500085","HD072579",101,150,"------ i]n memor[iam ------","in memoriam","epitaph","epitaph","NULL","Dalmatia","Dalmatia","Kotor / Acruvium","Acruvium","Kotor",NA,42.4438,18.689,1
"1088",1609,469586,"EDCS-59500045","HD072450",101,150,"------] / [h(oc) m(onumentum)] h(eredem) n(on) s(equetur)","hoc monumentum heredem non sequetur","epitaph","epitaph","altar","Dalmatia","Dalmatia","Krushevo","Ansium","Obrovac",NA,44.179,15.666,1
"1089",1623,469600,"EDCS-28400309","HD061817",101,150,"[---]us Hostid[u]/ces(?) f(ilius) Volso hic / LES in S&lt;y=V&gt;ria D(---) / Titius fratri fecit ","us Hostiduces filius Volso hic LES in S lt y gt ria D Titius fratri fecit","epitaph","epitaph","NULL","Dalmatia","Dalmatia","Labin / Alvona","Albona","Labin","milites, nomen singulare, viri",45.0949,14.1232,1
"1090",1707,469684,"EDCS-07400595","HD012590",101,150,"Lib(ero) P(atri) s(acrum) Ulp(ia) / Victorina pro / salute sua p(osuit)","Libero Patri sacrum Ulpia Victorina pro salute sua posuit","votive inscription","votive inscription","relief","Dalmatia","Dalmatia","Livno / Bariduum / Delminium","NULL","Livno","mulieres, tria nomina",43.8259136,17.0042416,1
"1091",1808,469793,"EDCS-41600117","HD064368",101,150,"D(is) M(anibus) s(acrum) / M(arcus) Ulp(ius) / Iustus / v(ixit) an(nos) XI / h(ic) s(itus) e(st) / Ulpius / Pris/cus pater / faciendum / curavit","Dis Manibus sacrum Marcus Ulpius Iustus vixit annos XI hic situs est Ulpius Priscus pater faciendum curavit","epitaph","epitaph","stele","Dalmatia","Dalmatia","Margegaj","NULL","Tropojë","tria nomina, viri",42.3723673,20.0772378,1
"1092",1925,469911,"EDCS-28400233","HD060343",101,150,"D(is) M(anibus) s(acrum) / Ap(p)uleio / P(ubli) f(ilio) Fron/toni ae(dili) / IIvir(o) q(uin)q(uennali) / pon(tifici) Sae(nia) / Maxima / marito / d(e) s(e) b(ene) m(erito)","Dis Manibus sacrum Appuleio Publi filio Frontoni aedili II viro quinquennali pontifici Saenia Maxima marito de se bene merito","epitaph","epitaph","NULL","Dalmatia","Dalmatia","Nin / Aenona","Aenona","Nin","mulieres, ordo decurionum, sacerdotes pagani, tria nomina, viri",44.2435,15.1842,1
"1093",2034,470027,"EDCS-28400392","HD061797",101,150,"Valeri/o Oclati/no aed(ili) aed(ili) II/vir(o) q(uin)q(uennali) Va/leria Pro/cilla f(ilia) pa/tri v(i)v(a) f(ecit)","Valerio Oclatino aedili aedili II viro quinquennali Valeria Procilla filia patri viva fecit","epitaph","epitaph","NULL","Dalmatia","Dalmatia","Osor / Opsorus","Apsorus","Mali Lošinj","mulieres, ordo decurionum, tria nomina, viri",44.693,14.3919,1
"1094",2065,470059,"EDCS-32300025","HD058535",101,150,"[-?] Ulpius [---] / [---] a[nn(orum)? ------","Ulpius annorum","epitaph","epitaph","tabula","Dalmatia","Dalmatia","Otinovci / Ad Matricem / Delminium","NULL","Kupres","viri",43.9793723,17.3082922,1
"1095",2085,470079,"EDCS-27400575","HD053204",101,150,"M(arcus) Plaet[orius?] / M(arci) f(ilius) Sergia [---] / h(ic) i(lle?) s(itus) e(st) vixit an[nos] / XXV","Marcus Plaetorius Marci filius Sergia hic ille situs est vixit annos XXV","epitaph","epitaph","tabula","Dalmatia","Dalmatia","Perast / Risinium","Risinium","Kotor","viri",42.5098,18.6969,1
"1096",2219,470217,"EDCS-31300302","HD058402",101,150,"Dis M(anibus) sacr(um) / genti Latinianae / et Epicadianae","Dis Manibus sacrum genti Latinianae et Epicadianae","epitaph","epitaph","tabula","Dalmatia","Dalmatia","Podgorica / Doclea","Doclea","Podgorica",NA,42.469,19.2615,1
"1097",2224,470222,"EDCS-03700658","HD040070",101,150,"Arruntiae / C(ai) f(iliae) / Celerinae C(aius) Arrunti/us / Sedatus / filiae carissimae / p(osuit)","Arruntiae Cai filiae Celerinae Caius Arruntius Sedatus filiae carissimae posuit","epitaph","epitaph","NULL","Dalmatia","Dalmatia","Podgrade / Asseria","Asseria","Benkovac","mulieres, tria nomina, viri",44.0103,15.6844,1
"1098",2236,470234,"EDCS-30101164","HD045058",101,150,"D(is) M(anibus) / T(ito) Plaeto/rio T(iti) f(ilio) Postu/mino Iuli/a Severina / fil(io)","Dis Manibus Tito Plaetorio Titi filio Postumino Iulia Severina filio","epitaph","epitaph","tabula","Dalmatia","Dalmatia","Podgrade / Asseria","Asseria","Benkovac","mulieres, tria nomina, viri",44.0103,15.6844,1
"1099",2247,470245,"EDCS-34100072","HD051038",101,150,"D(is) M(anibus) / Rubria R/estuta s(ibi) / viva fecit","Dis Manibus Rubria Restuta sibi viva fecit","epitaph","epitaph","altar","Dalmatia","Dalmatia","Podgrade / Asseria","Asseria","Benkovac","mulieres, tria nomina",44.0103,15.6844,1
"1100",2331,470330,"EDCS-28701323","HD060919",101,150,"D(is) M(anibus) // Tigrini / Tiburtinus / b(ene) m(erenti) p(osuit)","Dis Manibus Tigrini Tiburtinus bene merenti posuit","epitaph","epitaph","NULL","Dalmatia","Dalmatia","Podstrana / Pituntium","Pituntium","Podstrana","nomen singulare, viri",43.4741,16.5681,1
"1101",2400,470401,"EDCS-10000676","HD034032",101,150,"[D(is)] M(anibus) / [---]ci Pane(n)tis / [a]n(norum) LXXX","Dis Manibus ci Panentis annorum LXXX","epitaph","epitaph","NULL","Dalmatia","Dalmatia","Promajna","NULL","Baška Voda","tria nomina, viri",43.3348513,16.9737189,1
"1102",2454,470456,"EDCS-27400561","HD053199",101,150,"P(ublia) Luci filia / Saecunda(!) / annorum / XXVI h(ic) s(ita) e(st)","Publia Luci filia Saecunda annorum XXVI hic sita est","epitaph","epitaph","tabula","Dalmatia","Dalmatia","Risan / Risano / Risinium","Risinium","Kotor","mulieres, tria nomina",42.5098,18.6969,1
"1103",2460,470462,"EDCS-27400568","HD053206",101,150,"D(is) M(anibus) s(acrum) / Statiae / Paulinae / an(norum) VII","Dis Manibus sacrum Statiae Paulinae annorum VII","epitaph","epitaph","NULL","Dalmatia","Dalmatia","Risan / Risano / Risinium","Risinium","Kotor","mulieres, tria nomina",42.5098,18.6969,1
"1104",2462,470464,"EDCS-26600667","HD050267",101,150,"T(itus) Hate/rius / Hila/rus / ob / hono/rem","Titus Haterius Hilarus ob honorem","votive inscription","votive inscription","honorific/grave/votive column","Dalmatia","Dalmatia","Risan / Risano / Risinium","Narona","Metković","tria nomina, viri",43.0801,17.625,1
"1105",2482,470484,"EDCS-64100453","HD072514",101,150,"D(is) M(anibus) s(acrum) // S(exto) Caeso/nio Pulch&lt;r&gt;/o &lt;an=NA&gt;n(orum) XXXVII ","Dis Manibus sacrum Sexto Caesonio Pulch lt r gt o lt anA gt norum XXXVII","epitaph","epitaph","NULL","Dalmatia","Dalmatia","Risan / Risano / Risinium","Risinium","Kotor","tria nomina, viri",42.5098,18.6969,1
"1106",2565,470567,"EDCS-10000200","HD032896",101,150,"D(is) M(anibus) / Ulpia Pa/ula viva / [si]bi e[t] / [------","Dis Manibus Ulpia Paula viva sibi et","epitaph","epitaph","stele","Dalmatia","Dalmatia","Sarajevo / Aquae S[]","NULL","Sarajevo, Centar","mulieres, tria nomina",43.8519774,18.3866868,1
"1107",2587,470590,"EDCS-10000331","HD033619",101,150,"Lib(ero) Pat(ri) / L(ucius) Gavius Optatus sac(erdos) / Liburnor(um) immemor(iam)(!) Gaviae / L(uci) f(ilae) Maximae matris templum / a parte dextra aedic(ulae) libero / aditu maiori altano cum valvis / et accubitu et sedibus vetustate / corruptum a solo restituit","Libero Patri Lucius Gavius Optatus sacerdos Liburnorum immemoriam Gaviae Luci filae Maximae matris templum a parte dextra aediculae libero aditu maiori altano cum valvis et accubitu et sedibus vetustate corruptum a solo restituit","building/dedicatory inscription","building/dedicatory inscription","block","Dalmatia","Dalmatia","Senj / Segna / Zengg / Senia","Senia","Senj","mulieres, sacerdotes pagani, tria nomina",44.9931,14.902,1
"1108",2596,470599,"EDCS-10101970","HD035330",101,150,"D(is) M(anibus) s(acrum) / Super / h(ic) s(itus) e(st) / v(ixit) a(nnos) II m(enses) VII","Dis Manibus sacrum Super hic situs est vixit annos II menses VII","epitaph","epitaph","tabula","Dalmatia","Dalmatia","Shkoder / Shkodra / Skutari / Scodra","Scodra","Shkodra","nomen singulare, viri",42.0743,19.5277,1
"1109",2625,470628,"EDCS-28400257","HD061283",101,150,"Di(s) M(anibus) / Andes / et(?) Cleus(?) / v(ivi) p(osuerunt) sibi a(nnorum) LXX / Caius / [--]MON[-]","Dis Manibus Andes et Cleus vivi posuerunt sibi annorum LXX Caius MON","epitaph","epitaph","urn","Dalmatia","Dalmatia","Siroka Kula","Epidotium - Ancus","Gospić","nomen singulare, viri",44.6142,15.4557,1
"1110",2715,470718,"EDCS-10000291","HD033229",101,150,"------] / [VIvir? Au]gustalis / [---]atria Felicla / [---]ria M(arci) f(ilia) Secunda / [v(otum)] s(olverunt) l(ibentes) m(erito)","VI vir Augustalis atria Felicla ria Marci filia Secunda votum solverunt libentes merito","votive inscription","votive inscription","altar","Dalmatia","Dalmatia","Skradin / Scardona","Scardona","Skradin","mulieres, seviri Augustales, tria nomina",43.8227,15.9208,1
"1111",6238,474686,"EDCS-28300004","HD058437",101,150,"Dis Manibus / [s]acrum / C(aius) Vibius C(ai) f(ilius) Pompt(ina) / Pude(n)s dom(o) Arret(io) / |(centurio) leg(ionis) VII C(laudiae) p(iae) f(idelis) vivos(!) fec(it) / sibi et Iuliae C(ai) f(iliae) Pollae / uxori","Dis Manibus sacrum Caius Vibius Cai filius Pomptina Pudens domo Arretio centurio legionis VII Claudiae piae fidelis vivos fecit sibi et Iuliae Cai filiae Pollae uxori","epitaph","epitaph","NULL","Dalmatia","Dalmatia","Trogir / Tragurium","Tragurium","Trogir, bei","milites, mulieres, tria nomina, viri",43.5594,16.524,1
"1112",6371,474823,"EDCS-27500102","HD053386",101,150,"Mercurio Aug(usto) sacr(um) / M(arcus) Ulpius Aug(usti) lib(ertus) Nedymus / C(aius) Pollius [Alb]anus / T(itus) Vetul[enus T(iti) l(ibertus)] Abas[ca]ntus / Q(uintus) Cornelius Augustalis / L(ucius) Volceius Cerdo / IIIIIIviri m(agistri) M(ercuriales) ob hon(orem)","Mercurio Augusto sacrum Marcus Ulpius Augusti libertus Nedymus Caius Pollius Albanus Titus Vetulenus Titi libertus Abascantus Quintus Cornelius Augustalis Lucius Volceius Cerdo IIIIII viri magistri Mercuriales ob honorem","votive inscription","votive inscription","NULL","Dalmatia","Dalmatia","Vid / Narona","Narona","Metković","liberti/libertae, seviri Augustales, tria nomina, viri",43.0801,17.625,1
"1113",6378,474830,"EDCS-26600665","HD050196",101,150,"------] / M(arcus) Lusi[us] / Trofimas / M(arci) lib(ertus) / IIIIIIvir / m(agister) M(ercurialis) ob h(onorem)","Marcus Lusius Trofimas Marci libertus IIIIII vir magister Mercurialis ob honorem","votive inscription","votive inscription","NULL","Dalmatia","Dalmatia","Vid / Narona","Narona","Metković","liberti/libertae, sacerdotes pagani, seviri Augustales, tria nomina, viri",43.0801,17.625,1
"1114",6450,474902,"EDCS-27500168","HD053584",101,150,"D(is) M(anibus) / Pomponiae Messillae / coniugi karissimae ann(orum) XXV / et Lusiae Proculae coniugi / et Lusio Rufino adfini / L(ucius) Caerellius Proculus / v(ivus) f(ecit) sibi et / lib(ertis) libertabusq(ue) suis","Dis Manibus Pomponiae Messillae coniugi karissimae annorum XXV et Lusiae Proculae coniugi et Lusio Rufino adfini Lucius Caerellius Proculus vivus fecit sibi et libertis libertabus que suis","epitaph","epitaph","NULL","Dalmatia","Dalmatia","Vid / Narona","Narona","Čapljina","mulieres, tria nomina, viri",43.0645,17.6884,1
"1115",6455,474907,"EDCS-27500148","HD053591",101,150,"D(is) M(anibus) / L(ucio) Salvio / Saturnino / marito optimo / et Probae lib(ertae) / et Lusiae P(ubli) f(iliae) / Memoriae ann(orum) / XXXII m(ensium) VI Clau/dia Probilla mater / infelicissima / filiae pientissimae / et sibi v(iva) f(ecit)","Dis Manibus Lucio Salvio Saturnino marito optimo et Probae libertae et Lusiae Publi filiae Memoriae annorum XXXII mensium VI Claudia Probilla mater infelicissima filiae pientissimae et sibi viva fecit","epitaph","epitaph","NULL","Dalmatia","Dalmatia","Vid / Narona","Narona","Metković","liberti/libertae, mulieres, nomen singulare, praenomen et nomen, tria nomina, viri",43.0801,17.625,1
"1116",6780,475239,"EDCS-28400213","HD060121",101,150,"D(is) M(anibus) / P(ublio) Vettio Maritimo P(ubli) f(ilio) Annia / [------","Dis Manibus Publio Vettio Maritimo Publi filio Annia","epitaph","epitaph","NULL","Dalmatia","Dalmatia","Zadar / Iader","Iader","Zadar","mulieres, tria nomina, viri",44.115501,15.223778,1
