"","X","LIST.ID","EDCS.ID","EDH.ID","not_before","not_after","transcription","clean_text_interpretive_word","type_of_inscription_clean","type_of_inscription_auto","type_of_monument_clean","province","province_label_clean","place","findspot_ancient_clean","findspot_modern_clean","status_notation","Latitude","Longitude","count"
"208",1175,469138,"EDCS-28300162","HD058165",42,100,"L(ucius) Cassius L(uci) f(ilius) / Trom(entina) Marti/alis Aq(uae) Sta(tiellae) / mil(es) leg(ionis) XI / C(laudiae) p(iae) f(idelis) / |(centuria) Pulpidi Sil/vestris / stip(endiorum) XII an(norum) XXXV / t(itulum) f(ieri) i(ussit) h(eres) f(aciendum) c(uravit)","Lucius Cassius Luci filius Tromentina Martialis Aquae Statiellae miles legionis XI Claudiae piae fidelis centuria Pulpidi Silvestris stipendiorum XII annorum XXXV titulum fieri iussit heres faciendum curavit","epitaph","epitaph","tabula","Dalmatia","Dalmatia","Ivosevci / Burnum","Burnum","Kistanje","milites, tria nomina, viri",44.0317,15.9936,1
"209",1176,469139,"EDCS-28300163","HD058137",42,100,"[D(is) M(anibus)](?) / [A(ulus)? ---]ubiu[s] A(uli) [f(ilius)?] / [Cel]er |(centurio) leg(ionis) XI C(laudiae) / p(iae) f(idelis) domo Vero/na ann(orum) LXIII stip(endiorum) / XXXXIII t(itulum) f(ieri) iussit / Panthagathus / lib(ertus) f(aciendum) c(uravit)","Dis Manibus Aulus ubius Auli filius Celer centurio legionis XI Claudiae piae fidelis domo Verona annorum LXIII stipendiorum XXXXIII titulum fieri iussit Panthagathus libertus faciendum curavit","epitaph","epitaph","altar","Dalmatia","Dalmatia","Ivosevci / Burnum","Burnum","Kistanje","liberti/libertae, milites, nomen singulare, tria nomina, viri",44.0317,15.9936,1
"210",1177,469140,"EDCS-28300164","HD058166",9,42,"T(itus) Cominius / C(ai) f(ilius) R[o]milia / Ateste miles / leg(ionis) XI anno/rum XL stip(endiorum) XVI / h(ic) s(itus) e(st) frat[e]r / fratri posuit / vixsi(!) quoad potui sem/per bene pauper honeste / [fr]audavi nullum nunc iuvat / [os]sa mea","Titus Cominius Cai filius Romilia Ateste miles legionis XI annorum XL stipendiorum XVI hic situs est frater fratri posuit vixsi quoad potui semper bene pauper honeste fraudavi nullum nunc iuvat ossa mea","epitaph","epitaph","tabula","Dalmatia","Dalmatia","Ivosevci / Burnum","Burnum","Kistanje","milites, tria nomina, viri",44.0317,15.9936,1
"211",1178,469141,"EDCS-28300165","HD061408",-20,9,"Sal(vius) Frebranus T(iti) f(ilius) / Quir(ina) Baculus has(tatus) / pri(or) leg(ionis) XX","Salvius Frebranus Titi filius Quirina Baculus hastatus prior legionis XX","epitaph","epitaph","NULL","Dalmatia","Dalmatia","Ivosevci / Burnum","Burnum","Kistanje","milites, tria nomina, viri",44.0317,15.9936,1
"212",1179,469143,"EDCS-28300167","HD061410",1,150,"I[--]M(?)A(?)[---] / NAEV[---] / Q(uinti) lib(erti) Primi / Q(uintus) Naevius C(ai) / f(ilius) Vol(tinia) / Ponticus signif(er)","I MA NAEV Quinti liberti Primi Quintus Naevius Cai filius Voltinia Ponticus signifer","epitaph","epitaph","NULL","Dalmatia","Dalmatia","Ivosevci / Burnum","Burnum","Kistanje","liberti/libertae, milites, tria nomina, viri",44.0317,15.9936,1
"213",1180,469144,"EDCS-28300168","HD061411",42,69,"Q(uintus) Valerius / Q(uinti) f(ilius) Ani(ensis) Niger / domo Foro / Iu[l]i(i) vet(eranus) leg(ionis) X[I] / C(laudiae) p(iae) f(idelis) ann(orum) XLV / stip(endiorum) XXIIII h(ic) s(itus) e(st) / t(estamento) f(ieri) i(ussit) C(aius) Pontius / et Q(uintus) Gussius h(eredes) f(ecerunt)","Quintus Valerius Quinti filius Aniensis Niger domo Foro Iulii veteranus legionis XI Claudiae piae fidelis annorum XLV stipendiorum XXIIII hic situs est testamento fieri iussit Caius Pontius et Quintus Gussius heredes fecerunt","epitaph","epitaph","NULL","Dalmatia","Dalmatia","Ivosevci / Burnum","Ninia","Knin","milites, praenomen et nomen, tria nomina, viri",44.0408,16.1994,1
"214",1186,469150,"EDCS-30301399","HD061475",1,100,"Iovi Op(timo) M(aximo) / T(itus) Fufisius sig(nifer) / v(otum) s(olvit) l(ibens) m(erito)","Iovi Optimo Maximo Titus Fufisius signifer votum solvit libens merito","votive inscription","votive inscription","altar","Dalmatia","Dalmatia","Ivosevci / Burnum","Burnum","Kistanje","milites, praenomen et nomen, viri",44.0317,15.9936,1
"215",1189,469153,"EDCS-31300272","HD058464",88,96,"[Termini p]o[s(iti) inter p]ra/ta leg(ionis) [e]t fines / roboreti Fla(vi) / Marc(iani) per Augu/stianum Belli/c(i?)um proc(uratorem) / Aug(usti)","Termini positi inter prata legionis et fines roboreti Flavi Marciani per Augustianum Bellicium procuratorem Augusti","boundary inscription","boundary inscription","tabula","Dalmatia","Dalmatia","Ivosevci / Burnum","NULL","Biskupija","ordo equester, tria nomina, viri",44.0160408,16.0072244,1
"216",1190,469154,"EDCS-31400326","HD061449",42,69,"L(ucius) Va[leri]us L(uci) f(ilius) / Vo[lt(inia) V]erus / domo [L]uco Au[g(usti)] / mi[l(es) leg(ionis)] &lt;X=V&gt;I C(laudiae) p(iae) &lt;f=B&gt;(idelis) / ann(orum) [---]I stip(endiorum) / XVI[I](?) h(ic) s[it(us)] e(st) / &lt;t=I&gt;(estamento) f(ieri) &lt;i=P&gt;(ussit) P(ublius) [A]nnius / Aqu[ila?] f(aciendum) c(uravit) ","Lucius Valerius Luci filius Voltinia Verus domo Luco Augusti miles legionis lt X gt I Claudiae piae lt f gt idelis annorum I stipendiorum XVII hic situs est lt t gt estamento fieri lt i gt ussit Publius Annius Aquila faciendum curavit","epitaph","epitaph","NULL","Dalmatia","Dalmatia","Ivosevci / Burnum","Burnum","Ervenik","milites, tria nomina, viri",44.0317,15.9936,1
"217",1191,469155,"EDCS-31400327","HD061450",1,150,"------](?) / [-] Caerelli[us] / [-](?) Q(uinti) lib(ertus) Palat(ina) [---] / [-]icus domo [---] / [a]n(norum) [---]XXX h(ic?) [s(itus)? e(st)?] / [------?","Caerellius Quinti libertus Palatina icus domo annorum XXX hic situs est","epitaph","epitaph","NULL","Dalmatia","Dalmatia","Ivosevci / Burnum","Burnum","Ervenik","liberti/libertae, tria nomina, viri",44.0317,15.9936,1
"218",1193,469157,"EDCS-29900060","HD058168",42,100,"Sub hac in/scriptione / M(arcus) Cupitius / M(arci) f(ilius) Pol(lia) / Paulus / Amasia / miles leg(ionis) / XI C(laudiae) p(iae) f(idelis) stip/endiorum / XVII Cupitius / Pol(l)io frater / faciundum / curavit","Sub hac inscriptione Marcus Cupitius Marci filius Pollia Paulus Amasia miles legionis XI Claudiae piae fidelis stipendiorum XVII Cupitius Pollio frater faciundum curavit","epitaph","epitaph","stele","Dalmatia","Dalmatia","Ivosevci / Burnum","Burnum","Kistanje","milites, tria nomina, viri",44.0317,15.9936,1
"219",1196,469160,"EDCS-32700556","HD014697",151,200,"Herculi sa[c(rum)] / Claudius / Peregrinu[s] / dec(urio) coh(ortis) I Be[l]/garum v(otum) s(olvit) / l(ibens) m(erito)","Herculi sacrum Claudius Peregrinus decurio cohortis I Belgarum votum solvit libens merito","votive inscription","votive inscription","altar","Dalmatia","Dalmatia","Ivosevci / Burnum","Burnum","Kistanje","milites, tria nomina, viri",44.0317,15.9936,1
"220",1204,469168,"EDCS-32700564","HD061331",151,300,"------] / [---] b(ene)f(iciarius) [---] / [---]A(?)S [---] / [v(otum?) s(olvit?) l(ibens?)] m(erito?) [---](?)","beneficiarius AS votum solvit libens merito","votive inscription","votive inscription","NULL","Dalmatia","Dalmatia","Ivosevci / Burnum","Burnum","Kistanje","milites, viri",44.0317,15.9936,1
"221",1205,469169,"EDCS-32700565","HD061332",151,300,"D(is) M(anibus) / Aelio Mes/siano vete/rano defu/ncto ann(orum) LXX / Tesonia Iuli/an(a)e(!) pientissimo / marito et sibi / se viva fecit","Dis Manibus Aelio Messiano veterano defuncto annorum LXX Tesonia Iulianae pientissimo marito et sibi se viva fecit","epitaph","epitaph","stele","Dalmatia","Dalmatia","Ivosevci / Burnum","Burnum","Kistanje","milites, mulieres, tria nomina, viri",44.0317,15.9936,1
"222",1207,469171,"EDCS-32700567","HD061333",1,150,"------] / [---]onius / [---] Vienn(a) / [--- l]eg(ionis) VII[---] / [---] sti[p(endiorum) ---] / [------","onius Vienna legionis VII stipendiorum","epitaph","epitaph","NULL","Dalmatia","Dalmatia","Ivosevci / Burnum","Burnum","Kistanje","milites, viri",44.0317,15.9936,1
"223",1208,469172,"EDCS-32700568","HD061334",1,150,"C(aius) Av[---](?) / C(ai) f(ilius) Fa[---] / mil(es) leg(ionis) [---] / XXI h(ic) [s(itus) e(st)]","Caius Av Cai filius Fa miles legionis XXI hic situs est","epitaph","epitaph","NULL","Dalmatia","Dalmatia","Ivosevci / Burnum","Burnum","Kistanje","milites, viri",44.0317,15.9936,1
"224",1209,469173,"EDCS-32700569","HD061335",1,100,"[---] Caesius / [---]cla Secu/[ndu]s Iu(v)av(o) mil(es) / [---] O(?)I(?)I(?)C(?)A / [---] / [------?","Caesius cla Secundus Iuvavo miles OIICA","epitaph","epitaph","stele","Dalmatia","Dalmatia","Ivosevci / Burnum","Burnum","Kistanje","milites, tria nomina, viri",44.0317,15.9936,1
"225",1210,469174,"EDCS-32700570","HD061336",69,86,"P(ublio) Carsidi/o P(ubli) f(ilio) Gal(eria) / Calvo Lugd(uno) / aquilifero / leg(ionis) IIII F(laviae) f(elicis) ann{n}(orum) / XLI stip(endiorum) XIIX / h(ic) s(itus) e(st)","Publio Carsidio Publi filio Galeria Calvo Lugduno aquilifero legionis IIII Flaviae felicis annnorum XLI stipendiorum XIIX hic situs est","epitaph","epitaph","stele","Dalmatia","Dalmatia","Ivosevci / Burnum","Burnum","Kistanje","milites, tria nomina, viri",44.0317,15.9936,1
"226",1211,469175,"EDCS-32700571","HD028174",9,69,"L(ucius) Cicereiu[s - f(ilius) Ani(ensis) Lep?]/idus Arim(ini) [mil(es) leg(ionis) XI] / Cicerei Laevi p[rimipilaris] / leg(ionis) XI [---] / Cicerei Ascan[i primipila?]ris leg(ionis) XI VI[---]","Lucius Cicereius filius Aniensis Lepidus Arimini miles legionis XI Cicerei Laevi primipilaris legionis XI Cicerei Ascani primipilaris legionis XI VI","NULL",NA,"NULL","Dalmatia","Dalmatia","Ivosevci / Burnum","Burnum","Kistanje","milites, tria nomina, viri",44.0317,15.9936,1
"227",1212,469176,"EDCS-32700572","HD055081",42,69,"C(aius) Coccius / C(ai) f(ilius) Vetur(ia) / [T]ertius Plac(entia) / mil(es) leg(ionis) XI C(laudiae) p(iae) f(idelis) / stip(endiorum) XII |(centuria) Caecil(i) / Sabini benef(iciarius) / tribuni / [h(eres)] f(aciendum) c(uravit)","Caius Coccius Cai filius Veturia Tertius Placentia miles legionis XI Claudiae piae fidelis stipendiorum XII centuria Caecili Sabini beneficiarius tribuni heres faciendum curavit","epitaph","epitaph","stele","Dalmatia","Dalmatia","Ivosevci / Burnum","Burnum","Kistanje","milites, tria nomina, viri",44.0317,15.9936,1
"228",1213,469177,"EDCS-32700573","HD061350",42,69,"------] / XIII[---] / Q(uinto) Com[inio? - f(ilio)] / Ani(ensi) Cre[mona] / mil(iti) leg(ionis) XI [Cl(audiae) p(iae) f(idelis) ann(orum)] / XXIIX stip(endiorum) [---] / h(ic) s(iti) s(unt) fr(ater) f[ac(iendum)? cur(avit)?]","XIII Quinto Cominio filio Aniensi Cremona militi legionis XI Claudiae piae fidelis annorum XXIIX stipendiorum hic siti sunt frater faciendum curavit","epitaph","epitaph","stele","Dalmatia","Dalmatia","Ivosevci / Burnum","Burnum","Kistanje","milites, viri",44.0317,15.9936,1
"229",1214,469178,"EDCS-32700574","HD061352",42,69,"C(aius) Fabricius C(ai) f(ilius) Ouf(entia) Pri/mus Como miles / leg(ionis) XI C(laudiae) p(iae) f(idelis) |(centuria) Gemini / Flavi stip(endiorum) XX / ann(orum) XXXVIII testame(nto) / f(ieri) iussit her(es) / faciundum curavit","Caius Fabricius Cai filius Oufentia Primus Como miles legionis XI Claudiae piae fidelis centuria Gemini Flavi stipendiorum XX annorum XXXVIII testamento fieri iussit heres faciundum curavit","epitaph","epitaph","stele","Dalmatia","Dalmatia","Ivosevci / Burnum","Burnum","Kistanje","milites, tria nomina, viri",44.0317,15.9936,1
"230",1215,469179,"EDCS-32700575","HD058296",42,69,"L(ucius) Flavius / L(uci) f(ilius) Fab(ia) Vale/ns Heracle/a mil(es) leg(ionis) XI C(laudiae) p(iae) f(idelis) / |(centuria) Iuli Prisci an(norum) / XLII stip(endiorum) XXII / |(centuria) Iuli Prisci / h(eres) f(aciendum) c(uravit)","Lucius Flavius Luci filius Fabia Valens Heraclea miles legionis XI Claudiae piae fidelis centuria Iuli Prisci annorum XLII stipendiorum XXII centuria Iuli Prisci heres faciendum curavit","epitaph","epitaph","stele","Dalmatia","Dalmatia","Ivosevci / Burnum","Burnum","Kistanje","milites, tria nomina, viri",44.0317,15.9936,1
"231",1216,469180,"EDCS-31200486","HD028171",9,69,"P(ublius) Gosseli/us Q(uinti) f(ilius) An(i)e(nsis) / Cre(mona) mil(es) leg(ionis) / XI sig(nifer) an(n)or(um) / XL st(ipendiorum) XIIII / h(ic) s(itus) e(st)","Publius Gosselius Quinti filius Aniensis Cremona miles legionis XI signifer annorum XL stipendiorum XIIII hic situs est","epitaph","epitaph","stele","Dalmatia","Dalmatia","Ivosevci / Burnum","Burnum","Kistanje","milites, praenomen et nomen, viri",44.0317,15.9936,1
"232",1217,469181,"EDCS-04600017","HD039874",70,86,"Q(uinto) Iu(l)io Ar(nensi) / Felici mil(iti) / leg(ionis) IIII F(laviae) F(elicis) / ann(orum) XL sti(pendiorum) XIIX / t(estamento) f(ieri) i(ussit) / [Q(uintus)?] Iulius Caesa[rus?]","Quinto Iulio Arnensi Felici militi legionis IIII Flaviae Felicis annorum XL stipendiorum XIIX testamento fieri iussit Quintus Iulius Caesarus","epitaph","epitaph","stele","Dalmatia","Dalmatia","Ivosevci / Burnum","Burnum","Kistanje","milites, tria nomina, viri",44.0317,15.9936,1
"233",1219,469183,"EDCS-10000842","HD034381",151,250,"I(ovi) O(ptimo) M(aximo) / C(aius) Iulius / Victorin/us b(ene)f(iciarius) c[o(n)]s(ularis) / v(otum) s(olvit)","Iovi Optimo Maximo Caius Iulius Victorinus beneficiarius consularis votum solvit","votive inscription","votive inscription","altar","Dalmatia","Dalmatia","Ivosevci / Burnum","Burnum","Kistanje","milites, tria nomina, viri",44.0317,15.9936,1
"234",1220,469184,"EDCS-10000843","HD034382",238,271,"I(ovi) O(ptimo) M(aximo) / et G(enio) loci / M(arcus) Aurel(ius) / Dalmata / protec(tor) co(n)s(ularis) / pro be(neficiario) / l(ibens) p(osuit)","Iovi Optimo Maximo et Genio loci Marcus Aurelius Dalmata protector consularis pro beneficiario libens posuit","votive inscription","votive inscription","altar","Dalmatia","Dalmatia","Ivosevci / Burnum","Burnum","Kistanje","milites, tria nomina, viri",44.0317,15.9936,1
"235",1221,469185,"EDCS-10000844","HD034383",171,250,"I(ovi) O(ptimo) M(aximo) / Iunoni Mi/ner(vae) P(ublius) Ael(ius) Se/cund(us) mi(les) l[eg(ionis)] / I adi(utricis) b(ene)f(iciarius) co(n)[s(ularis)] // [------](?)","Iovi Optimo Maximo Iunoni Minervae Publius Aelius Secundus miles legionis I adiutricis beneficiarius consularis","votive inscription","votive inscription","altar","Dalmatia","Dalmatia","Ivosevci / Burnum","Burnum","Kistanje","milites, tria nomina, viri",44.0317,15.9936,1
"236",1222,469186,"EDCS-10000845","HD011491",151,330,"[---]rus eq(ues) R(omanus) donu[m dedit]","rus eques Romanus donum dedit","votive inscription","votive inscription","relief","Dalmatia","Dalmatia","Ivosevci / Burnum","Burnum","Kistanje","ordo equester, viri",44.0317,15.9936,1
"237",1223,469187,"EDCS-10000846","HD034384",1,150,"P(ublius) Ceri[sius?] / P(ubli) f(ilius) Sab(atina) I(?)[---] / Fa(---) mil(es) [---] ann(orum) XL [---] / [------","Publius Cerisius Publi filius Sabatina I Fa miles annorum XL","epitaph","epitaph","stele","Dalmatia","Dalmatia","Ivosevci / Burnum","Burnum","Kistanje","milites, tria nomina, viri",44.0317,15.9936,1
"238",1224,469188,"EDCS-10000847","HD034385",42,69,"C(aius) Cottius C(ai) Quiri(na) / Priscinus Aug(---) Ne(---) / mil(es) leg(ionis) XI C(laudiae) p(iae) f(idelis) / stipendioru(m) XVI / annoru(m) XXXV / testamen(to) fier(i) iu/[ssit ------?","Caius Cottius Cai Quirina Priscinus Aug Ne miles legionis XI Claudiae piae fidelis stipendiorum XVI annorum XXXV testamento fieri iussit","epitaph","epitaph","stele","Dalmatia","Dalmatia","Ivosevci / Burnum","Burnum","Kistanje","milites, tria nomina, viri",44.0317,15.9936,1
"239",1225,469189,"EDCS-10000848","HD034386",42,69,"Q(uintus) Iulius Q(uinti) f(ilius) / Ouf(entina) Man/suetus Co/mo miles / leg(ionis) XI C(laudiae) p(iae) f(idelis) / ann(orum) XXXV stip(endiorum) / XIIII t(estamento) f(ieri) i(ussit) Q(uintus) Iul(ius) / Annius mil(es) leg(ionis) / eiusd(em) fratri p(ientissimo) f(aciendum) c(uravit)","Quintus Iulius Quinti filius Oufentina Mansuetus Como miles legionis XI Claudiae piae fidelis annorum XXXV stipendiorum XIIII testamento fieri iussit Quintus Iulius Annius miles legionis eiusdem fratri pientissimo faciendum curavit","epitaph","epitaph","stele","Dalmatia","Dalmatia","Ivosevci / Burnum","Burnum","Kistanje","milites, tria nomina, viri",44.0317,15.9936,1
"240",1226,469190,"EDCS-10000849","HD034387",42,69,"L(ucius) Laberius / L(uci) f(ilius) Firmus tr/i(bu) Clau(dia) domo / F[o]ro Claudi / mile(s) leg(ionis) XI / [C(laudiae) p(iae)] f(idelis) [annor(um)] XXXV / [stip(endiorum)] XIIII / [h(ic)? s(itus)?] e(st)(?) / T(itus) Talon[i]us Sec[un(dus)] / t(estamento) f(ieri) i(ussit)","Lucius Laberius Luci filius Firmus tribu Claudia domo Foro Claudi miles legionis XI Claudiae piae fidelis annorum XXXV stipendiorum XIIII hic situs est Titus Talonius Secundus testamento fieri iussit","epitaph","epitaph","stele","Dalmatia","Dalmatia","Ivosevci / Burnum","Burnum","Kistanje","milites, tria nomina, viri",44.0317,15.9936,1
"241",1227,469191,"EDCS-10000850","HD034388",42,69,"L(ucius) Magnus / L(uci) Fabia / Cleme(n)s Tavia / mil(es) leg(ionis) XI C(laudiae) p(iae) f(idelis) / optio sti(pendiorum) XI / an(norum) XXX pos(uit) / L(ucius) Salvius / Clemens frater","Lucius Magnus Luci Fabia Clemens Tavia miles legionis XI Claudiae piae fidelis optio stipendiorum XI annorum XXX posuit Lucius Salvius Clemens frater","epitaph","epitaph","stele","Dalmatia","Dalmatia","Ivosevci / Burnum","Burnum","Kistanje","milites, tria nomina, viri",44.0317,15.9936,1
"242",1228,469192,"EDCS-10000851","HD034389",42,69,"Q(uintus) Satrius / Q(uinti) Publilia / Martialis Ver(ona) / mil(es) leg(ionis) XI C(laudiae) p(iae) f(idelis) / ann(orum) XXXIIII / stip(endiorum) XIIII","Quintus Satrius Quinti Publilia Martialis Verona miles legionis XI Claudiae piae fidelis annorum XXXIIII stipendiorum XIIII","epitaph","epitaph","stele","Dalmatia","Dalmatia","Ivosevci / Burnum","Burnum","Kistanje","milites, tria nomina, viri",44.0317,15.9936,1
"243",1229,469193,"EDCS-10000852","HD004410",42,69,"Dis Ma(nibus) / Ter(tius) Anto(nius) / Ter(ti) f(ilius) Pol(lia) Rufi(nus) / Par(ma) mil(es) leg(ionis) XI / C(laudiae) p(iae) f(idelis) stip(endiorum) XVI","Dis Manibus Tertius Antonius Terti filius Pollia Rufinus Parma miles legionis XI Claudiae piae fidelis stipendiorum XVI","epitaph","epitaph","stele","Dalmatia","Dalmatia","Ivosevci / Burnum","Burnum","Kistanje","milites, tria nomina, viri",44.0317,15.9936,1
"244",1230,469194,"EDCS-10000853","HD034390",1,71,"Buccus Staumi / f(ilius) Fab(ia) domo / Brixia miles / coh(ortis) Monta/norum ann(orum) / XXVI stip(endiorum) IIII / h(ic) s(itus) e(st) / t(estamento) f(ieri) i(ussit)","Buccus Staumi filius Fabia domo Brixia miles cohortis Montanorum annorum XXVI stipendiorum IIII hic situs est testamento fieri iussit","epitaph","epitaph","stele","Dalmatia","Dalmatia","Ivosevci / Burnum","Burnum","Kistanje","milites, nomen singulare, viri",44.0317,15.9936,1
"245",1231,469195,"EDCS-10000854","HD034391",1,50,"Heras Ennom/ai f(ilius) mil(es) c(oh)or(tis) II / Cyrr(hestarum) do(mo) Cyr(rh)o / ann(orum) L sti(pendiorum) XXII h(ic) s(itus) e(st) / [---]raeus Ab/emmi f(ilius) (h)er(es) pos(uit)","Heras Ennomai filius miles cohortis II Cyrrhestarum domo Cyrrho annorum L stipendiorum XXII hic situs est raeus Abemmi filius heres posuit","epitaph","epitaph","stele","Dalmatia","Dalmatia","Ivosevci / Burnum","Burnum","Kistanje","milites, nomen singulare, viri",44.0317,15.9936,1
"246",1232,469196,"EDCS-10000855","HD011485",70,80,"Imerix Servofr/edi f(ilius) Batavos(!) / eq(ues) ala(e) / Hispano/[rum I] / [a]nnor(um) XXVIII / stip(endiorum) VIII / [h(ic)] s(itus) e(st) // [---]azicico / [---] et Apulo / [---]co Aetoris f(ilio) / [he?]res","Imerix Servofredi filius Batavos eques alae Hispanorum I annorum XXVIII stipendiorum VIII hic situs est azicico et Apulo co Aetoris filio heres","epitaph","epitaph","stele","Dalmatia","Dalmatia","Ivosevci / Burnum","Burnum","Kistanje","milites, nomen singulare, viri",44.0317,15.9936,1
"247",1243,469207,"EDCS-10101835","HD025906",151,300,"I(ovi) O(ptimo) [M(aximo)] / T(itus) Aure[li]/us Pot[ens] / b(ene)f(iciarius) co(n)s(ularis) [leg(ionis)] / V Ma[ced(onicae)] / v(otum) s(olvit) l(ibens) m(erito)","Iovi Optimo Maximo Titus Aurelius Potens beneficiarius consularis legionis V Macedonicae votum solvit libens merito","votive inscription","votive inscription","altar","Dalmatia","Dalmatia","Ivosevci / Burnum","Burnum","Kistanje","milites, tria nomina, viri",44.0317,15.9936,1
"248",1244,469208,"EDCS-10101837","HD035391",50,50,"[Ti(berius) Claudius Drusi] / [f(ilius) Caesar Aug(ustus) German(icus)] / [pontif(ex) maximus tr(ibunicia) p(otestate) X] / [co(n)s(ul) IIII] imp(erator) XXI p(ater) p(atriae) c[ensor] / [P(ublio) A]nteio Ru[fo leg(ato)] / [Aug(usti) pr(o) p]r(aetore) le[g(io) XI C(laudia) p(ia) f(idelis)]","Tiberius Claudius Drusi filius Caesar Augustus Germanicus pontifex maximus tribunicia potestate X consul IIII imperator XXI pater patriae censor Publio Anteio Rufo legato Augusti pro praetore legio XI Claudia pia fidelis","building/dedicatory inscription","building/dedicatory inscription","NULL","Dalmatia","Dalmatia","Ivosevci / Burnum","Burnum","Kistanje","Augusti/Augustae, milites, ordo senatorius, tria nomina, viri",44.0317,15.9936,1
"249",1245,469209,"EDCS-10101838","HD035392",9,69,"Ter(tius) Baebius C(ai) f(ilius) Sca(ptia) domo Florentia ann(orum) XXXV stip(endiorum) XVII mil(es) leg(ionis) XI cornicen","Tertius Baebius Cai filius Scaptia domo Florentia annorum XXXV stipendiorum XVII miles legionis XI cornicen","epitaph","epitaph","NULL","Dalmatia","Dalmatia","Ivosevci / Burnum","Burnum","Ervenik","milites, praenomen et nomen, viri",44.0317,15.9936,1
"250",1246,469210,"EDCS-10101839","HD025909",42,69,"L(ucius) Bodlius L(uci) f(ilius) / Pol(lia) Genialis / Pollent(ia) mil(es) / leg(ionis) XI C(laudiae) p(iae) f(idelis) / |(centuria) Iuli Secundi / ann(orum) XXX stip(endiorum) X / h(eres) f(aciendum) c(uravit)","Lucius Bodlius Luci filius Pollia Genialis Pollentia miles legionis XI Claudiae piae fidelis centuria Iuli Secundi annorum XXX stipendiorum X heres faciendum curavit","epitaph","epitaph","stele","Dalmatia","Dalmatia","Ivosevci / Burnum","Burnum","Kistanje","milites, tria nomina, viri",44.0317,15.9936,1
"251",1247,469211,"EDCS-10101840","HD031659",42,69,"------?] / [--- S?]atr/[ius? - f(ilius)] Cam(ilia) Rufus / Ravenna miles / leg(ionis) XI C(laudiae) p(iae) f(idelis) / |(centuria) Fabrici Veri / ann(orum) XXXIII stip(endiorum) XV / t(estamento) f(ieri) i(ussit) / C(aius) Muscius Maternus / et / C(aius) Asuvius Crescens / her(edes) f(aciendum) c(uraverunt)","Satrius filius Camilia Rufus Ravenna miles legionis XI Claudiae piae fidelis centuria Fabrici Veri annorum XXXIII stipendiorum XV testamento fieri iussit Caius Muscius Maternus et Caius Asuvius Crescens heredes faciendum curaverunt","epitaph","epitaph","stele","Dalmatia","Dalmatia","Ivosevci / Burnum","Burnum","Kistanje","milites, tria nomina, viri",44.0317,15.9936,1
"252",1248,469212,"EDCS-10101842","HD035398",1,100,"------?] / [---]io P(ubli)(?) / [f(ilio) ---]sso do/[mo? --- s]ignif(er) / [---] stip(endiorum) XXIII / [---]ola / [---]o / [------","io Publi filio sso domo signifer stipendiorum XXIII ola o","epitaph","epitaph","stele","Dalmatia","Dalmatia","Ivosevci / Burnum","Burnum","Kistanje","milites, tria nomina, viri",44.0317,15.9936,1
"253",1249,469213,"EDCS-10101843","HD035401",31,70,"[S]ex(tus) Valeri[u]s Sex(ti) filius V&lt;o&gt;ltinia [L]uci[n]us(?) [V]ian(n)a(!) miles [l]eg(ionis) VIII Aug(ustae) |(centuria) Terent(i) Iuliani vixit an(n)is XXIX miles an(n)is [V?]IIII","Sextus Valerius Sexti filius V lt o gt ltinia Lucinus Vianna miles legionis VIII Augustae centuria Terenti Iuliani vixit annis XXIX miles annis VIIII","epitaph","epitaph","NULL","Dalmatia","Dalmatia","Ivosevci / Burnum","Burnum","Kistanje","milites, tria nomina, viri",44.0317,15.9936,1
"254",1250,469214,"EDCS-10101844","HD035402",1,100,"C(aius) Vatern(ius) / C(ai) f(ilius) Lem(onia) / Aprio Bon(onia) / stip&lt;e=F&gt;(ndiorum) XIX / h(eres) f(aciendum) c(uravit) ","Caius Vaternius Cai filius Lemonia Aprio Bononia stip lt e gt ndiorum XIX heres faciendum curavit","epitaph","epitaph","stele","Dalmatia","Dalmatia","Ivosevci / Burnum","Burnum","Kistanje","milites, tria nomina, viri",44.0317,15.9936,1
"255",1251,469215,"EDCS-10101845","HD025912",1,50,"Dacnas / Apsaei f(ilius) / mil(es) coh(ortis) II / Cyrrhestaru(m) / dom(o) Berea / ann(orum) L stip(endiorum) XXIV / h(ic) s(itus) e(st)","Dacnas Apsaei filius miles cohortis II Cyrrhestarum domo Berea annorum L stipendiorum XXIV hic situs est","epitaph","epitaph","stele","Dalmatia","Dalmatia","Ivosevci / Burnum","Burnum","Kistanje","milites, nomen singulare, viri",44.0317,15.9936,1
"256",1252,469216,"EDCS-59500043","HD072486",1,300,"I(ovi) O(ptimo) M(aximo) / M[---]G(?)[--]P / [-]EG[---] b(ene)f(iciarius) / co(n)s(ularis) v(otum) l(ibens) s(olvit)","Iovi Optimo Maximo M G P EG beneficiarius consularis votum libens solvit","votive inscription","votive inscription","altar","Dalmatia","Dalmatia","Ivosevci / Burnum","Burnum","Kistanje","milites, tria nomina, viri",44.0317,15.9936,1
"257",1262,469226,"EDCS-10000657","HD033902",151,300,"D(is) M(anibus) / I(uliae) Eulalae / [qu]ae e[t] Fi[r]ma / [------] / [be]ne mere[nti] / [---]ia p[osuit] / [------]","Dis Manibus Iuliae Eulalae quae et Firma bene merenti ia posuit","epitaph","epitaph","stele","Dalmatia","Dalmatia","Janjina / Peljesac / Sabbioncello / Narona","NULL","Janjina","mulieres, tria nomina",42.925148,17.4288843,1
