"","X","LIST.ID","EDCS.ID","EDH.ID","not_before","not_after","transcription","clean_text_interpretive_word","type_of_inscription_clean","type_of_inscription_auto","type_of_monument_clean","province","province_label_clean","place","findspot_ancient_clean","findspot_modern_clean","status_notation","Latitude","Longitude","count"
"594",4445,472613,"EDCS-31400711","HD001103",222,235,"------] / [---]I(?)I(?)AE[--] / [mi]l(iti) leg(ionis) I Italic(a)e / Severianae st[i]/pend(iorum) XX(?)III vixi[t] / an[nos --- Au]rel(ius) / Mar[ci]anus(?) / mil(es) leg(ionis) s(upra) s(criptae) con/tubernalis / b(ene) m(erenti) p(osuit)","IIAE militi legionis I Italicae Severianae stipendiorum XXIII vixit annos Aurelius Marcianus miles legionis supra scriptae contubernalis bene merenti posuit","epitaph","epitaph","stele","Dalmatia","Dalmatia","Solin / Salona","Salonae","Solin","milites, tria nomina, viri",43.5384,16.4743,1
"595",4446,472615,"EDCS-31400713","HD063889",151,300,"------]ius Lici[nianus?] / [---]i |(centuria) Serv[------ // ------] dulcis[sim---] / [---] XIIII et [------","ius Licinianus i centuria Serv dulcissim XIIII et","epitaph","epitaph","NULL","Dalmatia","Dalmatia","Solin / Salona","Salonae","Solin","milites, tria nomina, viri",43.5384,16.4743,1
"596",4447,472616,"EDCS-29900028","HD011253",1,300,"------] / [---] coh(ortis) VIII / vol(untariorum) / [---]mp(---) Firmi/[---?] c(oniugi) b(ene) m(erenti)","cohortis VIII voluntariorum mp Firmi coniugi bene merenti","epitaph","epitaph","tabula","Dalmatia","Dalmatia","Solin / Salona","Salonae","Solin","milites, mulieres, tria nomina, viri",43.5384,16.4743,1
"597",4448,472617,"EDCS-31400714","HD063890",1,100,"------] / Iuni[us] / [R]ufus d[om(o)] / [H]eracl[ea] / [v]et(eranus) leg(ionis) [---] / [c]uram eg[it ---] / vet(eranus) le[g(ionis) ------","Iunius Rufus domo Heraclea veteranus legionis curam egit veteranus legionis","epitaph","epitaph","NULL","Dalmatia","Dalmatia","Solin / Salona","Salonae","Solin","milites, tria nomina, viri",43.5384,16.4743,1
"598",4449,472618,"EDCS-31400715","HD063891",151,300,"------ Si]lvanus vet(e)ran(us) / [coh(ortis) VIII vo]lunt(ariorum) v(ivus) f(ecit) sibi et [---] / fratri d(efuncto) / [---]cae co(n)iug(i) m(e)ae v(ivae)","Silvanus veteranus cohortis VIII voluntariorum vivus fecit sibi et fratri defuncto cae coniugi meae vivae","epitaph","epitaph","NULL","Dalmatia","Dalmatia","Solin / Salona","Salonae","Solin","milites, mulieres, viri",43.5384,16.4743,1
"599",4450,472619,"EDCS-31400716","HD063892",151,300,"D(is) [M(anibus)] / Vict(?)[or---] / nepo[ti] / mil(iti) c[oh(ortis)] / III Al[p(inae) Se]/cund[ina?] / T&lt;e=F&gt;erti c[on]/tuber[na]/li b(ene) m(erenti) p(osuit) ","Dis Manibus Victor nepoti militi cohortis III Alpinae Secundina T lt e gt erti contubernali bene merenti posuit","epitaph","epitaph","NULL","Dalmatia","Dalmatia","Solin / Salona","Salonae","Solin","milites, viri",43.5384,16.4743,1
"600",4451,472620,"EDCS-31400718","HD063893",42,150,"------]IAN[---] / [--- leg(ionis)] XI Cl(audiae) [p(iae) f(idelis) ------","IAN legionis XI Claudiae piae fidelis","epitaph","epitaph","NULL","Dalmatia","Dalmatia","Solin / Salona","Salonae","Solin","milites, viri",43.5384,16.4743,1
"601",4452,472621,"EDCS-31400719","HD063894",1,150,"------ le]g(ionis) XXI[I ---] / [---] leg(ionis) X [---] / [---] et [------","legionis XXII legionis X et","epitaph","epitaph","NULL","Dalmatia","Dalmatia","Solin / Salona","Salonae","Solin","milites, viri",43.5384,16.4743,1
"602",4453,472622,"EDCS-31400720","HD063895",42,150,"------]OL[---] / [--- ve]ter(anus) leg(ionis) / [VII? Cl(audiae)?] p(iae) &lt;f=E&gt;(idelis) v(ivus) f(ecit) / [sibi et] suis ","OL veteranus legionis VII Claudiae piae lt f gt idelis vivus fecit sibi et suis","epitaph","epitaph","NULL","Dalmatia","Dalmatia","Solin / Salona","Salonae","Solin","milites, viri",43.5384,16.4743,1
"603",4454,472623,"EDCS-31400721","HD063897",1,300,"[D(is)] M(anibus) / [---]ING vet(erano) [------","Dis Manibus ING veterano","epitaph","epitaph","NULL","Dalmatia","Dalmatia","Solin / Salona","Salonae","Solin","milites, viri",43.5384,16.4743,1
"604",4455,472624,"EDCS-31400722","HD063898",1,300,"------ vet]eran[us] / [--- eq]ues a[lae? ---] / [---]nio [------","veteranus eques alae nio","epitaph","epitaph","NULL","Dalmatia","Dalmatia","Solin / Salona","Salonae","Solin","milites, viri",43.5384,16.4743,1
"605",4456,472625,"EDCS-31400723","HD063899",1,300,"------]EIO[---] / [---] coh(ortis) [------","EIO cohortis","epitaph","epitaph","NULL","Dalmatia","Dalmatia","Solin / Salona","Salonae","Solin","milites, viri",43.5384,16.4743,1
"606",4457,472626,"EDCS-31400724","HD063900",1,300,"------ ar?]mill(is?) a[b imperatore? ------","armillis ab imperatore","epitaph","epitaph","NULL","Dalmatia","Dalmatia","Solin / Salona","Salonae","Solin","milites, viri",43.5384,16.4743,1
"607",4464,472633,"EDCS-31400731","HD063907",1,300,"------] dec[urio? ------","decurio","epitaph","epitaph","NULL","Dalmatia","Dalmatia","Solin / Salona","Salonae","Solin","milites, ordo decurionum",43.5384,16.4743,1
"608",4678,472872,"EDCS-31900042","HD064102",151,300,"D(is) [M(anibus)] / Aurel(ius) Mi[---] / vet(eranus) leg(ionis) V [Mace]/donica[e qui] / vixit [annos ------","Dis Manibus Aurelius Mi veteranus legionis V Macedonicae qui vixit annos","epitaph","epitaph","tabula","Dalmatia","Dalmatia","Solin / Salona","Salonae","Solin","milites, tria nomina, viri",43.5384,16.4743,1
"609",4679,472873,"EDCS-31900043","HD064103",71,250,"------] leg(io---?) I Ita[lic(a-?) ------","legio I Italica","NULL",NA,"NULL","Dalmatia","Dalmatia","Solin / Salona","Salonae","Solin","milites",43.5384,16.4743,1
"610",4733,472928,"EDCS-30100676","HD025720",151,300,"[---]elius Eu[---] / [--- e]x coll(egio) fa[brum ---] / [---] Antonia [---] / [---] vivi sibi [---] / [--- lo]cus conc[essus ab] / [--- I]ulia Ma[---]","elius Eu ex collegio fabrum Antonia vivi sibi locus concessus ab Iulia Ma","epitaph","epitaph","sarcophagus","Dalmatia","Dalmatia","Solin / Salona","Salonae","Solin","mulieres, officium/professio, tria nomina, viri",43.5384,16.4743,1
"611",4745,472940,"EDCS-32201064","HD062038",1,300,"M(arc--) Corn[eli--] / Prisci[---?] / c(o)ho(r---) P[------","Marc Corneli Prisci cohor P","epitaph","epitaph","stele","Dalmatia","Dalmatia","Solin / Salona","Salonae","Solin","tria nomina, viri",43.5384,16.4743,1
"612",4746,472941,"EDCS-32201065","HD062036",301,400,"Fl(avius) Serenus ex primi[cerio] / [---] vix(it) ann(os) X[------","Flavius Serenus ex primicerio vixit annos X","epitaph","epitaph","sarcophagus","Dalmatia","Dalmatia","Solin / Salona","Salonae","Solin","milites, tria nomina, viri",43.5384,16.4743,1
"613",4747,472942,"EDCS-30100681","HD022808",1,100,"Q(uintus) Vettiu[s] / Hospes mil[es] / cohortis Camp(anorum) / domo Suessa / annorum XLV / stipendiorum / XXII testamen[to] / iussit fieri","Quintus Vettius Hospes miles cohortis Campanorum domo Suessa annorum XLV stipendiorum XXII testamento iussit fieri","epitaph","epitaph","tabula","Dalmatia","Dalmatia","Solin / Salona","Salonae","Solin","milites, tria nomina, viri",43.5384,16.4743,1
"614",4748,472943,"EDCS-32201067","HD062028",1,100,"------ l]eg(io) VII [Cl(audia)? p(ia)? f(idelis)?] / [---]ia leg(io) [------","legio VII Claudia pia fidelis ia legio","building/dedicatory inscription","building/dedicatory inscription","NULL","Dalmatia","Dalmatia","Solin / Salona","Salonae","Solin","milites, viri",43.5384,16.4743,1
"615",4749,472944,"EDCS-32201068","HD062026",151,300,"------] coh(ortis) [---] / [--- ex p]editibus(?) [---] / [---] d(e)f(uncto) ann(orum) [---] / [--- s]tip(endiorum) XIIII [---] / [--- Am]and(us)(?) fil(i--) [------","cohortis ex peditibus defuncto annorum stipendiorum XIIII Amandus fili","epitaph","epitaph","stele","Dalmatia","Dalmatia","Solin / Salona","Salonae","Solin","milites, viri",43.5384,16.4743,1
"616",4750,472945,"EDCS-32201069","HD062025",151,300,"------]A [---] / [--- si]ng(ularis?) c[oh(ortis?) ---] / [--- v]ixit [---] / [---]NCA[------","A singularis cohortis vixit NCA","epitaph","epitaph","NULL","Dalmatia","Dalmatia","Solin / Salona","Salonae","Solin","milites, viri",43.5384,16.4743,1
"617",4751,472946,"EDCS-32201070","HD062024",1,300,"------ im]m(unis?) c(o)h[ortis? ---] / [---]a h(eres) p(ro) p(ietate) f(ecit) [---?] / [---]a R(---?) et / [------","immunis cohortis a heres pro pietate fecit a R et","epitaph","epitaph","sarcophagus","Dalmatia","Dalmatia","Solin / Salona","Salonae","Solin","milites, viri",43.5384,16.4743,1
"618",4753,472948,"EDCS-32201072","HD062021",51,300,"------ domo? Claudia?] / Vir[uno? vetera?]/nus [leg(ionis) --- sibi] / et Elp[idiae ------","domo Claudia Viruno veteranus legionis sibi et Elpidiae","epitaph","epitaph","NULL","Dalmatia","Dalmatia","Solin / Salona","Salonae","Solin","milites, viri",43.5384,16.4743,1
"619",4789,472984,"EDCS-32201108","HD061726",151,300,"------]istus Gala/ticus mari&lt;t=I&gt;us / uxori dulcissimae ","istus Galaticus mari lt t gt us uxori dulcissimae","epitaph","epitaph","stele","Dalmatia","Dalmatia","Solin / Salona","Salonae","Solin","mulieres, tria nomina, viri",43.5384,16.4743,1
"620",4868,473076,"EDCS-30200398","HD056729",131,200,"D(is) M(anibus) / C(aio) Aelio Censorin(o) / optioni cl(assis) pr(aetoriae) Ra(vennatis) / natione Panno(nico) / vix(it) an(nos) XLI / militav(it) an(nos) XXI / [------","Dis Manibus Caio Aelio Censorino optioni classis praetoriae Ravennatis natione Pannonico vixit annos XLI militavit annos XXI","epitaph","epitaph","stele","Dalmatia","Dalmatia","Solin / Salona","Salonae","Klis","milites, tria nomina, viri",43.5384,16.4743,1
"621",4869,473077,"EDCS-32700255","HD051051",185,300,"------] / [---] Aureli[us ---] / [---]s duplic[arius] / [le]g(ionis) VIII p(iae) f(idelis) [---] / [------","Aurelius s duplicarius legionis VIII piae fidelis","epitaph","epitaph","NULL","Dalmatia","Dalmatia","Solin / Salona","Salonae","Solin","milites, viri",43.5384,16.4743,1
"622",4870,473078,"EDCS-32700256","HD061558",151,300,"------]cato [---] / [---] coh(ortis) I A[lpinorum?] / [---] sing(ularis) c[o(n)s(ularis) ---] / [---] Aur(elius) M[------","cato cohortis I Alpinorum singularis consularis Aurelius M","epitaph","epitaph","stele","Dalmatia","Dalmatia","Solin / Salona","Salonae","Solin","milites, tria nomina, viri",43.5384,16.4743,1
"623",4871,473079,"EDCS-32700258","HD061556",151,300,"D(is) [M(anibus)] // Licinio [--- mil(iti)] / coh(ortis) I[---] / an(norum) XX[---] / def(uncto) L[--- testa]/ment(o) f[ieri iussit]","Dis Manibus Licinio militi cohortis I annorum XX defuncto L testamento fieri iussit","epitaph","epitaph","stele","Dalmatia","Dalmatia","Solin / Salona","Salonae","Solin","milites, viri",43.5384,16.4743,1
"624",4872,473080,"EDCS-32700259","HD061555",151,300,"------]inio [---] / [---]timo qu[i vix(it)] / [a]n(nos) XXVII Max[imi]/nus vet(eranus) pate[r] / [f]ilio pientiss(imo) t(itulum) [f(ecit)]","inio timo qui vixit annos XXVII Maximinus veteranus pater filio pientissimo titulum fecit","epitaph","epitaph","NULL","Dalmatia","Dalmatia","Solin / Salona","Salonae","Klis","milites, nomen singulare, tria nomina, viri",43.5384,16.4743,1
"625",4873,473081,"EDCS-32700260","HD061554",1,300,"------] / mili[tavit in] / c(o)ho[rte ---] / [---]omn[---] / [---? |(centuria)?] Met[elli? ------","militavit in cohorte omn centuria Metelli","epitaph","epitaph","tabula","Dalmatia","Dalmatia","Solin / Salona","Salonae","Solin","milites",43.5384,16.4743,1
"626",4874,473082,"EDCS-32700261","HD061553",151,300,"[D(is)] M(anibus) / [-? P]ompeio / [Fro]ntiniano / [mil(iti) co]h(ortis) III Alp(inorum) [------?","Dis Manibus Pompeio Frontiniano militi cohortis III Alpinorum","epitaph","epitaph","NULL","Dalmatia","Dalmatia","Solin / Salona","Salonae","Solin","milites, tria nomina, viri",43.5384,16.4743,1
"627",4875,473083,"EDCS-32700262","HD061552",1,50,"------] Pom(peius) Titullus eq(ues) / [---? do]mo Dertona t(estamento) f(ieri) iussit / [---]ae Secundae uxoris / Cordiae C[---]/ae uxor[i ---] / Secun[d------","Pompeius Titullus eques domo Dertona testamento fieri iussit ae Secundae uxoris Cordiae C ae uxori Secund","epitaph","epitaph","NULL","Dalmatia","Dalmatia","Solin / Salona","Salonae","Solin","milites, mulieres, tria nomina, viri",43.5384,16.4743,1
"628",4876,473084,"EDCS-32700263","HD061551",42,100,"------] T(iti) f(ilius) Q[uir(ina)? ---] / [mil(es) leg(ionis)] VII C(laudiae) p(iae) [f(idelis)] / [---] Respe[ct---] / [--- A]basca[nt--- ------?","Titi filius Quirina miles legionis VII Claudiae piae fidelis Respect Abascant","epitaph","epitaph","stele","Dalmatia","Dalmatia","Solin / Salona","Salonae","Solin","milites, viri",43.5384,16.4743,1
"629",4877,473085,"EDCS-32700264","HD061550",151,300,"D(is) M(anibus) / Surus Vic/toris mil(es) / coh(ortis) I mil(iariae) / Aurel(iae) Teren/tiae hospi/tae ann(orum) XXXVII be/ne merenti po/sui(t) titulum","Dis Manibus Surus Victoris miles cohortis I miliariae Aureliae Terentiae hospitae annorum XXXVII bene merenti posuit titulum","epitaph","epitaph","stele","Dalmatia","Dalmatia","Solin / Salona","Salonae","Klis","milites, mulieres, nomen singulare, tria nomina, viri",43.5384,16.4743,1
"630",4878,473086,"EDCS-32700265","HD061539",151,300,"D(is) M(anibus) [s(acrum)] / Valerius As[iati]/cus(?) sagittar[ius qui] / v(ixit) an(nos) XXXV m(enses) II[---] / Valerius Va[lens] / f&lt;e=I&gt;cit mem[or(iam) fil(io)?] / suo infa[nti?] / &lt;e=F&gt;(t) denari[um quin]/que mili[bus fecit] // RB ","Dis Manibus sacrum Valerius Asiaticus sagittarius qui vixit annos XXXV menses II Valerius Valens f lt e gt cit memoriam filio suo infanti lt e gt t denarium quin que milibus fecit RB","epitaph","epitaph","tabula","Dalmatia","Dalmatia","Solin / Salona","Salonae","Solin","milites, tria nomina, viri",43.5384,16.4743,1
"631",4879,473087,"EDCS-32700266","HD055082",151,300,"D(is) M(anibus) [s(acrum)] / L(ucio) Vettio Pro[bo] / b(ene)f(iciario) co(n)s(ularis) leg(ionis) XI / Cl(audiae) p(iae) f(idelis) L(ucius) Vettius / Gratus et Vetti(a) / Ianuaria patri / b(ene) m(erenti) [p(osuerunt)]","Dis Manibus sacrum Lucio Vettio Probo beneficiario consularis legionis XI Claudiae piae fidelis Lucius Vettius Gratus et Vettia Ianuaria patri bene merenti posuerunt","epitaph","epitaph","stele","Dalmatia","Dalmatia","Solin / Salona","Salonae","Klis","milites, mulieres, tria nomina, viri",43.5384,16.4743,1
"632",4882,473091,"EDCS-32700270","HD061534",1,50,"------] Tro[m(entina) ---] / [--- trib(uno)] mil(itum) bis l[eg(ionis) ------ // ------ Caes]are [---] / [---]P[------","Tromentina tribuno militum bis legionis Caesare P","epitaph","epitaph","NULL","Dalmatia","Dalmatia","Solin / Salona","Salonae","Solin","milites, ordo equester, ordo senatorius, viri",43.5384,16.4743,1
"633",4883,473092,"EDCS-32700271","HD061533",1,150,"------]S / [--- leg(ionis)?] VII |(centuria)(?) [------","S legionis VII centuria","epitaph","epitaph","NULL","Dalmatia","Dalmatia","Solin / Salona","Salonae","Solin","milites, viri",43.5384,16.4743,1
"634",4884,473093,"EDCS-32700272","HD061532",1,300,"------] eq[uiti? ---] / [---] ann(orum) X[------","equiti annorum X","epitaph","epitaph","NULL","Dalmatia","Dalmatia","Solin / Salona","Salonae","Solin","milites, ordo equester, viri",43.5384,16.4743,1
"635",4885,473094,"EDCS-32700273","HD061522",1,300,"------] / CO[---] / mil(es?) [------","CO miles","epitaph","epitaph","NULL","Dalmatia","Dalmatia","Solin / Salona","Salonae","Solin","milites, viri",43.5384,16.4743,1
"636",4887,473096,"EDCS-31300306","HD031866",25,54,"L(ucio) Anicio L(uci) f(ilio) / Paetinati / IIIIvir(o) iure dic(undo) / quinquennal(i) prae(fecto) / quinq(uennali) Drusi Caesar(is) / Germanici praefec(to) / quinq(uennali) P(ubli) Dolabellae / pontifici flamini / Iuliae Augustae praef(ecto) / fabr(um) / praefectur(a) Phariac(a) / Salonitan(a)","Lucio Anicio Luci filio Paetinati IIII viro iure dicundo quinquennali praefecto quinquennali Drusi Caesaris Germanici praefecto quinquennali Publi Dolabellae pontifici flamini Iuliae Augustae praefecto fabrum praefectura Phariaca Salonitana","honorific inscription","honorific inscription","statue base","Dalmatia","Dalmatia","Solin / Salona","Salonae","Solin","Augusti/Augustae, milites, mulieres, ordo decurionum, ordo equester, ordo senatorius, sacerdotes pagani, tria nomina, viri",43.5384,16.4743,1
"637",4888,473097,"EDCS-32700275","HD031869",1,50,"L(ucio) Anicio C(ai) f(ilio) / Paetinati / IIIIvir(o) i(ure) d(icundo) prae(fecto) / fabr(um) IIIIvir(o) i(ure) d(icundo) / quinq(uennali) d(ecurionum) d(ecreto) / publice / bene merito","Lucio Anicio Cai filio Paetinati IIII viro iure dicundo praefecto fabrum IIII viro iure dicundo quinquennali decurionum decreto publice bene merito","honorific inscription","honorific inscription","statue base","Dalmatia","Dalmatia","Solin / Salona","Salonae","Solin","milites, ordo decurionum, ordo equester, tria nomina, viri",43.5384,16.4743,1
"638",4899,473108,"EDCS-32700286","HD061511",151,300,"------] / ann(os) p(lus) m(inus) [---] / et Iulio [Feli?]ci qui vi[x(it) ann(os)] / p(lus) m(inus) XXV &lt;c=G&gt;o[ll(egio) Mer]//[c]uri [et] Ven(eris) T[------ ","annos plus minus et Iulio Felici qui vixit annos plus minus XXV lt c gt ollegio Mercuri et Veneris T","epitaph","epitaph","NULL","Dalmatia","Dalmatia","Solin / Salona","Salonae","Solin","sacerdotes pagani, tria nomina, viri",43.5384,16.4743,1
"639",4920,473129,"EDCS-32700305","HD061431",151,300,"------ a(nnos) ---?] / [m(enses)] XI d(ies) VIII / [---] T(itus) Au(relius) Apa/[la]ustus / et Vi&lt;b=V&gt;(ia) Restu/[ta] parente[s] / [fili]ae in[f(elicissimae)] / [------? ","annos menses XI dies VIII Titus Aurelius Apalaustus et Vi lt b gt ia Restuta parentes filiae infelicissimae","epitaph","epitaph","NULL","Dalmatia","Dalmatia","Solin / Salona","Salonae","Solin","mulieres, tria nomina, viri",43.5384,16.4743,1
"640",4943,473152,"EDCS-32700325","HD061412",151,300,"[--- infeli]cissimo / [--- Cel]eri primo / [pilao? ---?] vixit mec(um) / [ann]is XXV fili[o ---] / [---]MIII pater / [---]IIFF FIPI / [------?","infelicissimo Celeri primo pilao vixit mecum annis XXV filio MIII pater IIFF FIPI","epitaph","epitaph","NULL","Dalmatia","Dalmatia","Solin / Salona","Salonae","Solin","milites, viri",43.5384,16.4743,1
"641",4984,473194,"EDCS-32700365","HD052771",151,300,"Iuliae Pa/laestrice / annor(um) V / Eleut[h]eris / m(ater) [------?","Iuliae Palaestrice annorum V Eleutheris mater","epitaph","epitaph","altar","Dalmatia","Dalmatia","Solin / Salona","Salonae","Kaštela","mulieres, tria nomina",43.5384,16.4743,1
"642",5007,473217,"EDCS-32700389","HD061099",151,300,"D(is) M(anibus) / Pardalae ann(orum) / XIII m(ensium) V / Fl(avius) verna et / Domitia Primiti(v)/a parentes / p(osuerunt)","Dis Manibus Pardalae annorum XIII mensium V Flavius verna et Domitia Primitiva parentes posuerunt","epitaph","epitaph","stele","Dalmatia","Dalmatia","Solin / Salona","Salonae","Solin","mulieres, nomen singulare, tria nomina, viri",43.5384,16.4743,1
"643",5100,473333,"EDCS-12300242","HD075700",94,94,"Imp(erator) Caesar divi Vespasiani f(ilius) Domitia/nus Augustus Germanicus pontifex maxi/mus tribunic(ia) potestat(e) XII imp(erator) XXII / censor perpetuus co(n)s(ul) XVI pater patriae / peditibus et equitibus qui militant in coho(r)/te III Alpinorum et in VIII Voluntariorum / civium Romanorum qui peregrinae condicio/nis probati erant et sunt in D&lt;a=E&gt;lmatia sub Q(uinto) Pom/ponio Rufo qui quina et vicena stipendia / aut plura meruerunt item dimisso ho/nesta missione emeritis stipendiis / quorum nomina subscripta sunt ipsis / liberis posterisque eorum civitatem // dedit et conubium cum uxoribus / quas tunc habuissent cum est civi/tas iis data aut si qui caelibes essent cum / iis quas postea duxissent dumtaxat / singuli singulas a(nte) d(iem) III Idus Iulias / M(arco) Lollio Paullino Valerio Asiatico Saturnino / C(aio) Antio Iulio Quadrato co(n)s(ulibus) / cohort(is) III Alpinorum cui prae(e)st / C(aius) Vibius Maximus / pediti / Veneto Diti f(ilio) Davers(o) / et Madenae Plarentis filiae uxori eius Deramist(ae) / et Gaio f(ilio) eius / descriptum et recognitum ex tabula / aenea quae fixa est Romae // Imp(erator) Caesar divi Vespasiani f(ilius) Domitia/nus Augustus Germanicus pontifex ma/ximus tribunic(ia) potestat(e) XII imp(erator) XXII co(n)s(ul) XVI / censor perpetuus pater patriae / peditibus et equitibus qui militant in co/horte III Alpinorum et in VIII Volun/tariorum civium Romanorum qui / peregrinae condicionis probati erant / et sunt in D&lt;a=E&gt;lmatia sub Q(uinto) Pomponio / Rufo qui quina et vicena stipendia / aut plura meruerunt item dimisso / honesta missione emeritis stipen/diis quorum nomina subscripta / sunt ipsis liberis posterisque eorum / civitatem dedit et conubium cum / uxoribus quas tunc habuissent / cum est civitas iis data aut si qui caeli/bes essent cum iis quas postea duxis/sent dumtaxat singuli singulas / a(nte) d(iem) III Idus Iulias / M(arco) Lollio Paul(l)ino Valerio Asiatico Saturnino / C(aio) Antio Iulio Quadrato co(n)s(ulibus) / cohort(is) III Alpinorum cui prae(e)st / C(aius) Vibius Maximus / pediti / Veneto Diti f(ilio) Davers(o) / et Madenae Plarentis filiae uxori eius Deramist(ae) / et Gaio f(ilio) eius / descriptum et recognitum ex tabula / aenea quae fixa est Romae in muro / post templum divi Aug(usti) ad Minervam // A(uli) Volumni Expectati / Q(uinti) Orfi Cupiti / Cn(aei) Egnati Vitalis / Sex(ti) Manli Cinnami / L(uci) Pulli Sperati / P(ubli) Atini Amermni / L(uci) Pulli Verecundi ","Imperator Caesar divi Vespasiani filius Domitianus Augustus Germanicus pontifex maximus tribunicia potestate XII imperator XXII censor perpetuus consul XVI pater patriae peditibus et equitibus qui militant in cohorte III Alpinorum et in VIII Voluntariorum civium Romanorum qui peregrinae condicionis probati erant et sunt in D lt a gt lmatia sub Quinto Pomponio Rufo qui quina et vicena stipendia aut plura meruerunt item dimisso honesta missione emeritis stipendiis quorum nomina subscripta sunt ipsis liberis posteris que eorum civitatem dedit et conubium cum uxoribus quas tunc habuissent cum est civitas iis data aut si qui caelibes essent cum iis quas postea duxissent dumtaxat singuli singulas ante diem III Idus Iulias Marco Lollio Paullino Valerio Asiatico Saturnino Caio Antio Iulio Quadrato consulibus cohortis III Alpinorum cui praeest Caius Vibius Maximus pediti Veneto Diti filio Daverso et Madenae Plarentis filiae uxori eius Deramistae et Gaio filio eius descriptum et recognitum ex tabula aenea quae fixa est Romae Imperator Caesar divi Vespasiani filius Domitianus Augustus Germanicus pontifex maximus tribunicia potestate XII imperator XXII consul XVI censor perpetuus pater patriae peditibus et equitibus qui militant in cohorte III Alpinorum et in VIII Voluntariorum civium Romanorum qui peregrinae condicionis probati erant et sunt in D lt a gt lmatia sub Quinto Pomponio Rufo qui quina et vicena stipendia aut plura meruerunt item dimisso honesta missione emeritis stipendiis quorum nomina subscripta sunt ipsis liberis posteris que eorum civitatem dedit et conubium cum uxoribus quas tunc habuissent cum est civitas iis data aut si qui caelibes essent cum iis quas postea duxissent dumtaxat singuli singulas ante diem III Idus Iulias Marco Lollio Paullino Valerio Asiatico Saturnino Caio Antio Iulio Quadrato consulibus cohortis III Alpinorum cui praeest Caius Vibius Maximus pediti Veneto Diti filio Daverso et Madenae Plarentis filiae uxori eius Deramistae et Gaio filio eius descriptum et recognitum ex tabula aenea quae fixa est Romae in muro post templum divi Augusti ad Minervam Auli Volumni Expectati Quinti Orfi Cupiti Cnaei Egnati Vitalis Sexti Manli Cinnami Luci Pulli Sperati Publi Atini Amermni Luci Pulli Verecundi","military diploma","military diploma","tabula","Dalmatia","Dalmatia","Solin / Salona","Salonae","Solin","Augusti/Augustae, nomen singulare, ordo equester, ordo senatorius, tria nomina, viri",43.5384,16.4743,1
"644",5110,473350,"EDCS-10000226","HD018019",313,324,"Aur(elio) Valerino excepto/ri Impp(eratorum) in officio memo/ri(a)e qui aput(!) civitatem / Nicomediensium fat/i munus complevit / vixsit(!) annis XXXII et [[VI]] / me(n)s(ibus) Aur(elius) Leontius vir / docen(arius)(!) et dec(urio) col(oniae) Salon(itanorum) / ex curatoribus eiusd/em civitatis filio dulc/issimo adque(!) obsequ/entissimo pater infeli/x qui quod primo mihi / hoc facere debuerat e/go feci","Aurelio Valerino exceptori Impperatorum in officio memoriae qui aput civitatem Nicomediensium fati munus complevit vixsit annis XXXII et VI mensibus Aurelius Leontius vir docenarius et decurio coloniae Salonitanorum ex curatoribus eiusdem civitatis filio dulcissimo ad que obsequentissimo pater infelix qui quod primo mihi hoc facere debuerat ego feci","epitaph","epitaph","stele","Dalmatia","Dalmatia","Solin / Salona","Salonae","Solin","milites, ordo decurionum, ordo equester, tria nomina, viri",43.5384,16.4743,1
"645",5128,473369,"EDCS-10000691","HD034119",201,300,"T(ito) Fl(avio) Herennio / Iasoni eq(uiti) R(omano) dec(urioni) / col(oniae) Sal(onitanae) pont(ifici) / aed(ili) praef(ecto) coll(egii) / fab(rum) et cent(onariorum) fil(io) / Herenni Iaso/nis v(iri) e(gregii) patroni / col(oniae) Sal(onitanae) ob amore(m) / patriae quem ob / merita sua conse/cutus est et erga / honorificentiam / quam civibus exhi/bet coll(egium) s(upra) s(criptum)","Tito Flavio Herennio Iasoni equiti Romano decurioni coloniae Salonitanae pontifici aedili praefecto collegii fabrum et centonariorum filio Herenni Iasonis viri egregii patroni coloniae Salonitanae ob amorem patriae quem ob merita sua consecutus est et erga honorificentiam quam civibus exhibet collegium supra scriptum","honorific inscription","honorific inscription","statue base","Dalmatia","Dalmatia","Solin / Salona","Salonae","Solin","ordo decurionum, ordo equester, sacerdotes pagani, tria nomina, viri",43.5384,16.4743,1
